ArticyId	TermType	ConvTitle	Actor	En	Zh
0x0100000F0000A67A	Dialogue Text	APT / STUDENT COMMUNIST	Kim Kitsuragi	"Speaking as an officer of the RCM, it is an *extremely* bad idea to strike a civilian without cause..."	“作为RCM的警官，无缘无故攻击平民是一个*非常*糟糕的主意……”
0x0100000F0000A67F	Dialogue Text	APT / STUDENT COMMUNIST	Kim Kitsuragi	"Speaking frankly, it's a terrible idea. The RCM already has issues with *wanton brutality* and this is unlikely to ameliorate those concerns..."	“老实说，这是个坏主意。RCM本就因*滥用暴力*而恶名远扬，而这个举动想必不会对我们的名声有什么帮助……”
0x0100000F0000A688	Dialogue Text	APT / STUDENT COMMUNIST	Kim Kitsuragi	"However, if one were to strike a civilian, which again I would never recommend, one should at least follow the RCM manual's guidance on non-lethal strikes."	“但是，如果警官真的要攻击平民——虽然我永远不会支持这种举动——他们至少应当遵守RCM手册对非致命攻击手段的指导意见。”
0x0100000F0000A68F	Dialogue Text	APT / STUDENT COMMUNIST	You	"What does the manual say?"	“手册怎么说？”
0x0100000F0000A694	Dialogue Text	APT / STUDENT COMMUNIST	You	"I don't need a book to tell me how to deck a guy."	“我用不着一本书来教我怎么打人。”
0x0100000F0000A69D	Dialogue Text	APT / STUDENT COMMUNIST	Kim Kitsuragi	"It advises officers in physical altercations to rely on the open-palm strike, as opposed to the backhand, in non-lethal situations."	“手册建议警官在发生冲突时，使用手掌而非手背进行攻击，以避免致命伤害。”
0x0100000F0000A6A3	Dialogue Text	APT / STUDENT COMMUNIST	Kim Kitsuragi	"You see, that attitude is precisely why the field manual's guidance is so valuable..."	“你瞧，这种态度就是为什么手册的指导意见对现场调查来说这么重要……”
0x0100000F0000A6AC	Dialogue Text	APT / STUDENT COMMUNIST	Kim Kitsuragi	"I can't recall the exact explanation, but it has something to do with the kinetic energy stored in the elbow. Basically, you're less able to control a *backhanded* slap, and therefore more likely to cause serious injury."	“我记不清具体的解释了，但是这和肘部运动的动能有关。简单来说，你会更不能控制一个*反手的*耳光，也就因此更容易造成严重伤害。”
0x0100000F0000A6B9	Dialogue Text	APT / STUDENT COMMUNIST	Kim Kitsuragi	"Or even death, if, say, you happen to be wearing a set of armoured ceramic gauntlets."	“在某些情况下，比如说你刚好戴着一双陶瓷装甲手套，那甚至可能造成死亡。”
0x0100000F0000A6BE	Dialogue Text	APT / STUDENT COMMUNIST	Kim Kitsuragi	"At the same time, this is emphatically *your thing*, so do as you will."	“不过，这总归是*你的事*，所以请自行选择。”
0x0100000F0000A6C9	Dialogue Text	APT / STUDENT COMMUNIST	Steban, the Student Communist	"Well, gendarme? What are we waiting for?"	“来吧，警官？你在等什么？”
0x0100000F0000A6D5	Dialogue Text	APT / STUDENT COMMUNIST	Kim Kitsuragi	"There's no *what if*, because I won't. This is your thing, remember?"	“没有什么*要不*，因为我不会这么做。这是你的事，记得吗？”
0x0100000F0000A703	Dialogue Text	APT / STUDENT COMMUNIST	Physical Instrument	As with all applications of violence, the key is the appropriate amount of force exercised with absolute control on the part of the wielder.	和其他任何暴力手段一样，关键在于何时的力度，以及对施力部位的绝对控制……
0x0100000F0000A708	Dialogue Text	APT / STUDENT COMMUNIST	Physical Instrument	If you were trying this against an actual opponent, it would be a meagre, embarrassing effort.	面对一个真正的对手时，这样的小心翼翼会成为一个笑话。
0x0100000F0000A713	Dialogue Text	APT / STUDENT COMMUNIST	Logic	Fortunately, you're trying *not* to cause any real damage.	但幸运的是，当下你的目标就是*不*造成任何真正的损伤。
0x0100000F0000A735	Dialogue Text	APT / STUDENT COMMUNIST	Interfacing	Ensconced in your ceramic armour, you barely notice the moment of contact. Striking the young man's face is almost indistinguishable from swatting away a fly.	在陶瓷盔甲的保护下，你几乎没有任何感觉。打击年轻人的脸颊，给你的触感就和挥走一只苍蝇差不多。
0x0100000F0000A73A	Dialogue Text	APT / STUDENT COMMUNIST	Interfacing	At the moment of contact you feel the pads of your bare fingers brush the wiry hairs of the young man's beard, as though caressing a wad of kitchen wool.	接触的一瞬间，你感到自己的指肚划过年轻人蜷曲的胡须，触感如同抚摸一块地毯。
0x0100000F0000A73F	Dialogue Text	APT / STUDENT COMMUNIST	Interfacing	The actual moment of contact is ever-so-slightly disappointing, as the feeling is dulled by the yellow latex shell that contains your hand.	真正接触时，你的指尖触感被包裹双手的黄色橡胶手套所阻隔，这个瞬间短暂得令你失望。
0x0100000F0000A744	Dialogue Text	APT / STUDENT COMMUNIST	Interfacing	At the moment of contact you feel the wool of your fingerless gloves entangling with the wiry hairs of the young man's beard. His eyes are wide as a pair of old silver coins.	接触的一瞬间，你感到无指手套的羊绒材质钩住了年轻人蜷曲的胡须。他双眼圆睁，仿佛两枚古旧的银币。
0x0100000F0000A749	Dialogue Text	APT / STUDENT COMMUNIST	Interfacing	At the moment of contact the high-performance gripping that covers the palm of your glove causes your hand to *stick* for an instant against the young man's cheek. As your hand pulls away, his pale skin appears momentarily to follow with it.	接触的一瞬间，你的高性能手套的掌心布料，令你的手掌在年轻人的脸颊上*停留*了一刹那。在你收手的时候，他苍白的皮肤似乎还被你的手掌带动。
0x0100000F0000A758	Dialogue Text	APT / STUDENT COMMUNIST	Steban, the Student Communist	The young man staggers back into the couch, eyes agog and momentarily dazed, but not seriously hurt.	年轻人踉跄着后退一步，倒进了沙发，傻乎乎地瞪着眼，但并没有受到重伤。
0x0100000F0000A76D	Dialogue Text	APT / STUDENT COMMUNIST	Kim Kitsuragi	"Not the best look for the RCM, but I suppose it could've gone worse."	“这对RCM的形象可没有什么好处，不过我想已经优于许多更加糟糕的状况了。”
0x0100000F0000A772	Dialogue Text	APT / STUDENT COMMUNIST	Echo Maker	"Steban? Are you alright?"	“史蒂文？你还好吗？”
0x0100000F0000A77C	Dialogue Text	APT / STUDENT COMMUNIST	You	"Who's the baddest communist now?"	“现在，谁才是最厉害的康米主义者？”
0x0100000F0000A781	Dialogue Text	APT / STUDENT COMMUNIST	You	"You need this?" (Offer him Kim's handkerchief.)	“你需要这个吗？”（把金的手帕递给他。）
0x0100000F0000A786	Dialogue Text	APT / STUDENT COMMUNIST	You	Say nothing.	什么也不说。
0x0100000F0000A78E	Dialogue Text	APT / STUDENT COMMUNIST	Steban, the Student Communist	"That... was *amazing*. Uli, perhaps we should tangle with the gendarmerie more often." The young man rubs his cheek.	“这……*棒*极了。尤利，也许我们应该多和这位警官吵吵嘴。”年轻人揉揉脸颊。
0x0100000F0000A794	Dialogue Text	APT / STUDENT COMMUNIST	Steban, the Student Communist	"No, keep it. I feel... *great*, actually..." He turns to his companion. "Perhaps we should tangle with the gendarmerie more often."	“不用，没事。我感觉……*非常好*，真的……”他转向同伴。“也许我们应该多和这位警官吵吵嘴。”
0x0100000F0000A799	Dialogue Text	APT / STUDENT COMMUNIST	Steban, the Student Communist	"I'm fine. Better than fine, actually." The young man rubs his cheek. "Perhaps we should tangle with the gendarmerie more often."	“我没事。好吧，其实是很好。”年轻人揉揉脸颊。“也许我们应该多和这位警官吵吵嘴。”
0x0100000F0000A7A6	Dialogue Text	APT / STUDENT COMMUNIST	Pain Threshold	It doesn't hurt, yet. The rush of endorphins will keep the pain at bay for a while yet.	痛感还没起来呢。迅速分泌的内啡肽会为他抑制住疼痛，但那不会持续很久。
0x0100000F0000A7AB	Dialogue Text	APT / STUDENT COMMUNIST	Composure	He isn't bluffing. He appears invigorated, as though he's truly experiencing life for the first time.	他没有装模作样。那兴高采烈的样子，仿佛他第一次真正体验人生。
0x0100000F0000A7B0	Dialogue Text	APT / STUDENT COMMUNIST	Authority	You've earned his respect. See how you've *marked* him?	你赢得了他的尊重。看看你是怎么*标记*了他的？
0x0100000F0000A7BB	Dialogue Text	APT / STUDENT COMMUNIST	Perception (Sight)	In the meantime, a small indigo flower begins to bloom just below his cheekbone.	与此同时，他的颧骨上开出一朵靛青色的小花。
0x0100000F0000A7C0	Dialogue Text	APT / STUDENT COMMUNIST	Pain Threshold	That would be the sweet endorphin rush. You've granted him a natural high, at least until the hurt sets in.	想必是甜美的内啡肽在发挥作用。至少在痛觉恢复之前，你把他搞爽了。
0x0100000F0000A7C5	Dialogue Text	APT / STUDENT COMMUNIST	Physical Instrument	A little ice on it will keep the swelling down. He'll be fine in a day or two.	冰敷可以帮助消肿。一两天之后他就没事了。
0x0100000F0000A7D7	Dialogue Text	APT / STUDENT COMMUNIST	Physical Instrument	TOO STRONG, KILLER.	太猛了，杀手。
0x0100000F0000A7DC	Dialogue Text	APT / STUDENT COMMUNIST	Physical Instrument	OH YEAH, we're gonna spin this kid like a top!	哦耶，我们要像一个真正的大哥一样把这个小孩玩弄于掌心！
0x0100000F0000A7E7	Dialogue Text	APT / STUDENT COMMUNIST	Logic	Wait-wait-wait, you were trying *not* to do that!	等等等等，你本来的目的可*不是*这个！
0x0100000F0000A811	Dialogue Text	APT / STUDENT COMMUNIST	Interfacing	Ensconced in your ceramic armour, you barely notice the moment of contact. But you do hear the distinct *ting* of your knuckles catching the young man's cheekbone.	在陶瓷盔甲的保护下，你几乎没有任何感觉。但是你确实听到了指节撞击颧骨时独特的*脆响*。
0x0100000F0000A816	Dialogue Text	APT / STUDENT COMMUNIST	Interfacing	Even through the yellow latex shell containing your hand you can feel the force of the impact against the young man's cheekbone.	即使隔着黄色橡胶手套，你也能感觉到拳击年轻人颧骨的反作用力。
0x0100000F0000A81B	Dialogue Text	APT / STUDENT COMMUNIST	Interfacing	En route to its target your FALN glove traces a strangely pleasing black-and-white blur through the air, like some kind of ultra-sonic weasel.	你的FALN手套落在他脸上，在空气中留下一道赏心悦目的黑白残影，像一只超音速黄鼠狼。
0x0100000F0000A820	Dialogue Text	APT / STUDENT COMMUNIST	Interfacing	At the moment of contact you're reminded of a fight you once witnessed between two homeless men in an alleyway. Could it be that you've set out to recreate that moment now, right down to the smelly fingerless gloves?	接触的一瞬间，你回想起曾在小巷里见过的两个流浪汉之间的斗殴。你是否正在尝试复制那个瞬间，通过这双散发着异味的无指手套？
0x0100000F0000A825	Dialogue Text	APT / STUDENT COMMUNIST	Interfacing	You feel a bright pain as your bare knuckle collides with the young man's oddly prominent cheekbone. At the moment of contact his eyes are wide as old silver coins.	你裸露的指节撞在年轻人古怪的高颧骨上，一阵刺骨的疼痛从手上传来。接触的一瞬间，他双眼圆睁，仿佛两枚古旧的银币。
0x0100000F0000A82A	Dialogue Text	APT / STUDENT COMMUNIST	Rhetoric	Of course, it's not *actually* ultra-sonic, that's just an illusion produced by good branding. Still, the force you've unleashed really is tremendous.	当然，你没有*真的*用超音速打他，那只是名牌产品带来的错觉。但是，你挥拳的力道依然超乎想象。
0x0100000F0000A834	Dialogue Text	APT / STUDENT COMMUNIST	Inland Empire	Oh god, tell us you haven't done it *again*. Are you twice the killer now?	哦老天，你不会*又*干了一次这种事吧。你现在是连环杀手了吗？
0x0100000F0000A839	Dialogue Text	APT / STUDENT COMMUNIST	Inland Empire	Oh, no. Tell us you didn't *really* kill him.	哦不，你不会*真的*杀了他吧。
0x0100000F0000A863	Dialogue Text	APT / STUDENT COMMUNIST	Kim Kitsuragi	"Good god, detective! What's wrong with you?"	“天啊，警探！你怎么回事？”
0x0100000F0000A86A	Dialogue Text	APT / STUDENT COMMUNIST	Echo Maker	"Steban, can you hear me?"	“史蒂文，你能听见吗？”
0x0100000F0000A872	Dialogue Text	APT / STUDENT COMMUNIST	Steban, the Student Communist	"Errrrck." The young man cradles his jaw and looks up, his expression blank.	“呃呃呃……”年轻人捧住下巴，眼神空洞地抬头。
0x0100000F0000A878	Dialogue Text	APT / STUDENT COMMUNIST	Physical Instrument	You're both lucky you didn't shatter his cheekbone. He may want to count his teeth before he goes to bed tonight.	你没有一巴掌拍碎他的颧骨，这对你们两人都是幸事。他今晚睡觉之前或许得数一下自己的牙了。
0x0100000F0000A880	Dialogue Text	APT / STUDENT COMMUNIST	You	"Oh, god. I'm sorry about that."	“哦，老天。我真的很抱歉。”
0x0100000F0000A885	Dialogue Text	APT / STUDENT COMMUNIST	You	"Let that be a lesson to you."	“给你一个教训。”
0x0100000F0000A88A	Dialogue Text	APT / STUDENT COMMUNIST	You	Say nothing.	一言不发。
0x0100000F0000A88F	Dialogue Text	APT / STUDENT COMMUNIST	Steban, the Student Communist	"*Sorry*? You nearly took my fucking jaw off!"	“*抱歉*？你他妈的差点把我的下巴打碎！”
0x0100000F0000A894	Dialogue Text	APT / STUDENT COMMUNIST	Steban, the Student Communist	"What lesson is that, huh? That the RCM are assholes? That they'll take your fucking jaw off?"	“什么教训，哈？你想告诉我，RCM都是混蛋？他们会打碎别人的下巴？”
0x0100000F0000A899	Dialogue Text	APT / STUDENT COMMUNIST	Steban, the Student Communist	"What? You're just gonna stand there after you nearly broke my fucking jaw?"	“什么？你在差点打碎了我的下巴之后，就打算他妈的站在那里什么也不说吗？”
0x0100000F0000A8AA	Dialogue Text	APT / STUDENT COMMUNIST	Perception (Hearing)	You think you can hear a slight popping sound as he moves his mouth.	他动嘴的时候你能听到轻微的泡泡声。
0x0100000F0000A8B5	Dialogue Text	APT / STUDENT COMMUNIST	Esprit de Corps	It certainly won't improve your precinct's image within the community.	这对于你的分局在群众面前的形象显然不会有任何帮助。
0x0100000F0000A8BA	Dialogue Text	APT / STUDENT COMMUNIST	Authority	That's right. You don't *owe* him any explanation.	没错。你不*欠*他任何解释。
0x0100000F0000A8D4	Dialogue Text	APT / STUDENT COMMUNIST	Kim Kitsuragi	The lieutenant nods.	警督点点头。
0x0100000F0000A8DA	Dialogue Text	APT / STUDENT COMMUNIST	Kim Kitsuragi	"Thank god we avoided *that* fiasco, at least..."	“感谢老天我们至少避免了*那种*情况……”
0x0100000F0000A8E0	Alternate1	APT / STUDENT COMMUNIST	Steban, the Student Communist	For his part, the young man looks rather put off. It's clear he was *also*  looking forward to you punching him.	年轻人看起来有些失落。显然他*也*指望着被你殴打。
0x0100000F0000A8E0	Dialogue Text	APT / STUDENT COMMUNIST	Steban, the Student Communist	The young man can hardly conceal his disappointment. He was apparently looking forward to being punched by you.	年轻人几乎掩饰不住他的失望。显然他指望着被你殴打。
0x0100000F0000A8ED	Dialogue Text	APT / STUDENT COMMUNIST	Esprit de Corps	And yet you can't help but sense a slight disappointment on his part. It seems a part of him hoped you would hit the pretentious young communist...	但你忍不住为他感到一丝失望。看起来他似乎隐隐希望你能够重击这个自命不凡的年轻康米主义者……
0x0100000F0000A8F6	Dialogue Text	APT / STUDENT COMMUNIST	Steban, the Student Communist	"Well, if you're not going to play along, I don't think we have anything further to discuss. Good evening to you, gendarme."	“好吧，如果你不想按我们说好的来，那我们也没什么可聊的了。晚安，警官。”
0x0100000F0000A902	Dialogue Text	APT / STUDENT COMMUNIST	You	"I'm ready... let's talk about infra-materialism."	“我准备好了……我们来探讨亚唯物主义吧。”
0x0100000F0000A90B	Dialogue Text	APT / STUDENT COMMUNIST	Steban, the Student Communist	"Yes, let's get right to it."	他点点头。“好，我们现在就开始吧。”
0x0100000F0000A912	Dialogue Text	APT / STUDENT COMMUNIST	Rhetoric	You'll be leading this conversation, so wherever you take it, they'll be glad to follow.	你来起头。你说什么，他们都会乐意跟着你讨论。
0x0100000F0000A919	Dialogue Text	APT / STUDENT COMMUNIST	You	"I have some questions about the origins of this theory."	“我对这个理论的起源有一些问题。”
0x0100000F0000A91E	Dialogue Text	APT / STUDENT COMMUNIST	You	"I really want to hear more about these hyper-revolutionary figures."	“我只想进一步了解那些超-革命人物。”
0x0100000F0000A923	Dialogue Text	APT / STUDENT COMMUNIST	You	"It's the theoretical parts I'm interested in. The third-level stuff."	“我对理论部分感兴趣。”
0x0100000F0000A92E	Dialogue Text	APT / STUDENT COMMUNIST	Steban, the Student Communist	"Oh, it's a great story. You should check out Nilsen's journals if you ever have the chance."	“哦，那是个很有趣的故事。如果有机会，你可以读一度尼尔森的日记。”
0x0100000F0000A933	Dialogue Text	APT / STUDENT COMMUNIST	Steban, the Student Communist	"Ah, yes. That's certainly one of the *least* developed parts of the theory, but also one of the most intriguing."	“啊，好。它是这个理论*最不*完善的部分之一，但也是最有趣的部分之一。”
0x0100000F0000A938	Dialogue Text	APT / STUDENT COMMUNIST	Steban, the Student Communist	"Oh, yes. Or the *fun parts*, as we like to call them."	“哦，好。我们也喜欢管它叫*乐趣部分*。”
0x0100000F0000A93D	Dialogue Text	APT / STUDENT COMMUNIST	Echo Maker	His companion nods in agreement.	他的同伴点头表示同意。
0x0100000F0000A942	Dialogue Text	APT / STUDENT COMMUNIST	Echo Maker	His companion leans forward, ready to jump in...	他同伴身体前倾，随时准备插入对话……
0x0100000F0000A947	Dialogue Text	APT / STUDENT COMMUNIST	Echo Maker	His companion nods his head with expectation.	他的同伴期盼地点点头。
0x0100000F0000A94C	Dialogue Text	APT / STUDENT COMMUNIST	Rhetoric	These two are full of interesting stories and rumours about Nilsen, Mazov, and their revolutionary exploits. Half an hour passes and the conversation gradually wends its way to some unexpected places...	这两人对尼尔森、马佐夫轶闻趣事以及革命成果简直门清。你们聊了半个小时，对话逐渐拐向了前所未料的方向……
0x0100000F0000A951	Dialogue Text	APT / STUDENT COMMUNIST	Rhetoric	They're impressed that you dove right in to the most advanced parts of the theory. Half an hour evaporates and the conversation is still wending its way toward new and unexpected places...	他们很惊讶你一头栽进了这个理论最前沿的部分。半个小时凭空蒸发，对话逐渐拐向了前所未料的全新方向……
0x0100000F0000A967	Dialogue Text	APT / STUDENT COMMUNIST	Shivers	A cool breeze coming off the bay wraps itself around the Capeside Apartments. In a nearly forgotten part of that glorified construction site, surrounded by rusted pieces of scaffolding and walls of faded tarpaulin, a detective of the RCM debates the intricacies of an abstruse theory with a pair of university students...	清凉的夜风从海湾边吹来，绕着岬岸公寓打转。在这曾经辉煌的施工地点一个被遗忘的角落，被生锈的脚手架零件与褪色油布构成的墙壁所包围着，一名RCM的警探与两名大学生正辩论着一个深奥理论的精妙之处……
0x0100000F0000A987	Dialogue Text	APT / STUDENT COMMUNIST	Steban, the Student Communist	"... but if it's true that this individual possesses *so much capital* that light literally *bends* around him, then that must mean..."	“……但如果这个人拥有*这么多资本*，以至于光线都在他周围*扭曲*，这是否意味着……”
0x0100000F0000A98E	Dialogue Text	APT / STUDENT COMMUNIST	You	"That *capital* produces its *own* form of plasm!"	“意味着*资本*能够产生出它*自己的*凝胶类型！”
0x0100000F0000A993	Dialogue Text	APT / STUDENT COMMUNIST	You	"That *light itself* is a bourgeois illusion!"	“那个*光线*本身就是资产阶级的幻觉！”
0x0100000F0000A9A1	Dialogue Text	APT / STUDENT COMMUNIST	Echo Maker	"In 'Innocence of Capital', Puncher and Wattmann argue that communists must possess as little capital as possible, in order to keep their thinking *undiluted* by its influence..."	“在‘资本无罪论’里，庞奇和瓦特曼提出，康米主义者应当持有尽可能少的资本，以避免自己的思想被它*稀释*……”
0x0100000F0000A9A7	Dialogue Text	APT / STUDENT COMMUNIST	Steban, the Student Communist	"*Or* it suggests that capital, in sufficient quantities, must exhibit its own plasm-like qualities..."	“*或者*它意味着，足够大量的资本能够体现出类似于凝胶的独有性质……”
0x0100000F0000A9BC	Dialogue Text	APT / STUDENT COMMUNIST	Savoir Faire	Watch out. You call yourself a communist and yet you've been accumulating a *suspiciously* large share of capital in just the last few days. It's almost certainly distorting your thinking.	注意。你自命为康米主义者，却在过去几天里积攒了数额大到*可疑*的资本。它一定在扭曲你的思想。
0x0100000F0000A9C2	Dialogue Text	APT / STUDENT COMMUNIST	Savoir Faire	You've accrued a modest account balance over the last few days, but probably not enough to warp your thinking *too* much.	过去几天里，你在自己账户里积累了数额适中的金钱，但它们或许还不能*严重*扭曲你的思想。
0x0100000F0000A9C7	Dialogue Text	APT / STUDENT COMMUNIST	Savoir Faire	Nothing to fear. Judging from your account balance, you should be thinking *extremely* clearly.	你无所畏惧。从你的账户余额来看，你的思想*一片清澈*。
0x0100000F0000A9D9	Dialogue Text	APT / STUDENT COMMUNIST	Kim Kitsuragi	"Again, he was just a regular high-net-worth individual. There was nothing *extra-physical* about him..."	“他只是个有-钱-人。他没有任何超物理效用……”
0x0100000F0000A9E0	Dialogue Text	APT / STUDENT COMMUNIST	Shivers	Now the breeze has subsided. All is still except for the last bits of steam rising from the coffee pot.	风停了。除了咖啡壶上袅袅升起的最后一缕蒸汽，一切都静止下来。
0x0100000F0000A9E8	Dialogue Text	APT / STUDENT COMMUNIST	Steban, the Student Communist	"... but my question is where does the RCM *recruit* all these hyper-revolutionaries to join this 'Remote Viewers Division'?"	“……但我的问题是，RCM是从哪里*招募*了那么多超-革命分子加入遥视者部门的？”
0x0100000F0000A9EF	Dialogue Text	APT / STUDENT COMMUNIST	You	"It's less that you're 'recruited' into the RVD and more like you're *called*."	“遥视者部门并不是‘招募’，而是更像*召唤*需要的人。”
0x0100000F0000A9F4	Dialogue Text	APT / STUDENT COMMUNIST	You	"And my *point* is that maybe these *hyper-revolutionary* individuals are more common than infra-materialism generally assumes..."	“我的*意思*是，这个世界上的*超-革命分子*的存在，可能比亚唯物主义所估计的要普遍得多……”
0x0100000F0000A9FD	Dialogue Text	APT / STUDENT COMMUNIST	Steban, the Student Communist	"Fascinating..."	“有意思……”
0x0100000F0000AA0B	Dialogue Text	APT / STUDENT COMMUNIST	Kim Kitsuragi	"Yes, only the detective here would draw a connection between a made-up division of para-psychics and the addled ramblings of a defunct communist mage..."	“也只有这位警探才会觉得，一个捏造出来的类通灵师部门和一个死掉的康米主义思想家的信口开河，这两者能有什么联系。”
0x0100000F0000AA11	Dialogue Text	APT / STUDENT COMMUNIST	Esprit de Corps	A fortunate turn that the lieutenant isn't here. Imagine what he would have to say about this.	幸好警督不在。想想他会说什么吧。
0x0100000F0000AA19	Dialogue Text	APT / STUDENT COMMUNIST	Steban, the Student Communist	The young man ignores the lieutenant. "But I suppose it makes sense that some common strain of infra-materialist thought would persist in the RCM, even to this day, given its origins."	年轻人无视了警督。“但我想我可以理解，为什么到了今天，一些大众化的亚唯物主义思想依然存在于RCM。考虑到这个理论的起源。”
0x0100000F0000AA1E	Dialogue Text	APT / STUDENT COMMUNIST	Steban, the Student Communist	The young man nods thoughtfully. "But I suppose it makes sense that some common strain of infra-materialist thought would persist in the RCM, even to this day, given its origins."	年轻人若有所思地点点头。“但我想我可以理解，为什么到了今天，一些大众化的亚唯物主义思想依然存在于RCM。考虑到这个理论的起源。”
