ArticyId	TermType	ConvTitle	Actor	En	Zh
0x0100000F00007701	Dialogue Text	APT / STUDENT COMMUNIST	Steban, the Student Communist	"'Confiscated'? Next he's probably going to say it was civil asset forfeiture..."	“‘充公’？我看他接下来就要说这是没收公民财产……”
0x0100000F00007706	Dialogue Text	APT / STUDENT COMMUNIST	Steban, the Student Communist	"Unlikely. That's real Saramirizian twill. Only old Saramirizian communists and drug smugglers wear those anymore..."	“这不太可能。那可是真正的萨拉米尔泽斜纹布。现在只有老萨拉米尔泽康米主义者和毒贩还穿这种衣服了……”
0x0100000F0000770E	Dialogue Text	APT / STUDENT COMMUNIST	Savoir Faire	He is neither of those, of course. He is simply a poor student, putting on airs. Also, he doesn't have the shoulders to fill out such a jacket.	当然，他并不属于这二者。他只是个自命不凡的穷学生。况且，他的窄肩可撑不起这样一件夹克。
0x0100000F0000771D	Dialogue Text	APT / STUDENT COMMUNIST	Steban, the Student Communist	"See, Uli? It's just like Mazov wrote. How does it go again?"	“你瞧，尤利？就和马佐夫写的一样。那句话是怎么说的来着？”
0x0100000F00007725	Dialogue Text	APT / STUDENT COMMUNIST	Authority	Damn right. If he keeps mouthing off, you should take his pants too.	一点不错。要是他再喋喋不休，你就把他的裤子也扒了。
0x0100000F0000772D	Dialogue Text	APT / STUDENT COMMUNIST	Echo Maker	"'Those committed to the rights of property are those most apt to violate them'." His companion nods emphatically.	“‘那些致力于保护财产权的人也最容易侵犯它’……”他的同伴点头强调语气。
0x0100000F0000773C	Dialogue Text	APT / STUDENT COMMUNIST	Steban, the Student Communist	"I assumed it was Maurice who broke into my room, to play a trick on me. I didn't think I'd *actually* been raided by the RCM!"	“我还以为是莫里斯闯进我的房间搞恶作剧。谁能想到*居然*是RCM抢劫了我！”
0x0100000F00007741	Dialogue Text	APT / STUDENT COMMUNIST	Conceptualization	Just a minute. Steban... Ulixes... *why* do those names ring the faintest of bells?	等一下。史蒂文……尤利西斯……*为什么*这些名字给你一种隐隐的熟悉感？
0x0100000F0000774F	Dialogue Text	APT / STUDENT COMMUNIST	Logic	Probably because they're the real names of 'Nasteb' and 'Exilus', the authors of that so-called essay about TipTop Tournée you read...	可能因为它们就是‘凡史蒂’和‘西利尤斯’的真名，也就是你之前读过的那篇所谓的大师巡回赛批判的作者。
0x0100000F00007758	Dialogue Text	APT / STUDENT COMMUNIST	Conceptualization	You should get to the bottom of this, when you have the chance.	你应该抽时间仔细读一读那篇文章。
0x0100000F00007760	Dialogue Text	APT / STUDENT COMMUNIST	Empathy	There is surprise in his voice, naturally, but is that a note of *excitement* you also detect?	他听起来有些惊讶，这很正常，但为什么你还能听出来一丝*兴奋*？
0x0100000F00007767	Dialogue Text	APT / STUDENT COMMUNIST	You	"So, do you want your jacket *back*?"	“那你想*要回*你的夹克吗？”
0x0100000F0000776E	Dialogue Text	APT / STUDENT COMMUNIST	You	"Listen, comrade, it's not what it looks like..."	“听着，同志，事情不是你想的那样……”
0x0100000F00007774	Dialogue Text	APT / STUDENT COMMUNIST	You	"Why do you sound *excited* to be raided by the RCM?"	“为什么你被RCM抢劫了，反而听起来有点*兴奋*？”
0x0100000F00007779	Dialogue Text	APT / STUDENT COMMUNIST	You	"Look, man, it doesn't even fit you, anyway."	“你看，老兄，反正它对你来说根本就不合身嘛。”
0x0100000F00007783	Dialogue Text	APT / STUDENT COMMUNIST	Steban, the Student Communist	"Absolutely not. You have to keep it..."	“绝不，请你留着它。”
0x0100000F00007788	Dialogue Text	APT / STUDENT COMMUNIST	Steban, the Student Communist	"You're right. It's *better*!"	“没错。事情比我想得更好！”
0x0100000F0000778D	Dialogue Text	APT / STUDENT COMMUNIST	Steban, the Student Communist	"Oh, gendarme, because this is perfect..."	“哦，警官，因为它是完美的……”
0x0100000F00007792	Dialogue Text	APT / STUDENT COMMUNIST	Steban, the Student Communist	"You're right. It was a gift from my grandmother. But now you've *got* to keep it..."	“你说得对。它是我祖母送给我的礼物。但你*得*留下它……”
0x0100000F00007798	Dialogue Text	APT / STUDENT COMMUNIST	Steban, the Student Communist	He turns to his companion. "Can you imagine the look on Maurice's face when he finds out the RCM has been kicking my door down?"	他转向同伴。“要是莫里斯知道RCM闯进了我的房间，你猜他会是什么表情？”
0x0100000F0000779D	Dialogue Text	APT / STUDENT COMMUNIST	Echo Maker	"He'll shit himself! Positively."	“他会吓瘫在地的！肯定如此！”
0x0100000F000077BB	Dialogue Text	APT / STUDENT COMMUNIST	Steban, the Student Communist	"And now they've shown up *in force* to break up our meeting!" He rubs his hands together excitedly.	“现在他们还*强行*闯进来破坏我们的集会！”他激动地搓起了手。
0x0100000F000077C0	Dialogue Text	APT / STUDENT COMMUNIST	Steban, the Student Communist	"And now they've sent one of their agents to *infiltrate* our meeting." He rubs his hands together excitedly.	“现在他们还派了一名探员来*混入*我们的集会！”他激动地搓起了手。
0x0100000F000077C9	Dialogue Text	APT / STUDENT COMMUNIST	Kim Kitsuragi	The lieutenant sighs. "Something tells me these young men are not very experienced with law enforcement."	警督叹了口气。“不知怎么，我感觉这两位年轻人并不熟悉执法部门。”
0x0100000F000077D0	Alternate1	APT / STUDENT COMMUNIST	You	"Hold on, we're not here to *break up* your meeting. We want to *join* your meeting!"\n	“等等，我们不是来这里*破坏*你们的集会的。我们是想*加入*你们的集会！”
0x0100000F000077D0	Dialogue Text	APT / STUDENT COMMUNIST	You	"Hold on, I'm not here to *infiltrate* your meeting. I want to *join* your meeting!"	“等等，我不是来这里*混入*你们的集会的，我是想*加入*你们的集会！”
0x0100000F000077DC	Dialogue Text	APT / STUDENT COMMUNIST	Steban, the Student Communist	"The RCM wants to join us?" A quizzical expression...	“RCM想加入我们？”疑惑的表情……
0x0100000F000077EE	Dialogue Text	APT / STUDENT COMMUNIST	Kim Kitsuragi	"My partner, of course, is acting in a strictly *personal capacity*, not as an official representative of the RCM."	“这我的搭档的个人行为，并不代表RCM官方。”
0x0100000F000077F5	Dialogue Text	APT / STUDENT COMMUNIST	Steban, the Student Communist	"Interesting. Does that mean you've done the reading?"	“有趣。你的意思是你已经完成阅读任务了？”
0x0100000F00007801	Dialogue Text	APT / STUDENT COMMUNIST	Authority	One leader and one follower, the most ancient power dynamic.	一个领袖，一个追随者，最古典的权力结构。
0x0100000F00007808	Dialogue Text	APT / STUDENT COMMUNIST	Composure	There's a great deal of tension in this young man's shoulders, more than someone his age should bear...	年轻人的肩膀紧绷着，远超他这个年龄的人应该承受的压力……
0x0100000F00007815	Dialogue Text	APT / STUDENT COMMUNIST	Composure	Meanwhile, his companion inclines toward him, eager to catch every word that dribbles from his friend's mouth.	同时，他的同伴靠向他，急切地聆听任何从他嘴角漏下的话语。
0x0100000F0000781B	Dialogue Text	APT / STUDENT COMMUNIST	Savoir Faire	Just a moment -- could this be the former owner of a certain jacket you 'acquired' recently?	等一等——他会不会是你最近‘取得’的那件夹克的前主人？
0x0100000F00007823	Dialogue Text	APT / STUDENT COMMUNIST	Drama	Don't let them see you *flustered*, ssssire. Play along...	别让他们看到你*慌张*的样子，大大大人。顺着他的话说……
0x0100000F00007831	Dialogue Text	APT / STUDENT COMMUNIST	You	"Before we move on, do you recognise this jacket?" (Show him the Saramirizian jacket.)	“先别急着进入正题，你认得这件夹克吗？”（向他展示萨拉米尔泽休闲夹克。）
0x0100000F00007836	Dialogue Text	APT / STUDENT COMMUNIST	You	"You weren't exactly easy to find."	“你们可不好找啊。”
0x0100000F0000783B	Dialogue Text	APT / STUDENT COMMUNIST	You	"What am I late *for* exactly?"	“我到底迟到了*什么*？”
0x0100000F00007840	Dialogue Text	APT / STUDENT COMMUNIST	You	(Play along.) "My apologies, comrades. I had to be sure I wasn't being tailed... by our *class enemies*."	（顺着他的话说。）“很抱歉，同志们。我得确认我甩掉了……*阶级敌人*的尾巴。”
0x0100000F00007845	Dialogue Text	APT / STUDENT COMMUNIST	You	[Leave.]	[离开。]
0x0100000F0000785C	Dialogue Text	APT / STUDENT COMMUNIST	Steban, the Student Communist	"That's the whole point, of course. We can't just have *anybody* waltzing in here. Martinaise is crawling with reactionary infiltrators."	“这是有意为之。我们不能随便放任*乱七八糟的人*跳着华尔兹进来。马丁内斯到处都是反动的卧底。”
0x0100000F00007869	Dialogue Text	APT / STUDENT COMMUNIST	Steban, the Student Communist	"There are RCM spies, for one. Just recently, someone even broke into my apartment, if you can believe it..."	“比如说RCM的间谍。就在最近，有人闯入了我的公寓，你能相信吗……”
0x0100000F0000786F	Dialogue Text	APT / STUDENT COMMUNIST	Steban, the Student Communist	"To say nothing of Gottwaldians and Econoclards."	“更不要说戈特伍德人与经济眼了……”
0x0100000F0000787D	Dialogue Text	APT / STUDENT COMMUNIST	Echo Maker	The young man's companion reflexively snorts at the mention of Gottwaldians and Econoclards.	听到戈特伍德与经济眼，年轻人的同伴反射性地哼了一声。
0x0100000F00007884	Dialogue Text	APT / STUDENT COMMUNIST	Steban, the Student Communist	"Are you saying you *haven't* done the reading for tonight?"  The two young men look at one another.	两人面面相觑。“你是想说你*还没*读完今晚的内容吗？”
0x0100000F0000788A	Dialogue Text	APT / STUDENT COMMUNIST	Drama	Uh oh. No one said anything about *reading*. You'll just have to wing this one.	哦不。这个*阅读*又是什么。你得即兴发挥了。
0x0100000F00007892	Dialogue Text	APT / STUDENT COMMUNIST	Steban, the Student Communist	"Mmmm." The young man considers you a moment...	“嗯……”年轻人审视了你一番。
0x0100000F00007899	Dialogue Text	APT / STUDENT COMMUNIST	Physical Instrument	He's taking your measure. Like an ideological boxer stepping into the ring.	他在估量你。像一个意识形态的拳击手走上拳击台。
0x0100000F000078AE	Dialogue Text	APT / STUDENT COMMUNIST	Inland Empire	This must be the *theory combat* the boiadeiro warned you about! En garde!	这一定是那个牛仔警告过你的*理论搏斗*！各就各位，预备！
0x0100000F000078B5	Dialogue Text	APT / STUDENT COMMUNIST	Steban, the Student Communist	"We all have to take precautions, especially during these delicate times. What matters is that you've made it, and that you've done the reading."	“我们都得小心点，尤其现在时局混乱。重要的是你终于来了，而且你完成了阅读任务……”
0x0100000F000078CB	Dialogue Text	APT / STUDENT COMMUNIST	You	(Just wing it.) "The reading, yes. I've *definitely* done that."	（即兴发挥。）“阅读，是的。我*当然*读完了！”
0x0100000F000078D0	Dialogue Text	APT / STUDENT COMMUNIST	You	"What is this *reading*? I thought this was a revolutionary group!"	“这个*阅读*是什么？我以为这是个革命小组！”
0x0100000F000078D5	Dialogue Text	APT / STUDENT COMMUNIST	You	"There must be some misunderstanding. No one mentioned any reading."	“或许有什么误会。没人说过要读什么东西。”
0x0100000F000078DA	Dialogue Text	APT / STUDENT COMMUNIST	You	(Whisper.) "Kim, did *you* do the reading?"	（低语。）“金，*你*读过了吗？”
0x0100000F000078E7	Dialogue Text	APT / STUDENT COMMUNIST	Steban, the Student Communist	"You have? Excellent. Let's hear your critique then."	“你读完了？太棒了。那来说说你的批判意见吧。”
0x0100000F000078ED	Dialogue Text	APT / STUDENT COMMUNIST	Steban, the Student Communist	"Yes, a revolutionary *reading* group. The most ideologically advanced materialist reading group in Martinaise. But it sounds like that's news to you..."	“是的，一个革命*阅读*小组。全马丁内斯意识形态最超前的唯物主义阅读小组。但你好像没有听说过……”
0x0100000F000078F3	Dialogue Text	APT / STUDENT COMMUNIST	Steban, the Student Communist	"Well, this is getting awkward. I'm not sure what you were expecting to find here then..."	“这就有点尴尬了。不知道你本以为我们是干什么的……”
0x0100000F000078F9	Dialogue Text	APT / STUDENT COMMUNIST	Kim Kitsuragi	"No, detective. The only reading I've been doing is right here..." The lieutenant holds up his little blue notebook.	“不，警探。我最近唯一的阅读都在这里了……”警督举起他的蓝色小笔记本。
0x0100000F00007901	Dialogue Text	APT / STUDENT COMMUNIST	Empathy	There's profound consternation in his voice. You suspect it's about something bigger than your not having done the reading.	他的声音中包含着一种深沉的忧虑。你怀疑这不仅仅是因为你没有完成阅读任务。
0x0100000F0000790A	Alternate1	APT / STUDENT COMMUNIST	Echo Maker	"Maybe they can explain themselves."	“也许他们能解释一番……”
0x0100000F0000790A	Dialogue Text	APT / STUDENT COMMUNIST	Echo Maker	"Maybe he can explain himself."	“也许他能解释一番……”
0x0100000F00007911	Dialogue Text	APT / STUDENT COMMUNIST	Esprit de Corps	He seems to be wagging the notebook at you, as though he suspects you may have forgotten why you're here.	他向你晃了晃笔记本，好像在怀疑你是不是忘了为什么要来这里。
0x0100000F00007918	Dialogue Text	APT / STUDENT COMMUNIST	Kim Kitsuragi	"I have not had time to seek out pretentious communist book clubs, nor have I done their 'reading'."	“我没有时间寻找这些自命不凡的康米主义读书俱乐部，也没有做过他们的阅读任务。”
0x0100000F0000791F	Alternate1	APT / STUDENT COMMUNIST	Echo Maker	"It doesn't sound like they've done the reading, Steban."	“看来他们没有做阅读任务，史蒂文。”
0x0100000F0000791F	Dialogue Text	APT / STUDENT COMMUNIST	Echo Maker	"It doesn't sound like he's done the reading, Steban."	“看来他没有做阅读任务，史蒂文。”
0x0100000F00007930	Dialogue Text	APT / STUDENT COMMUNIST	Steban, the Student Communist	"Go ahead." The young man gives you a half-smile. His companion sniffs.	“来吧。”年轻人向你微笑。他的同伴嗤了一声。
0x0100000F00007939	Dialogue Text	APT / STUDENT COMMUNIST	You	"I liked... the characters and the plot."	“我喜欢……角色和情节。”
0x0100000F0000793E	Dialogue Text	APT / STUDENT COMMUNIST	You	"I thought the themes were... *interesting*."	“我觉得主题……很*有趣*。”
0x0100000F00007943	Dialogue Text	APT / STUDENT COMMUNIST	You	"There were... too many words."	“字数……太多了。”
0x0100000F0000794E	Dialogue Text	APT / STUDENT COMMUNIST	Steban, the Student Communist	"Characters? What characters are you talking about?"	“角色？你在说哪些角色？”
0x0100000F00007954	Dialogue Text	APT / STUDENT COMMUNIST	Steban, the Student Communist	"They always say that when they haven't done the reading."	“所有没读的人都是这么说的。”
0x0100000F0000795A	Dialogue Text	APT / STUDENT COMMUNIST	Steban, the Student Communist	"Too many... *words*?"	“*字数*……太多？”
0x0100000F00007974	Dialogue Text	APT / STUDENT COMMUNIST	You	"Yes, but if the writer just cut a few I'm sure it would be fine."	“没错，但如果作者能砍掉一些，我觉得就没问题了。”
0x0100000F000090A6	Dialogue Text	APT / STUDENT COMMUNIST	You	"What *exactly* are you two doing here?"	“你们两个到底是来干什么的？”
0x0100000F000090AF	Dialogue Text	APT / STUDENT COMMUNIST	Steban, the Student Communist	"In the most general sense, I would say we're cultivating revolutionary consciousness."	“笼统地说，我们在培养革命觉悟。”
0x0100000F000090B4	Dialogue Text	APT / STUDENT COMMUNIST	Steban, the Student Communist	"But more specifically, we're running a reading group, the most rigorous and theoretically advanced materialist reading group in Martinaise."	“更确切地说，我们组织了一个阅读小组，全马丁内斯最严谨、意识形态最超前的唯物主义阅读小组。”
0x0100000F000090BD	Dialogue Text	APT / STUDENT COMMUNIST	Echo Maker	"Comrade Steban is a great discussion leader. One of the best at the university."	“史蒂文同志是大学里最出色的讨论组织者之一。”
0x0100000F000090C6	Dialogue Text	APT / STUDENT COMMUNIST	Logic	It's obvious they take this 'group' of theirs extremely seriously. Whatever you do, *don't* compare it to a common book club.	他们显然非常重视这个“小组”。不管说什么，都别把它和普通的读书俱乐部相提并论。
0x0100000F000090CD	Dialogue Text	APT / STUDENT COMMUNIST	Half Light	*YAWWWWN!* Can you imagine anything duller than a bunch of binoclards yanking each others' knobs?	*哈欠*还有什么事情能比一群四眼仔互相扯鸡鸡更无聊？
0x0100000F000090D4	Dialogue Text	APT / STUDENT COMMUNIST	You	"Is this where I can square off in *theory combat*?"	“这里是我能参加*理论搏斗*的地方吗？”
0x0100000F000090D9	Dialogue Text	APT / STUDENT COMMUNIST	You	"Sounds like a place for intense intellectual engagement. Exactly my kind of jam."	“听起来你们要组织紧张刺激的智力对战。我就好这一口。”
0x0100000F000090DE	Dialogue Text	APT / STUDENT COMMUNIST	You	"Sounds just like a regular book club."	“听起来就是个普通的读书俱乐部嘛。”
0x0100000F000090E3	Dialogue Text	APT / STUDENT COMMUNIST	You	"Sounds like a yank-fest for binos."	“听起来是四眼仔的扯鸡鸡比赛。”
0x0100000F000090F0	Dialogue Text	APT / STUDENT COMMUNIST	Steban, the Student Communist	"We have been known to get into some *spirited* debates. But it's always in service of our larger intellectual and ideological project."	“我们确实组织过一些*激情四射*的辩论。但最终总归是为了我们更宏大的智力与意识形态命题。”
0x0100000F000090F6	Dialogue Text	APT / STUDENT COMMUNIST	Steban, the Student Communist	"That's our whole *thing*. The world is so shallow, all noise and repetition. We're interested in genuinely radical critique."	“我们*就*干这个。这世界如此肤浅，灌满了噪音与复读。我们只对真正激进的批判意见有兴趣。”
0x0100000F000090FB	Dialogue Text	APT / STUDENT COMMUNIST	Steban, the Student Communist	"It's really nothing like that." The young man scoffs. "A book club is a place for talking about the plot points of bourgeois social novels and sipping effervescent cocktails."	“风马牛不相及。”年轻人嘲笑你。“你在读书俱乐部里只能喝着气泡水，讨论讨论资产阶级世情小说的剧情。”
0x0100000F00009100	Dialogue Text	APT / STUDENT COMMUNIST	Steban, the Student Communist	"It's nothing like that. A yank-fest is a decadent bourgeois phenomenon, a pastime for over-educated office workers who lack proper revolutionary outlets for their social dissatisfactions and repressed sexuality."	“差别大了去了。扯鸡鸡比赛是一种堕落的资产阶级现象。教育程度过高的办公室白领对社会不满，又处于性压抑状态，却不能通过革命的方式来纾解，于是只能在扯鸡鸡比赛里寻找一点消遣。”
0x0100000F00009112	Dialogue Text	APT / STUDENT COMMUNIST	Kim Kitsuragi	"Repressed sexualities are something of an *idée fixe* of his."	“性压抑是他的执念。”
0x0100000F00009117	Dialogue Text	APT / STUDENT COMMUNIST	Steban, the Student Communist	"But now we're getting hung up on the pathologies of capitalism. Let's move on."	“我们对资本主义的病理聊个没完。换个话题吧。”
0x0100000F00009120	Dialogue Text	APT / STUDENT COMMUNIST	Steban, the Student Communist	"One of capitalism's more banal pathologies. But let's move on."	“是资本主义较为陈腐的病理之一。我们还是换个话题吧。”
0x0100000F0000913A	Dialogue Text	APT / STUDENT COMMUNIST	Kim Kitsuragi	"That doesn't sound so bad," the lieutenant says. "In any case, it's healthier than certain *other* after-hours pursuits I've seen officers engage in." He gives you a pointed look.	“那听起来还不坏，”警督说道。“不管怎么说，总比警官们热衷的*某些*业余消遣要健康多了。”他尖锐地瞟你一眼。
0x0100000F00009140	Dialogue Text	APT / STUDENT COMMUNIST	Conceptualization	Extremely different from discussing the aesthetic merits of avant-garde literature while quaffing a fine Mirovan red, eh, Art Cop?	看来和一边吨吨吨地痛饮一瓶米洛凡红酒一边讨论先锋文学的美学价值完全不同哈，艺术警探？
0x0100000F0000914C	Dialogue Text	APT / STUDENT COMMUNIST	Echo Maker	"Precisely. We're not interested in senseless parroting. We like to read *critically*."	“一点不错。我们对无脑的鹦鹉学舌毫无兴趣。我们喜欢*批判性*阅读。”
0x0100000F00009154	Dialogue Text	APT / STUDENT COMMUNIST	Steban, the Student Communist	"Within the contours of Mazovian historical materialism, of course."	“当然，是在马佐夫历史唯物主义的框架之内。”
0x0100000F0000915E	Dialogue Text	APT / STUDENT COMMUNIST	You	"I didn't realise they taught radical Mazovian theory in the universities."	“现在的大学居然还教激进马佐夫主义理论？”
0x0100000F00009163	Dialogue Text	APT / STUDENT COMMUNIST	You	“Kim, can we arrest these kids for truancy?”	“金，我们能逮捕这些旷课的小鬼吗？”
0x0100000F00009168	Dialogue Text	APT / STUDENT COMMUNIST	You	"Okay, so what does your reading group actually *read*?"	“好吧，那你们的阅读小组到底*读*什么？”
0x0100000F0000916D	Dialogue Text	APT / STUDENT COMMUNIST	You	"I think I get the idea. Let me ask about something else."	“我想我明白了。让我问你点别的事。”
0x0100000F0000917D	Dialogue Text	APT / STUDENT COMMUNIST	Steban, the Student Communist	"We study all the foundational texts of Mazovian theory, of course. Just last week we finished the second volume of Puncher and Wattmann's 'Innocence of Capital'..."	“当然，我们学了所有的马佐夫主义理论基础。上周我们刚刚学完了庞奇和瓦特曼的‘资本无罪论’第二卷……”
0x0100000F00009184	Dialogue Text	APT / STUDENT COMMUNIST	Echo Maker	"Truly extraordinary."	“真是不同凡响。”
0x0100000F0000918B	Dialogue Text	APT / STUDENT COMMUNIST	Steban, the Student Communist	"And before that we spent six weeks on 'State and Plasm'..."	“在那之前我们又用了六周学习‘国家与凝胶’……”
0x0100000F00009192	Dialogue Text	APT / STUDENT COMMUNIST	Reaction Speed	For some reason the word *plasm* catches in your ear like a piece of old wax.	不知怎么，*凝胶*这个词像耳屎一样卡在了你的耳朵里。
0x0100000F00009199	Dialogue Text	APT / STUDENT COMMUNIST	Volition	Uh oh, you can feel your attention span rapidly deteriorating...	啊哦，你能感觉到自己的注意力正在迅速地涣散……
0x0100000F000091AC	Dialogue Text	APT / STUDENT COMMUNIST	Volition	This is fine. You can handle a list. In fact, you find the tedium strangely soothing.	没关系。不过是一个书单而已。实际上，你觉得这个沉闷的书单有种奇异的安慰。
0x0100000F000091B3	Dialogue Text	APT / STUDENT COMMUNIST	You	Force yourself to keep listening.	强迫自己继续听下去。
0x0100000F000091BA	Dialogue Text	APT / STUDENT COMMUNIST	Steban, the Student Communist	"We've also read Wertmüller's 'The Mega-Structure of History,' and before that, 'Reál and Reality'..."	“我们还读了韦特缪勒的‘历史的巨型结构’，之前还有‘雷亚尔与现实’……”
0x0100000F000091C2	Dialogue Text	APT / STUDENT COMMUNIST	Conceptualization	Communist theorists love puns, in case that wasn't obvious.	康米主义理论家热爱谐音梗，这简直不能更明显了。
0x0100000F000091C9	Dialogue Text	APT / STUDENT COMMUNIST	Echo Maker	"Abelard's 'Un Pays Infernal'..."	“阿伯拉的‘地狱般的国家’……”
0x0100000F000091D2	Dialogue Text	APT / STUDENT COMMUNIST	Steban, the Student Communist	"The original Fizdale translation, not that watered-down revisionist garbage."	“是原本的菲兹戴尔译本，不是那坨阉割过的修正主义垃圾。”
0x0100000F000091D8	Dialogue Text	APT / STUDENT COMMUNIST	Drama	These two deserve the Order of Honour for Bullshitting. There's no way they've actually *read* all this stuff.	他们两个应该被授予胡说八道学的荣誉学位。他们绝对不可能*读*过这么多东西。
0x0100000F000091E0	Dialogue Text	APT / STUDENT COMMUNIST	Echo Maker	"Obviously." He snorts.	“显而易见。”他从鼻子里出气。
0x0100000F000091E7	Dialogue Text	APT / STUDENT COMMUNIST	Steban, the Student Communist	"But, of course, our *special emphasis* is on the theories of Ignus Nilsen and his followers, especially the infra-materialists."	“不过当然，我们的*重点*还是伊格纳斯·尼尔森和他的追随者，尤其是亚唯物主义者们的理论。”
