ArticyId	TermType	ConvTitle	Actor	En	Zh
0x0100005700016107	Dialogue Text	APT / TOMAS THE SPONSOR	You	"What about the rest of Revachol? Is it part of the normal world?"	“那瑞瓦肖的其他地方呢？也是平常世界的一部分吗？”
0x010000570001610D	Dialogue Text	APT / TOMAS THE SPONSOR	Sunday Friend	"It's moving towards the right direction and that's all that matters. Progress is measured in centimetres, my friend."	“它正在朝正确的方向前进，这才是最重要的。进步是以厘米来衡量的，我的朋友。”
0x0100005700016113	Dialogue Text	APT / TOMAS THE SPONSOR	Sunday Friend	"Revachol is generally... difficult. It's led by an interim government, which means it hasn't yet achieved *full* democracy..."	“通常来说，瑞瓦肖……挺困难的。它由临时政府领导，这就意味着它还没有达到*完全的*民主……”
0x0100005700016119	Dialogue Text	APT / TOMAS THE SPONSOR	You	"And you're telling me *this* world here is working out well?"	“你是想告诉我，*这个*世界运转的不太好？”
0x010000570001611F	Dialogue Text	APT / TOMAS THE SPONSOR	Sunday Friend	"Sounds like you're a moralist indeed, my friend. Welcome."	“听起来你确实是个道德家，我的朋友。欢迎欢迎。”
0x0100005700016136	Dialogue Text	APT / TOMAS THE SPONSOR	You	"Yes, everything else is super extreme. It's like I'm living with a bunch of lunatics..."	“是的，其他一切都太极端了。比如说我，就跟一群疯子生活在一起……”
0x010000570001613C	Dialogue Text	APT / TOMAS THE SPONSOR	You	"Tell me about Sur-la-Clef."	“跟我说说苏拉菲。”
0x010000570001616F	Dialogue Text	APT / TOMAS THE SPONSOR	Sunday Friend	"Is this 'Option D' usually the most *reasonable* answer?"	“这个‘选项D’一般不都是最*合理*的答案吗？”
0x010000570001617B	Dialogue Text	APT / TOMAS THE SPONSOR	Sunday Friend	"Your full autonomy is important, I agree. But it's an ongoing process. Nothing happens overnight."	“我同意，完全自治权对于你们来说是很重要的。但这是一个不断前进的过程。没有什么是一夜之间就能发生的。”
0x0100005700016183	Dialogue Text	APT / TOMAS THE SPONSOR	You	"It's like every time I'm talking to people I'm choosing Option D, 'none of the above'... Is that moralism?"	“简直就像，每次和别人说话的时候我都会选D，'以上都不合适’……这就是道德主义？”
0x010000570001618E	Dialogue Text	APT / TOMAS THE SPONSOR	Sunday Friend	"Now, enough of this delightful political interlude. Was there anything else you wanted to ask?"	“好了，愉快的政治小插曲已经说得差不多了。你还有什么想问的吗？”
0x010000570001619A	Dialogue Text	APT / TOMAS THE SPONSOR	You	"I don't think I'm a moralist. Moralism sounds incredibly boring. I want more action."	“我不觉得自己是个道德家。道德主义听起来太无聊。我想要更多行动。”
0x01000057000161A5	Dialogue Text	APT / TOMAS THE SPONSOR	You	"Moralism is the ideology of foreign occupiers. Revachol must be governed by Revacholians!"	“道德主义是外国侵略者的意识形态。瑞瓦肖必须由瑞瓦肖人自己统治！”
0x01000057000161B9	Dialogue Text	APT / TOMAS THE SPONSOR	You	"Democracy is a meaningless sham as long as the working class is under the boot-heel of Capital."	“只要工人阶级还被踩在资本家的脚底，民主就是一场毫无意义的骗局。”
0x01000057000161C5	Dialogue Text	APT / TOMAS THE SPONSOR	Sunday Friend	"Ah, my friend, but the lesson of the Revolution is that communism does not work."	“啊，我的朋友，但大革命的教训就是，康米主义是行不通的。”
0x010000570001627E	Dialogue Text	APT / TOMAS THE SPONSOR	Sunday Friend	"A moment, officer."	“稍等一下，警官。”
0x0100005700016284	Dialogue Text	APT / TOMAS THE SPONSOR	You	"Thanks, I've got all I need." [Leave.]	“谢谢，我已经得到所有需要的信息了。”[离开。]
0x010000570001632D	Dialogue Text	APT / TOMAS THE SPONSOR	You	"The man who was lynched outside your window was from Oranje."	“在你窗外被处以私刑的男人是奥兰治来的。”
0x010000570001662E	Dialogue Text	APT / TOMAS THE SPONSOR	Sunday Friend	"You have acquired the hat." He assesses the situation. "Keep it, officer, it looks good on you."	“你拿到那顶帽子了。”他评估了一下眼前的形势。“留着吧，警官，你戴上很好看。”
0x0100005700016634	Dialogue Text	APT / TOMAS THE SPONSOR	Sunday Friend	"You have acquired the robe." He assesses the situation. "Keep it, officer, it looks good on you."	“你拿到制服了。”他评估了一下眼前的形势。“留着吧，警官，你穿着很好看。”
0x0100005700016665	Dialogue Text	APT / TOMAS THE SPONSOR	Sunday Friend	"You have acquired the hat." The man assesses the situation. "Keep it, officer, it looks good on you."	“你拿到那顶帽子了。”他评估了一下眼前的形势。“留着吧，警官，你戴上很好看。”
0x010000570001666B	Dialogue Text	APT / TOMAS THE SPONSOR	Sunday Friend	"You have acquired the robe." The man assesses the situation. "Keep it, officer, it looks good on you."	“你拿到制服了。”他评估了一下眼前的形势。“留着吧，警官，你穿着很好看。”
0x01000057000167F6	Dialogue Text	APT / TOMAS THE SPONSOR	Sunday Friend	"What's there to say? Sur-la-Clef is a modern, urbanized country that measures very high on the Human Development and Freedom Index. Mostly, though, it's known as the executive heart of *EPIS*..."	“有什么好说的呢？苏拉菲是一个现代化、城市化的国家，人类发展和自由的指标得分很高。不过，它主要还是以*EPIS*的行政中心而闻名……”
0x01000057000167FC	Dialogue Text	APT / TOMAS THE SPONSOR	Sunday Friend	"Oranje is an *exemplary* nation who, as a core member of EPIS, contributes 28% of our annual budget. Next to Sur-la-Clef, Oranje is probably the most prominent member of the international community."	“奥兰治是一个*模范*国家，作为EPIS的核心成员，它为我们贡献了28%的年度预算。奥兰治紧邻苏拉菲，可能是国际社会最杰出的成员之一。”
0x0100005700016802	Dialogue Text	APT / TOMAS THE SPONSOR	Sunday Friend	"Do you have everything you need from me? I'm afraid we won't have the chance to speak again once you leave."	“还有什么需要问我的吗？一旦你离开之后，恐怕就不会再有机会跟我说话了。”
0x0100005700016810	Dialogue Text	APT / TOMAS THE SPONSOR	You	"I'm not going anywhere, I just want to take a look around in this apartment." [Leave.]	“我哪里也不去，我只是想看看这个公寓。”[离开。]
0x0100005700016816	Dialogue Text	APT / TOMAS THE SPONSOR	You	"Thanks for the heads up, but my work here is done." [Leave.]	“感谢你的提醒，但是我在这里的工作已经完成了。”[离开。]
0x0100005700016821	Dialogue Text	APT / TOMAS THE SPONSOR	Sunday Friend	"Of course, I'm glad I could help."	“当然，很高兴能帮到你。”
0x010000570001682F	Dialogue Text	APT / TOMAS THE SPONSOR	You	"Hold on, why can't we talk later?"	“等等，为什么我们以后不能说话了？”
0x0100005700016837	Dialogue Text	APT / TOMAS THE SPONSOR	Sunday Friend	"Sure, go ahead, it's a beautiful space." He glances at his watch. "Let me know if you have any further questions."	“当然，请吧，这是个漂亮的地方。”他瞥了一眼手表。“如果你还有其他问题，直接说就好。”
0x010000570001683E	Dialogue Text	APT / TOMAS THE SPONSOR	Sunday Friend	"It's against diplomatic best practices for an official in my position to be discussing murders with local militiamen." He pauses. "And I'm pressed for time. After you leave, I should be leaving as well."	“像我这种地位的官员，跟一位本地民兵讨论谋杀案是违反外交最佳实践的。”他停顿了一下。“而且我的时间很紧张。你离开之后，我也要走了。“
0x0100005700016858	Dialogue Text	APT / TOMAS THE SPONSOR	Kim Kitsuragi	"No, that's not his..." the lieutenant sighs. "Martin Martinaise is a *joke*, a generic nickname for someone from Martinaise."	“不，不是他的……”警督叹了口气。“马丁·马丁内斯是个*玩笑话*，是马丁内斯人的通用昵称。”
0x010000570001685F	Dialogue Text	APT / TOMAS THE SPONSOR	Sunday Friend	"And my friend's not even your typical local -- definitely not just another Martin Martinaise or Raoul Revachol. Maybe that's why we're friends."	“而且我的朋友甚至都不是典型的本地人——肯定不是又一个马丁·马丁内斯，或者是拉乌尔·瑞瓦肖。也许这就是我们能成为朋友的原因。”
0x0100005700016C18	Dialogue Text	APT / TOMAS THE SPONSOR	Rhetoric	But that didn't tell you anything about Oranje.	但是这样还是不知道任何奥兰治的信息。
0x0100005700016C1F	Dialogue Text	APT / TOMAS THE SPONSOR	You	"Can't you just... talk like a normal person?"	“你能不能……像个普通人一样说话？”
0x0100005700016C25	Dialogue Text	APT / TOMAS THE SPONSOR	You	"I once heard from *here* that they are a reasonably sized superpower." (Tap your head.)	“我曾经在*这里*听说，它们是一股规模巨大的超级力量。”（拍拍你的脑袋。）
0x0100005700016C2D	Dialogue Text	APT / TOMAS THE SPONSOR	Sunday Friend	"That's one way to put it, yes. They certainly have the power to exert influence over others, but they only do it in the name of regional stability. After all, Oranje is a Moralintern nation, not some crazed Mesque petro-fascist state."	“这是一种说法，没错。它们的确拥有对其他国家产生影响的能力，但这也是为了维护地区稳定性而做的。毕竟奥兰治是一个道德主义国家，不是什么疯狂的梅斯克*石油法西斯主义*国家。”
0x0100005700016C34	Dialogue Text	APT / TOMAS THE SPONSOR	Sunday Friend	"About what?"	“关于什么的？”
0x0100005700016C3B	Dialogue Text	APT / TOMAS THE SPONSOR	You	"About Oranje -- just tell me what it's like there."	“关于奥兰治——跟我说说那里什么样。”
0x0100005700016C42	Dialogue Text	APT / TOMAS THE SPONSOR	Sunday Friend	"Oh, it's very urban and very well-organized. Their streets are clean, their horsecars run on time, the people are polite and efficient. Like I said, they are an example for less-emerged nations to follow."	“哦，它很城市化，而且井井有条。那里的街道很干净，轨道马车运行准时，人们礼貌又有效率。就像我说的，它是欠发达国家效仿的范例。”
0x0100005700016C4B	Dialogue Text	APT / TOMAS THE SPONSOR	You	"What makes Revachol Sur-la-Clef's 'darling'?"	“为什么瑞瓦肖会成为苏拉菲的‘宠儿’？”
0x0100005700016C52	Dialogue Text	APT / TOMAS THE SPONSOR	Sunday Friend	"Because a great percentage of Revachol's culture hails from Sur-la-Clef -- its language, its people, its cuisine even, or at least in the downtown La Delta area."	“因为瑞瓦肖文化有很大一部分都来自于苏拉菲——它的语言、人民，甚至是烹饪方法，至少在德尔塔市区是这样的。”
0x0100005700016C5F	Dialogue Text	APT / TOMAS THE SPONSOR	Perception (Taste)	Jamrock and other parts of the International Zone have been mercifully spared of Sur-la-Clef's love for meatballs and mashed potatoes.	加姆洛克和国际区的其他部分被仁慈地赦免了，不用分享苏拉菲对肉丸和土豆泥的热爱。
0x0100005700023210	Dialogue Text	APT / TOMAS THE SPONSOR	Suggestion	The tone somehow suggests to you that you're starting to become a little sponsored by him as well.	不知怎么的，这种语气暗示着他也有点开始支持你了。
0x0100005700023231	Dialogue Text	APT / TOMAS THE SPONSOR	Esprit de Corps	Superior? But he's not in the command chain...	上级？但他不在指挥链里……
0x0100005700023286	Dialogue Text	APT / TOMAS THE SPONSOR	You	(Point at the bed.) "Before we go on, I absolutely *have* to inquire about this wonderful canopy."	（指向床。）“在我们继续之前，我*必须*询问一下这个美妙的华盖。”
0x010000570002328C	Dialogue Text	APT / TOMAS THE SPONSOR	You	(Show him the silk robe.) "Before we get to that, tell me where you got this *beautiful* silk robe from?"	（把丝绸长袍拿给他看。）“在说那个之前，能告诉我这件*漂亮的*丝绸长袍是哪来的吗？”
0x0100005700023292	Dialogue Text	APT / TOMAS THE SPONSOR	You	(Show him the Samaran hat.) "We'll get to that. Right after you tell me the story behind the black Samaran hat."	（把萨马拉帽子拿给他看。）“之后会说到的。你先跟我说说这顶黑色萨马拉帽背后的故事吧。”
0x0100005700023298	Dialogue Text	APT / TOMAS THE SPONSOR	Suggestion	No, first ask an innocuous personal question to get the interview off on the right foot.	不，先问个无伤大雅的私人问题，让这从询问有个良好的开端。
0x010000570002329F	Dialogue Text	APT / TOMAS THE SPONSOR	Authority	Yes. Make it clear you're the one setting the terms here...	是的。明确一点，你才是这里定规矩的人……
0x01000057000232B3	Dialogue Text	APT / TOMAS THE SPONSOR	You	(Get down to business.) "Hello, Mr. Villedrouin. Let's get started."	（言归正传。）“你好，维尔德鲁安先生。我们开始吧。”
0x01000057000232CB	Dialogue Text	APT / TOMAS THE SPONSOR	Half Light	Yeah, *yeah*! Let's *fuck* with him! Who does he think he is, assisting *you*?	是啊，*是的*！去他妈的吧！他以为自己是谁，还说什么协助*你*？
0x01000057000232D3	Dialogue Text	APT / TOMAS THE SPONSOR	Conceptualization	Hanging? What a drag. He seems like a *cultured* gentleman -- you should ask him about the finer things...	绞刑？真无聊。他像是那种*有文化*的绅士——你应该问他些更精细的问题……
0x01000057000232E1	Dialogue Text	APT / TOMAS THE SPONSOR	Sunday Friend	"Of course. Let me just say it has been an emotional week for me." He forms a little rooftop with his fingers. Cold air comes in from the balcony.	“当然。对我来说，这周真的非常激动人心。”他把手指搭成一个小屋顶的形状。冷风从阳台上吹了进来。
0x01000057000232EE	Dialogue Text	APT / TOMAS THE SPONSOR	Kim Kitsuragi	The lieutenant takes out his notebook and nods to you to proceed.	警督拿出他的笔记本，点头示意你继续。
0x01000057000232FD	Dialogue Text	APT / TOMAS THE SPONSOR	You	(Point to the silk robe.) "Before we get to that, tell me where you got this *beautiful* silk robe from?"	（把丝绸长袍拿给他看。）“在说那个之前，能告诉我这件*漂亮的*丝绸长袍是哪来的吗？”
0x0100005700023303	Dialogue Text	APT / TOMAS THE SPONSOR	You	(Point to the Samaran hat.) "We'll get to that. Right after you tell me the story behind the black Samaran hat."	（把萨马拉帽子拿给他看。）“之后会说到的。你先跟我说说这顶黑色萨马拉帽背后的故事吧。”
0x0100005700023315	Dialogue Text	APT / TOMAS THE SPONSOR	Sunday Friend	"That's really all I can tell you about it." He forms a little rooftop with his fingers. Cold air sweeps in from the balcony.	“我真的只能说这么多了。”他把手指搭成一个小屋顶的形状。冷风从阳台上吹了进来。
0x010000570002332B	Dialogue Text	APT / TOMAS THE SPONSOR	Sunday Friend	"I got it from the head of the Samaran delegation on my trip to Lo-Manthang. It's made from a *special* charcoal-coloured bamboo. It's an emblem of the formal normalization of our diplomatic relations."	“这是去罗马丹的途中，我从萨马拉代表团团长那里得来的。它是用一种*特殊的*炭色竹子制成的，是我们外交关系常规化的象征。”
0x010000570002333A	Dialogue Text	APT / TOMAS THE SPONSOR	Sunday Friend	"Oh, we got it from an atelier in the East Delta Commerce Centre. Personally I think it's a little culturally insensitive, but the material is great. Sadly the shop is now out of business..."	“哦，我是从东德尔塔商业中心的一间工作室得到的。就我个人而言，我觉得它对文化有些不太敏感，不过材质非常好。可惜那家商店现在已经破产了……”
0x0100005700023349	Dialogue Text	APT / TOMAS THE SPONSOR	Rhetoric	He's alluding to the decade-long war of independence while deftly brushing aside the *complex* causes behind the conflict.	他一方面在暗指那场持续十年之久的独立战争，同时也巧妙地忽略了那场冲突背后*复杂*的原因。
0x0100005700023DB0	Dialogue Text	APT / TOMAS THE SPONSOR	Encyclopedia	Wait, there isn't actually an *Institute of Price Stabilité*, is there? Or maybe there is... God, it's impossible to understand whether someone from the Moralintern is joking or not.	等等，其实根本没有什么*物价稳定研究所*，对吧？或者可能有……天啦，要搞清楚国际道德伦理委员会的人是不是在开玩笑是不可能的。
0x0100005700023DBB	Dialogue Text	APT / TOMAS THE SPONSOR	Sunday Friend	"Moreover, it is a great sponsor of less-emerged countries. Revachol is only one of its many darlings whose progress it supports and cherishes."	“而且，它还是很多欠发展国家的大赞助方。瑞瓦肖只是它支持和珍视的众多宠儿之一。”
0x010000580001E07B	Dialogue Text	APT / TOMAS THE SPONSOR	Sunday Friend	"A *fugitive*?"	“一个*逃亡者*?”
0x010000580001E08A	Dialogue Text	APT / TOMAS THE SPONSOR	You	Say nothing.	一言不发。
0x0100006B000099EA	Dialogue Text	APT / TOMAS THE SPONSOR	Kim Kitsuragi	"Sounds like the victim was unconscious. Or at least incapacitated. Interesting."	“听起来被害人失去意识了。或者至少是丧失了行动能力。有点意思。”
0x0100007000005BDF	Dialogue Text	APT / TOMAS THE SPONSOR	Authority	That didn't work at all.	这根本一点用也没有。
0x0100007000005BE7	Dialogue Text	APT / TOMAS THE SPONSOR	Half Light	What was *that*?! You were supposed to *fuck* with him, not compliment the décor!	*那是*在干什么？！你应该给他*好看*，而不是恭维装饰品！
0x0100007000005BED	Dialogue Text	APT / TOMAS THE SPONSOR	Sunday Friend	"The economy impacts the entire *international community*, which is why it requires international oversight."	“经济影响了整个*国际社会*，这就是需要国际监管的原因。”
0x0100007000006121	Dialogue Text	APT / TOMAS THE SPONSOR	You	"You actually *witnessed* the lynching?"	“你实际上是*目击*了那次私刑吗？”
0x0100007000006127	Dialogue Text	APT / TOMAS THE SPONSOR	Sunday Friend	"I'm sorry to say I did, officer." The man gives a solemn nod.	“很抱歉的说，我确实看到了，警官。”男人郑重地点了点头。
0x010000700000612E	Dialogue Text	APT / TOMAS THE SPONSOR	You	(Turn to the lieutenant.) "This is just the break we've been looking for!"	（转向警督。）“这就是我们寻找的突破口！”
0x0100007000006134	Dialogue Text	APT / TOMAS THE SPONSOR	You	"Start from the beginning, if you don't mind."	“如果你不介意的话，请从最开头说起吧。”
0x010000700000613A	Dialogue Text	APT / TOMAS THE SPONSOR	You	"Is it because you did it, Mr. Villedrouin?"	“因为是你做的吗，维尔德鲁安先生？”
0x0100007000006143	Dialogue Text	APT / TOMAS THE SPONSOR	Sunday Friend	"Officer, it's very difficult to describe what I saw that night. It was so surreal to me, like in a play."	“警官，要描述那晚我看见的东西，真的很困难。对我来说太不真实了，就像一出戏剧。”
0x0100007000006149	Dialogue Text	APT / TOMAS THE SPONSOR	Drama	He holds out his hands and blossoms his fingers, like a drama teacher setting the scene.	他伸出双手，张开手指，像一个布置场景的戏剧老师。
0x0100007000006151	Dialogue Text	APT / TOMAS THE SPONSOR	Sunday Friend	"Because I *did it*?" the man scoffs.	“因为是我*做的*？”男人的口气有些嘲弄的意味。
0x0100007000006158	Dialogue Text	APT / TOMAS THE SPONSOR	Composure	He's clearly not a man accustomed to being spoken to in that manner, let alone to being accused of *murder*.	他显然不习惯别人用这种方式跟他说话，更不用说被指控*谋杀*了。
0x010000700000615F	Dialogue Text	APT / TOMAS THE SPONSOR	Sunday Friend	"I was on the balcony when it happened, getting some fresh air. I remember that first they came in, carrying what looked like a body, and then I saw all the surrounding windows go dead one-by-one..."	“事情发生的时候，我站在阳台上透气。我记得一开始他们走了进来，抬着一个类似人形的东西，然后我看见周围的窗户一个个地关上了……”
0x010000700000616B	Dialogue Text	APT / TOMAS THE SPONSOR	You	"My apologies, I misspoke. I mean, what did you see?"	“抱歉，我说错话了。我是说，你看见什么了？”
0x0100007000006171	Dialogue Text	APT / TOMAS THE SPONSOR	You	"Don't jerk my chain, paper-jockey. You did it, didn't you?"	“别戏弄我，坐办公室的家伙。就是你做的，对吗？”
0x0100007000006185	Dialogue Text	APT / TOMAS THE SPONSOR	Kim Kitsuragi	The lieutenant is already scribbling down notes. "What do you mean, 'like in a play'?"	警督已经开始潦草地做笔记了。“你说‘像一出戏剧’是什么意思？”
0x010000700000618C	Dialogue Text	APT / TOMAS THE SPONSOR	You	"Meaning it was terrifying?"	“意思是很可怕？”
0x0100007000006192	Dialogue Text	APT / TOMAS THE SPONSOR	You	"Meaning it was entertaining?"	“意思是让人很愉快？”
0x010000700000619A	Alternate1	APT / TOMAS THE SPONSOR	Sunday Friend	"It was just so strange. I could barely comprehend what was happening..."	“真的太奇怪了。我几乎不能理解到底发生了什么……”
0x010000700000619A	Dialogue Text	APT / TOMAS THE SPONSOR	Sunday Friend	"No, no." The man shakes his head. "I mean it was so strange I could barely believe what was happening..."	“不，不。”男人摇摇头。“我的意思是实在太奇怪了，我都不敢相信这一切真的发生了……”
0x01000070000061AB	Dialogue Text	APT / TOMAS THE SPONSOR	Kim Kitsuragi	"There is no meaning, sir. Please excuse my colleague. This case has... been a great strain on his nerves."	“没什么特别的意思，先生。请原谅我的同事。这个案子……给他的神经带来了不小的压力。”
0x01000070000061B1	Dialogue Text	APT / TOMAS THE SPONSOR	Sunday Friend	"What's the meaning of this?"	“这是什么意思？”
0x01000070000061B9	Dialogue Text	APT / TOMAS THE SPONSOR	You	"What gets on my nerves is *murderers*. Why'd you kill him, man?"	“让我心烦意乱的是*杀人犯*。你为什么要杀他，老兄？”
0x01000070000061BF	Dialogue Text	APT / TOMAS THE SPONSOR	You	"Kim's right. I'm sorry. I haven't been myself lately."	“金说得对。我很抱歉。我最近真的有些不太对劲。”
0x01000070000061C5	Dialogue Text	APT / TOMAS THE SPONSOR	You	"I'm sorry. Let's start over. My nerves got the best of me there."	“很抱歉。让我们重新开始吧。我的头脑有些不太清醒。”
0x01000070000061D0	Dialogue Text	APT / TOMAS THE SPONSOR	You	"It means the jig's up, creep. I am the law!"	“意思是抓到你了吧，死变态。我就是法律！”
0x01000070000061E0	Dialogue Text	APT / TOMAS THE SPONSOR	Sunday Friend	"Well, I can certainly understand *that*." The man loosens his tie knot and appears to relax slightly. "That hanging was a surreal play. Everything since then has been too..."	“呃，我确实能理解*那个*。”男人松开领结，好像稍微放松了些。“那场绞刑是一出超现实主义戏剧。那之后发生的一切也是如此……”
0x01000070000061F3	Dialogue Text	APT / TOMAS THE SPONSOR	Sunday Friend	"I won't stand for this." His left eye starts twitching -- as the last warning. "What's your name? I'll have your badge!"	“这我可不能忍受。”他的左眼开始抽搐——就像在发出最后的警告。“你叫什么名字？把你的警徽拿出来！”
0x01000070000061FB	Dialogue Text	APT / TOMAS THE SPONSOR	You	"*I* don't even have my badge -- so spin on this!" (Give him the finger.)	“*我*连警徽都没有——所以给你这个吧！”（朝他竖起中指。）
0x0100007000006201	Dialogue Text	APT / TOMAS THE SPONSOR	You	"I'm in-between names right now."	“我现在还游离在各种名字中间呢。”
0x0100007000006210	Dialogue Text	APT / TOMAS THE SPONSOR	You	"My name's Harry."	“我叫哈里。”
0x0100007000006216	Alternate1	APT / TOMAS THE SPONSOR	You	"Lieutenant-yefreitor Harrier Du Bois."	“荣誉警督哈里尔·杜博阿。”
0x0100007000006216	Dialogue Text	APT / TOMAS THE SPONSOR	You	"Harrier Du Bois, and don't forget it."	“哈里尔·杜博阿，你可别忘了。”
0x010000700000621E	Dialogue Text	APT / TOMAS THE SPONSOR	You	"You can just call me *The Law*."	“你可以直接叫我*法律*。”
0x0100007000006224	Dialogue Text	APT / TOMAS THE SPONSOR	You	"I am Detective Raphaël Ambrosius Costeau, at your service."	“我是拉斐尔·安普罗修斯·科斯泰，乐意为你效劳。”
0x010000700000622A	Alternate1	APT / TOMAS THE SPONSOR	You	"I *prefer* to be called Tequila Sunset."	“我*更喜欢*别人叫我龙舌兰日落。”
0x010000700000622A	Dialogue Text	APT / TOMAS THE SPONSOR	You	"Around these parts I go by Tequila... Tequila Sunset."	“在这一带我叫龙舌兰……龙舌兰日落。”
0x0100007000006235	Dialogue Text	APT / TOMAS THE SPONSOR	Sunday Friend	"Very well, *Harry*. You're a disgrace to the RCM. Get out of my sight, this instant!" He points at the door.	“很好，*哈里*。你是RCM的耻辱。滚出我的视线，马上！”他指向大门。
