ArticyId	TermType	ConvTitle	Actor	En	Zh
_1mhhwg41z_4onp3	Dialogue Text	Flow – PLAZA / SUGGESTION JACKET EPIC / Flow – EPIC SUGGESTION	You	"It's okay, Kim. Here, you take this one. *I'm* the Pissf****t now."	
_70c1wb1zyqg_m25	Dialogue Text	Flow – PLAZA / SUGGESTION JACKET EPIC / Flow – EPIC SUGGESTION	Rhetoric	There's another way we can go with this: *Frame-control*. Flip the situation on its head. Make them play by *your rules*.	
_j5r4j92_7uncu9g	Dialogue Text	Flow – PLAZA / SUGGESTION JACKET EPIC / Flow – EPIC SUGGESTION	Half Light	Now he is become the *Pissf****t*. There's no stopping you now.	
_v2h8db1x7j3xjy8	Dialogue Text	Flow – PLAZA / SUGGESTION JACKET EPIC / Flow – EPIC SUGGESTION	Kim Kitsuragi	"Damnit, detective. Give me the piss-jacket."	
0_ra43otq_w8pwq_	Dialogue Text	Flow – PLAZA / SUGGESTION JACKET EPIC / Flow – EPIC SUGGESTION	You	I feel silly. People are looking. I'm gonna take it off. (Discard thought.)	
0do45t41a0ej2_o0	Dialogue Text	Flow – PLAZA / SUGGESTION JACKET EPIC / Flow – EPIC SUGGESTION	You	"No-no, Kim. We *just* committed to the bit. We gotta stick with it for a while."	
0r36jgcg2plkbp5u	Dialogue Text	Flow – PLAZA / SUGGESTION JACKET EPIC / Flow – EPIC SUGGESTION	Rhetoric	'What was that, that's not how woooooords are used, say it again', giggles-giggles. Classic shit-test. That was your chance to just *own* it.	
1_aw2dtcu3m4p07k	Dialogue Text	Flow – PLAZA / SUGGESTION JACKET EPIC / Flow – EPIC SUGGESTION	Suggestion	If you can't even wear it outside for everyone to see then yes, time to abandon rock and roll.	
14i4ca4gyoq9cu2k	Dialogue Text	Flow – PLAZA / SUGGESTION JACKET EPIC / Flow – EPIC SUGGESTION	Rhetoric	Fine, go with whatever you want. You have multiple solid options.	
1gxz3bzo90nq18e2	Dialogue Text	Flow – PLAZA / SUGGESTION JACKET EPIC / Flow – EPIC SUGGESTION	You	"Weird, it looked *so* much cooler in my head."	
1mhdecnl63xltyr9	Dialogue Text	Flow – PLAZA / SUGGESTION JACKET EPIC / Flow – EPIC SUGGESTION	You	"Forget it, this was a stupid idea." (Abandon the effort.)	
1mszucv5wvonjpda	Dialogue Text	Flow – PLAZA / SUGGESTION JACKET EPIC / Flow – EPIC SUGGESTION	Kim Kitsuragi	"Mhm. This is one of those times where you're just going to keep talking no matter what I say, isn't it?"	
1oouicpxsbuf3h1u	Dialogue Text	Flow – PLAZA / SUGGESTION JACKET EPIC / Flow – EPIC SUGGESTION	You	It was a rough morning, let's not revisit it.	
2r5orlkkc0oe0fym	Dialogue Text	Flow – PLAZA / SUGGESTION JACKET EPIC / Flow – EPIC SUGGESTION	You	"Oh, *I* see... Look, I can wear the 'Pissfa***t' jacket if that's the problem."	
57l8_15vqduhawam	Dialogue Text	Flow – PLAZA / SUGGESTION JACKET EPIC / Flow – EPIC SUGGESTION	You	Yawn and stretch like a leather-clad panther.	
5gqc_if6kklz853b	Dialogue Text	Flow – PLAZA / SUGGESTION JACKET EPIC / Flow – EPIC SUGGESTION	Kim Kitsuragi	"The 'cool-factor' might hit me later." The lieutenant fingers the brown studded lapels. "Right now it feels like a joke gone too far."	
6_densvq7j62u4bx	Dialogue Text	Flow – PLAZA / SUGGESTION JACKET EPIC / Flow – EPIC SUGGESTION	Kim Kitsuragi	"It's..." the lieutenant slowly shakes his head, "not a good look. Doesn't exactly signal shit-together-ness."	
6i27kgnj6n2qsotm	Dialogue Text	Flow – PLAZA / SUGGESTION JACKET EPIC / Flow – EPIC SUGGESTION	Kim Kitsuragi	"..."	
6nh2lc3rrx760lc4	Dialogue Text	Flow – PLAZA / SUGGESTION JACKET EPIC / Flow – EPIC SUGGESTION	Kim Kitsuragi	"Never has anyone asked me to place more trust in them than you're asking of me, right now. If you saw this branch out from under me while I've got 'Pissf****t' written on my back..."	
7tpo0leow4pd4sy3	Dialogue Text	Flow – PLAZA / SUGGESTION JACKET EPIC / Flow – EPIC SUGGESTION	You	Do a little twirl.	
83vawnk56rowwvdu	Dialogue Text	Flow – PLAZA / SUGGESTION JACKET EPIC / Flow – EPIC SUGGESTION	You	"It's not a problem. Here, *I'll* put on the Pissf****t jacket right now..."	
8ng8b6zorpwr5j0w	Dialogue Text	Flow – PLAZA / SUGGESTION JACKET EPIC / Flow – EPIC SUGGESTION	Kim Kitsuragi	He sighs. "I'm afraid the RCM is going to have our asses for this."	
978znoiexix7gysm	Dialogue Text	Flow – PLAZA / SUGGESTION JACKET EPIC / Flow – EPIC SUGGESTION	Suggestion	You've got to work your way into this thing. The subtle way. Wind him up a little, don't immediately go for the kill.	
9drm9q539wtgw1zy	Dialogue Text	Flow – PLAZA / SUGGESTION JACKET EPIC / Flow – EPIC SUGGESTION	Kim Kitsuragi	"Let's be clear about one thing. The first chance I get, this thing's coming off. And that will be it -- no take-backs, no 'follow-up conversations', that's it. Do you understand?"	
ac2jsi89tv7_6dm9	Dialogue Text	Flow – PLAZA / SUGGESTION JACKET EPIC / Flow – EPIC SUGGESTION	Reaction Speed	Officer in the bag! Officer in the bag!	
as6cb_2fb9__t4js	Dialogue Text	Flow – PLAZA / SUGGESTION JACKET EPIC / Flow – EPIC SUGGESTION	You	"Tell me, Kim: What are the odds that after *all that* they fail to solve the case while wearing these two jackets?"	
avpyp_0mav4v7qkm	Dialogue Text	Flow – PLAZA / SUGGESTION JACKET EPIC / Flow – EPIC SUGGESTION	Kim Kitsuragi	"You mean any more than I already am?" He looks around. "We better solve this case *fast* officer. I'm not 100% comfortable with this."	
bda_rgp9f81v1llb	Dialogue Text	Flow – PLAZA / SUGGESTION JACKET EPIC / Flow – EPIC SUGGESTION	Kim Kitsuragi	"Alright, that was fun. But not really," he adds, slipping back into his familiar bomber. "Enough time wasted. Let's get back to work."	
bexg7cnl4d001fw9	Dialogue Text	Flow – PLAZA / SUGGESTION JACKET EPIC / Flow – EPIC SUGGESTION	Kim Kitsuragi	With a look of utter disbelief the lieutenant slips into the jacket...	
cxllvkwy0ryzexnv	Dialogue Text	Flow – PLAZA / SUGGESTION JACKET EPIC / Flow – EPIC SUGGESTION	Rhetoric	It was sub-par delivery, not a lack of technique that failed you there. You could've still saved it, had you not failed her shit-test.	
d58udvbfo2t46p0d	Dialogue Text	Flow – PLAZA / SUGGESTION JACKET EPIC / Flow – EPIC SUGGESTION	Kim Kitsuragi	"The odds are *quite* high," the lieutenant replies, rubbing his forehead. "It doesn't care if we're in leather jackets that say 'Fuck the World' and 'Pissf****t' on their backs..."	
dnu13ay8m7eqqo9h	Dialogue Text	Flow – PLAZA / SUGGESTION JACKET EPIC / Flow – EPIC SUGGESTION	Drama	This is not how one gives speeches, milord -- why antagonise the lieutenant? Try again.	
eblef399ceiah_hp	Dialogue Text	Flow – PLAZA / SUGGESTION JACKET EPIC / Flow – EPIC SUGGESTION	Kim Kitsuragi	"That's not what I was saying, detective."	
ghtgy06vvn12nq7t	Dialogue Text	Flow – PLAZA / SUGGESTION JACKET EPIC / Flow – EPIC SUGGESTION	You	"Look at us, Kim! This is how we were meant to be."	
i2_z1whnnogs1r5_	Dialogue Text	Flow – PLAZA / SUGGESTION JACKET EPIC / Flow – EPIC SUGGESTION	Kim Kitsuragi	"Alright, Fuck," the lieutenant turns to you. "Time to solve a murder, as counter-intuitive as it might seem in these jackets. Let's go."	
ik0rpoexw_ex7ymh	Dialogue Text	Flow – PLAZA / SUGGESTION JACKET EPIC / Flow – EPIC SUGGESTION	Kim Kitsuragi	"That's what I'm afraid of," he mumbles. More to himself than anyone else. "We better solve this thing fast."	
jhjqffc0zceaz5gn	Dialogue Text	Flow – PLAZA / SUGGESTION JACKET EPIC / Flow – EPIC SUGGESTION	Esprit de Corps	I can't believe I've climbed aboard the piss-train.	
kb1cbphs1nvwcb11	Dialogue Text	Flow – PLAZA / SUGGESTION JACKET EPIC / Flow – EPIC SUGGESTION	Rhetoric	But the lieutenant isn't going to shit-test you. You've got multiple valid options here.	
kfrkiuvih9rcdoai	Dialogue Text	Flow – PLAZA / SUGGESTION JACKET EPIC / Flow – EPIC SUGGESTION	Kim Kitsuragi	"The problem is..." the lieutenant says, glancing at the lapels, sleeves, and studs, "it really *does* look cool to have both of these jackets on right now."	
kzoazazfvmmt2wd5	Dialogue Text	Flow – PLAZA / SUGGESTION JACKET EPIC / Flow – EPIC SUGGESTION	You	"Wish you could see yourself right now, Kim." (Wipe your eye.)	
mx45ygfo0nl56wxx	Dialogue Text	Flow – PLAZA / SUGGESTION JACKET EPIC / Flow – EPIC SUGGESTION	Inland Empire	Feels like you've failed the biggest shit-test of them all...	
oczns153kkq2z5j7	Dialogue Text	Flow – PLAZA / SUGGESTION JACKET EPIC / Flow – EPIC SUGGESTION	Suggestion	Of course, if being outside, looking like a rock-lion is making you 'feel silly', then just drop the whole thing.	
ost86mecx83v5ojc	Dialogue Text	Flow – PLAZA / SUGGESTION JACKET EPIC / Flow – EPIC SUGGESTION	You	"You will *not* regret this, lieutenant!"	
ox8vuacurlw8k9i1	Dialogue Text	Flow – PLAZA / SUGGESTION JACKET EPIC / Flow – EPIC SUGGESTION	Reaction Speed	Plough ahead! Don't let him slow you down.	
pqeae_31zw8rldn7	Dialogue Text	Flow – PLAZA / SUGGESTION JACKET EPIC / Flow – EPIC SUGGESTION	You	Wait, what 'shit-test'?	
q0hiiau6ca8899oj	Dialogue Text	Flow – PLAZA / SUGGESTION JACKET EPIC / Flow – EPIC SUGGESTION	Conceptualization	'Subtle' like the aesthetic cacophony the two of you are making right now? Look at this shit. The visual fields make no sense. You're like a pair of white socks in brown sandals right now. It's disgusting.	
qgrekchzdpl7v7q_	Dialogue Text	Flow – PLAZA / SUGGESTION JACKET EPIC / Flow – EPIC SUGGESTION	Reaction Speed	Doesn't need to, your shit is compact as a diamond.	
qnuf4sx4uk9rwsgc	Dialogue Text	Flow – PLAZA / SUGGESTION JACKET EPIC / Flow – EPIC SUGGESTION	You	"Kim, you and I -- this dynamo duo -- me in the 'Fuck the World' jacket and you in that old bomber jacket... Visually it just doesn't make sense any more."	
qw4kkct_ihxlgz80	Dialogue Text	Flow – PLAZA / SUGGESTION JACKET EPIC / Flow – EPIC SUGGESTION	Suggestion	He means it. The moment your jacket comes off, so does his. That means you're probably going to have to keep fucking the world till the end of days.	
qwd0fmr40k0zygl1	Dialogue Text	Flow – PLAZA / SUGGESTION JACKET EPIC / Flow – EPIC SUGGESTION	You	"Fortunately for you, I'm *still* holding on to this sweet-as-fuck 'Pissf****t" jacket... Funny how life is sometimes..."	
r8pf61umvultyl7o	Dialogue Text	Flow – PLAZA / SUGGESTION JACKET EPIC / Flow – EPIC SUGGESTION	Endurance	A shit-test is something wömen give men to see how strong their frame is, how confident they are. Fail it and they'll bail for another, more dominant alpha-male. It's in their nature.	
r8vq2mi4y5xcy6z7	Dialogue Text	Flow – PLAZA / SUGGESTION JACKET EPIC / Flow – EPIC SUGGESTION	Kim Kitsuragi	A long moment passes as the lieutenant considers his words.	
rp_9o_56nwnnb5se	Dialogue Text	Flow – PLAZA / SUGGESTION JACKET EPIC / Flow – EPIC SUGGESTION	Kim Kitsuragi	"Detective... what are you talking about?"	
s_am_8ylx5p09l4e	Dialogue Text	Flow – PLAZA / SUGGESTION JACKET EPIC / Flow – EPIC SUGGESTION	You	"Piss and Fuck on the case, all-in, busting the bank!"	
s46ar5z9hvqwvnk6	Dialogue Text	Flow – PLAZA / SUGGESTION JACKET EPIC / Flow – EPIC SUGGESTION	Kim Kitsuragi	"The odds are *very high*, officer. It's situations like this that make me afraid I'll end up being the cretin-cop with 'Pissf****t' on his back..."	
sxv3w6u0ulzkwuvg	Dialogue Text	Flow – PLAZA / SUGGESTION JACKET EPIC / Flow – EPIC SUGGESTION	Kim Kitsuragi	"Yes, you're really showing off that... aggressive slogan there."	
t0e6khb39plvnz3f	Dialogue Text	Flow – PLAZA / SUGGESTION JACKET EPIC / Flow – EPIC SUGGESTION	You	"Imagine two cops, who've only known each other for a few days, yet such is their devotion, their bond, that they don *these* two jackets -- 'Fuck the World' and 'Pissf****t'..."	
tfexnpsqus068c2c	Dialogue Text	Flow – PLAZA / SUGGESTION JACKET EPIC / Flow – EPIC SUGGESTION	Suggestion	Good. Step one complete. Now, let the lieutenant feast his eyes on the fruit of the tree of cool.	
tigjcv05zmlbiawq	Dialogue Text	Flow – PLAZA / SUGGESTION JACKET EPIC / Flow – EPIC SUGGESTION	You	"You said you'd wear 'Pissf****t', but you realised you're more 'Fuck-the-World'. And that's totally fine..."	
tjz3_tbi42aj3m4n	Dialogue Text	Flow – PLAZA / SUGGESTION JACKET EPIC / Flow – EPIC SUGGESTION	You	"Lieutenant, I'm gonna be honest for a moment: You look like shit."	
ubvc3xia_6nxxp93	Dialogue Text	Flow – PLAZA / SUGGESTION JACKET EPIC / Flow – EPIC SUGGESTION	Kim Kitsuragi	"Very rock and roll, but is now really the time?"	
uln_tp4t4d9s8rdq	Dialogue Text	Flow – PLAZA / SUGGESTION JACKET EPIC / Flow – EPIC SUGGESTION	Kim Kitsuragi	"I can't believe you talked me into this," he mumbles. "We better solve this thing fast."	
v12tukx0x02tbwkj	Dialogue Text	Flow – PLAZA / SUGGESTION JACKET EPIC / Flow – EPIC SUGGESTION	Kim Kitsuragi	"I agree. Fortunately we have plenty of work to occupy us. Let's get back to it."	
wcpzoy0yetsizmav	Dialogue Text	Flow – PLAZA / SUGGESTION JACKET EPIC / Flow – EPIC SUGGESTION	Kim Kitsuragi	"I know exactly what you're trying to do, detective, and it's *not* going to work."	
xz05_57zdd70f_kp	Dialogue Text	Flow – PLAZA / SUGGESTION JACKET EPIC / Flow – EPIC SUGGESTION	You	"The RCM isn't gonna solve this, Kim. You and I are. Together." (Hold out the jacket.)	
y8l7oosnmp47e2_6	Dialogue Text	Flow – PLAZA / SUGGESTION JACKET EPIC / Flow – EPIC SUGGESTION	Composure	He's looking around nervously, regrets putting the jacket on, wants to take it off.	
ygnsa_x3ia096sls	Dialogue Text	Flow – PLAZA / SUGGESTION JACKET EPIC / Flow – EPIC SUGGESTION	You	Shake the lapels of your jacket and look at the lieutenant defiantly.	
yj45ur__0gkfh76p	Dialogue Text	Flow – PLAZA / SUGGESTION JACKET EPIC / Flow – EPIC SUGGESTION	You	Hold on... 'Frame-control'? 'I-wanna-have-fuck-with-you' kind of frame-control?	
yq6k2ax7mx1b7hk9	Dialogue Text	Flow – PLAZA / SUGGESTION JACKET EPIC / Flow – EPIC SUGGESTION	Kim Kitsuragi	"I disagree," he says with a small nod. "In fact if we were to do a poll right now, a little 'who looks like shit'-poll, I'm fairly confident you'd come out on top."	
