ArticyId	TermType	ConvTitle	Actor	En	Zh
0x010000060001B37B	Dialogue Text	Flow – PLAZA ORB / wearing skullboy jackets	You	Damn right I'm dangerous.	你他妈真说对了，我就是很危险。
0x010000060001B381	Dialogue Text	Flow – PLAZA ORB / wearing skullboy jackets	You	Yeah -- a danger to *myself*. What am I doing? This is insane.	是啊——对于*我自己*来说很危险。我在做什么呢？简直是太疯狂了。
0x010000060001B38A	Dialogue Text	Flow – PLAZA ORB / wearing skullboy jackets	Composure	Oh no, believe me -- it will be *everyone else* who's uncomfortable with it. You're safe. No one dares say a word -- unless they're, like, from your station and coming to *judge* you. But what are the chances of that happening?	哦不，相信我——会为此感到不舒服的是*其他人*。你是安全的。没有人敢说半个字——除非他们，比如说，是你警局的同事，专门来*评判*你的。但是这种几率又能有多大呢？
0x0100006B000025D3	Dialogue Text	Flow – PLAZA ORB / wearing skullboy jackets	Composure	You've finally made it haven't you? People point fingers at you and whisper to each other when you pass by, wondering to themselves:	你总算是做到了，不是吗？大家路过的时候都会用手指着你，彼此之间窃窃私语，他们一定想知道：
0x0100006B000025D9	Dialogue Text	Flow – PLAZA ORB / wearing skullboy jackets	Composure	You are very dangerous, my friend. Dangerous and cool. In fact, no one dares to say *a single thing* about the jacket. But believe me, they are all *very impressed*.	你很危险，我的朋友。又酷又危险。事实上，没人敢对这件夹克有*任何意见*。但是相信我，他们全都*被你打动了*。
0x0100006B00004779	Dialogue Text	Flow – PLAZA ORB / wearing skullboy jackets	Composure	"Where did that man get such a cool jacket? Did he receive it upon graduating the École normale supérieure de Bad-Assery? Is he *dangerous?*"	“那个男人从哪里找来这么酷的一件夹克？是从巴黎高等混账师范学院得到的毕业礼物吗？他很*危险*吗？
