ArticyId	TermType	ConvTitle	Actor	En	Zh
0x01000045000128AA	Dialogue Text	KIM SWITCH / DISCUSSING KLAASJE DOWNSTAIRS	You	(Whisper.) "She has half my skillset compromised, singing her tune. My assessments of her are untrustworthy."	（低语。）“她自己很有一套，对我一半的技能都有抵抗力。我对她的评价完全靠不住。”
0x01000045000128B2	Dialogue Text	KIM SWITCH / DISCUSSING KLAASJE DOWNSTAIRS	Kim Kitsuragi	"She seemed forthcoming to me... Unusually so. Being forthcoming with some things is a good way to obscure other things. But I wouldn't call myself compromised..."	“在我看来，她看起来很愿意提供信息……一般都是这样。很乐意提供某些事的信息，是掩盖其他事的好办法。但我自己也不是一个容易妥协的人……”
0x01000045000128C5	Dialogue Text	KIM SWITCH / DISCUSSING KLAASJE DOWNSTAIRS	You	"Perhaps that's because you *are*?"	“也许是因为你*就是*这样的？”
0x01000045000128CB	Dialogue Text	KIM SWITCH / DISCUSSING KLAASJE DOWNSTAIRS	You	"Well. I am, anyway."	“呃，我是，无所谓了。”
0x01000045000128D3	Dialogue Text	KIM SWITCH / DISCUSSING KLAASJE DOWNSTAIRS	Kim Kitsuragi	"I am not easily swayed by young women. But on the other hand... the best liars are candid. And she was candid."	“我不会轻易被年轻女人影响。不过话又说回来……最好的骗子都是很坦率的。而且她也很坦率。”
0x01000045000128D9	Dialogue Text	KIM SWITCH / DISCUSSING KLAASJE DOWNSTAIRS	Kim Kitsuragi	"Anyway, we should move. I suspect our investigation will bring us back soon enough."	“不管怎么说，我们该走了。我想问询工作很快会把我们带回到这里。”
0x01000045000128DF	Dialogue Text	KIM SWITCH / DISCUSSING KLAASJE DOWNSTAIRS	Volition	The lieutenant seems oddly sure he is not compromised, not psychologically at least. Is it hubris?	警督对自己不会妥协这一点好像有种奇怪的执着，至少心理上没有。难道是因为傲慢吗？
0x0100000500002CC1	Dialogue Text	KIM SWITCH / DOOMED	You	"Let's go get the flashlight then."	“那我们就去拿手电筒吧。”
0x0100000500002CC8	Dialogue Text	KIM SWITCH / DOOMED	Kim Kitsuragi	The lieutenant nods.	警督点点头。
0x0100000500002CD7	Dialogue Text	KIM SWITCH / DOOMED	Kim Kitsuragi	"No need to look for *supra-natural* explanations where a banal one will do. Now, let's go get the flashlight, shall we?"	“没必要寻找什么*超自然*解释，用老一套的理由就够了。我们先去拿手电筒吧，怎么样？”
0x0100000500002CE5	Dialogue Text	KIM SWITCH / DOOMED	Kim Kitsuragi	"Now, let's move on, shall we?"	“现在，我们该继续前进了，走吧？”
0x010000060001A406	Dialogue Text	KIM SWITCH / DOOMED	Kim Kitsuragi	"You didn't *have* to ram the door down, you know..." He looks around. "No one's been here for ages."	“*没必要*把门撞开，你知道的……”他看了看这个“很久没人待过的地方”。
0x0100002D000001B9	Dialogue Text	KIM SWITCH / DOOMED	Kim Kitsuragi	"I doubt the electricity still works... Good thing we have a flashlight on us."	“不知道电还有没有用……还好我们身上带着手电筒。”
0x0100005700021DD0	Dialogue Text	KIM SWITCH / DOOMED	You	"Looks like a gym to me."	“在我看来像是健身房。”
0x0100005700021DD6	Dialogue Text	KIM SWITCH / DOOMED	You	"It's the netherworld. Beyond the veil."	“这是阴间。是来世。”
0x0100005700021DDC	Dialogue Text	KIM SWITCH / DOOMED	You	"No idea, Kim... but my head hurts... my head hurts *bad*."	“不知道，金……但我的脑袋很疼……我的脑袋伤的*很重*。”
0x0100005700021DE5	Dialogue Text	KIM SWITCH / DOOMED	Kim Kitsuragi	"No, it's a gym," he disagrees. "Though it looks like no one's been here in ages..."	“不，这是个健身房，”他不同意这个看法。“不过看起来已经很久没人了……”
0x0100005700021DFD	Dialogue Text	KIM SWITCH / DOOMED	Kim Kitsuragi	"Yes, but no one's been here in ages." He draws a stripe on the dusty floor with his foot...	“是的，不过已经很久没人来过这里了。”他的脚在满是灰尘的地板上拖出一条痕迹……
0x0100005700021E04	Dialogue Text	KIM SWITCH / DOOMED	Kim Kitsuragi	"We don't *have to* explore an abandoned gym, you know. Besides, no one's been here in ages..."	“我们*没必要*探索一个废弃的健身房，你应该知道的。再说，已经很久没人来过这里了……”
0x0100005700021E12	Dialogue Text	KIM SWITCH / DOOMED	You	"It's an adventure!"	“这是场冒险！”
0x0100005700021E32	Dialogue Text	KIM SWITCH / DOOMED	Perception (Sight)	Some specks of dust shimmer in a faint beam of daylight falling from the window. Other than that, the room is dark.	窗户上落下些许灰尘，在日光下闪烁着点点光芒。除此之外，这个房间一片漆黑。
0x0100005700021E37	Dialogue Text	KIM SWITCH / DOOMED	Kim Kitsuragi	"I doubt the electricity still works... We should find a flashlight if we want to go on. There should be one in my Kineema."	“不知道电还能不能用……如果想继续调查的话，应该找个手电筒。我的锐影里应该有一只。”
0x0100005700021E43	Dialogue Text	KIM SWITCH / DOOMED	Perception (Sight)	Some specks of dust shimmer in a ray of streetlight falling from the window. Other than that, the room is dark.	窗户上落下些许灰尘，在街灯的照耀下闪烁着点点光芒。除此之外，这个房间一片漆黑。
0x0100005700021E50	Dialogue Text	KIM SWITCH / DOOMED	Kim Kitsuragi	"I doubt the electricity still works... Good thing we have a flashlight on us. Don't forget to take it out of your bag before we move on."	“不知道电还能不能用……还好我们身上带着手电筒。走之前记得先从包里拿出来。”
0x0100005700021E64	Dialogue Text	KIM SWITCH / DOOMED	Inland Empire	An eerie feeling rises in your chest...	一种奇异的感觉涌上你的心头……
0x0100005700021E71	Dialogue Text	KIM SWITCH / DOOMED	You	"What if there's a *reason* why no one's been here for ages..."	“如果这里这么多年没人是有*原因*的呢……”
0x0100005700021E77	Dialogue Text	KIM SWITCH / DOOMED	You	"Let's just keep going, I'm sure it's just a regular abandoned house, nothing mysterious here."	“我们还是走吧，我肯定这里只是个普通的废弃房屋，没什么神秘的。”
0x0100005700021E80	Dialogue Text	KIM SWITCH / DOOMED	Kim Kitsuragi	"Sounds good."	“听起来不错。”
0x0100005700021E88	Dialogue Text	KIM SWITCH / DOOMED	Kim Kitsuragi	"Yes, because it's *closed*..."	“是的，因为这里*关门*了……”
0x0100005700021E8F	Dialogue Text	KIM SWITCH / DOOMED	Kim Kitsuragi	"No need to look for *supra-natural* explanations where a banal one will do. Now, let's move on, shall we?"	“没必要寻找什么*超自然*解释，用老一套的理由就够了。我们该走了吧？”
0x0100005700021F9E	Dialogue Text	KIM SWITCH / DOOMED	You	"I think this may be the Artemitep's Boxing Club For Young Athletes."	“我觉得可能是针对青少年运动员的阿特米普拳击俱乐部。”
0x0100005700021FA5	Dialogue Text	KIM SWITCH / DOOMED	Kim Kitsuragi	"I think you're right," he says. "Though it looks like no one's been here in ages..."	“我觉得你说的对，”他说道。“不过看起来已经很久没人来过了……”
0x01000092000021C7	Dialogue Text	KIM SWITCH / DOOMED	Kim Kitsuragi	"Now, let's go get the flashlight, shall we?"	“我们去拿手电筒吧，怎么样？”
0x01000002000011B7	Dialogue Text	KIM SWITCH / END OF DAY	Kim Kitsuragi	"We can pick up where we left off tomorrow morning."	警督点点头。“明天一早我们可以继续没完成的工作。”
0x010000580000600C	Dialogue Text	KIM SWITCH / END OF DAY	You	"I haven't paid the cafeteria manager for damages yet."	“我还没有向餐厅经理赔偿损失。”
0x0100005800006046	Dialogue Text	KIM SWITCH / END OF DAY	You	"But I don't have the money..."	“但是我没钱……”
0x010000580000606C	Dialogue Text	KIM SWITCH / END OF DAY	Empathy	He's proud of you for getting your act together and finding a way to pay back what you owe.	你终于振作起来，想办法还清了自己的债务，这让他为你感到骄傲。
0x0100005800006083	Dialogue Text	KIM SWITCH / END OF DAY	Kim Kitsuragi	"Let's talk to him anyway. An officer of the RCM shouldn't be sleeping in the streets. We'll figure something out."	“不管怎么说，我们还是去跟他聊聊吧。RCM的警官不应该睡在大街上。我们会想出办法的。”
0x010000580000608A	Dialogue Text	KIM SWITCH / END OF DAY	Empathy	Though he finds this situation frustrating, he is doing his best to not make you feel any worse than you already do.	虽然他发现眼下的状况让人有些沮丧，不过还是打算尽自己最大努力，让你的感觉不要比现在更糟糕。
0x0100005800008B77	Dialogue Text	KIM SWITCH / END OF DAY	You	"Yes, my hostel room calls."	“是的，我的旅社房间在呼唤。”
0x0100005800008B7D	Dialogue Text	KIM SWITCH / END OF DAY	You	"I found lodgings in the village. I'll spend the night there."	“我在村庄里发现一些住所，打算去那里过夜。”
0x0100005800008B85	Dialogue Text	KIM SWITCH / END OF DAY	Kim Kitsuragi	"Good to know. I'll be wherever is necessary in the morning. Bright and early, 7:30 sharp."	警督点点头。“很高兴知道这个。早上我会出现在那个地方。明天一大早，7:30分整。”
0x0100005800008B97	Dialogue Text	KIM SWITCH / END OF DAY	Kim Kitsuragi	"I'll also take a room at the Whirling."	“我也去飞旋旅社开个房间。”
0x0100005800008BBD	Dialogue Text	KIM SWITCH / END OF DAY	You	"I think I have the money now. This is money, right?" (Show him reál bills.)	“我现在好像有钱了。这个是钱，没错吧？”（把雷亚尔钞票拿给他看。）
0x0100005800008BC7	Dialogue Text	KIM SWITCH / END OF DAY	Kim Kitsuragi	He nods. "I'll also take a room at the Whirling. One cannot get much closer to the crime scene."	他点点头。“我也去飞旋旅社开个房间。离犯罪现场多近都不为过。”
0x0100005800008BCE	Dialogue Text	KIM SWITCH / END OF DAY	Kim Kitsuragi	"You should take care of that, then."	“那你应该把这件事处理好。”
0x0100006B0000A492	Dialogue Text	KIM SWITCH / END OF DAY	Kim Kitsuragi	"Let's continue tomorrow, bright and early -- 7:30 sharp. I'll be waiting downstairs."	警督点点头。“我们明天再继续吧，就一大早——7：30分整。我会在楼下等你。”
0x0100007A0000067C	Dialogue Text	KIM SWITCH / END OF DAY	You	"I think I need to talk to the cafeteria manager about my room..."	“我觉得应该去跟餐厅经理聊聊房间的事……”
0x0100007A00000683	Dialogue Text	KIM SWITCH / END OF DAY	Kim Kitsuragi	"You certainly have been avoiding it."	“你确实一直在逃避。”
0x01000081000042C8	Dialogue Text	KIM SWITCH / END OF DAY	You	"Then I should check in with the cafeteria manager."	“那我应该去问问餐厅经理。”
0x01000081000042CF	Dialogue Text	KIM SWITCH / END OF DAY	Kim Kitsuragi	"Do that. I'll be waiting for you downstairs tomorrow."	警督点点头。“去吧。明天我在楼下等你。”
0x0100002100000852	Dialogue Text	KIM SWITCH / FIGHT FAILURE	You	"Can't promise that. I might attack him again." [Leave.]	“这个没法保证。我可能会再袭击他一次。”[离开。]
0x0100002100000859	Dialogue Text	KIM SWITCH / FIGHT FAILURE	Kim Kitsuragi	The lieutenant groans, but doesn't say anything.	警督叹息着，但终究没有说什么。
0x0100002100000860	Dialogue Text	KIM SWITCH / FIGHT FAILURE	Volition	That's right, you *should* do it again! It's the *last* thing he'll be expecting.	没错，你*应该*再做一次！这是他*最不愿意*见到的事。
0x0100002100000868	Dialogue Text	KIM SWITCH / FIGHT FAILURE	You	"Okay, I was trying to assert my dominance over him."	“好吧，我只是想维护我的权威而已。”
0x0100002D00000371	Dialogue Text	KIM SWITCH / FIGHT FAILURE	You	"How else are we gonna get through the gates?"	“不然我们怎么通过那些大门呢？”
0x0100002D00000376	Dialogue Text	KIM SWITCH / FIGHT FAILURE	You	"But... I was fighting *bad*, unsavoury ideologies. I'm a hero."	“但是……我是在跟*坏的*、邪恶的意识形态作斗争。我是个英雄。”
0x0100002D0000037D	Dialogue Text	KIM SWITCH / FIGHT FAILURE	Kim Kitsuragi	"We're not here on some political quest, we're here to solve a crime. Don't make this situation any more volatile than it already is."	“我们来这儿不是因为什么政治任务，我们是来破案的。不要把情况搞得比现在更复杂了。”
0x0100002D0000038F	Dialogue Text	KIM SWITCH / FIGHT FAILURE	Kim Kitsuragi	"There must be some other way. Let's go see the yard again -- it faces the other end of the harbour. We're done with Measurehead here."	“肯定还有其他办法。我们再去院子里看看——它正对着港口的另一端。跟测颅先生已经说的差不多了。”
0x0100005A0000A8FD	Dialogue Text	KIM SWITCH / FIGHT FAILURE	You	"But *he's* the one trying to provoke *me*!"	“但*他*才是想要*激怒*我的人！”
0x0100005A0000AA68	Dialogue Text	KIM SWITCH / FIGHT FAILURE	Kim Kitsuragi	He nods. "Let's think of something else."	他点点头。“我们再想想别的。”
0x0100005A0000AA81	Dialogue Text	KIM SWITCH / FIGHT FAILURE	Kim Kitsuragi	"I'm not even sure the *one bullet* my chamber holds would even prick that hulk."	“我甚至都不确定，我枪膛里的*一颗子弹*到底能不能穿透那个庞然大物。”
0x0100005A0000AABD	Dialogue Text	KIM SWITCH / FIGHT FAILURE	You	"Alright, fine. I won't do it again." [Leave.]	“好吧。我不会再这么做了。”[离开。]
0x0100005A0000AAC5	Dialogue Text	KIM SWITCH / FIGHT FAILURE	Volition	No, no. You *should* do it again. It's the *last* thing he'll be expecting.	不不。你*应该*再做一次。这是他*最不愿意*见到的事。
0x0100005A0000AAD0	Dialogue Text	KIM SWITCH / FIGHT FAILURE	Kim Kitsuragi	"And you're just going to *let* him manipulate you like that?" He raises an eyebrow.	“你就打算*让*他这样操纵你吗？”他扬起一边的眉头。
0x0100000100000386	Dialogue Text	KIM SWITCH / flashlight	Kim Kitsuragi	"And the flashlight works a lot better if you *hold it in your hand*."	“而且，如果你把手电筒*握在手里*的话，可能会好很多。”
0x010000010000038E	Dialogue Text	KIM SWITCH / flashlight	You	"Fair point. Yes, totally obvious."	“说得好。没错，是很明显。”
0x0100001200000097	Dialogue Text	KIM SWITCH / flashlight	Kim Kitsuragi	"This would be a lot easier with a flashlight..."	“要是有个手电筒就容易多了……”
0x010000120000009F	Dialogue Text	KIM SWITCH / flashlight	Kim Kitsuragi	"I've got one in the Kineema's toolbox. We should go back for it before we continue. No sense in tripping around in the darkness."	“我的锐影工具箱里应该有一只。我们应该先回去取，然后再继续前进。这样在黑暗里跌跌撞撞的毫无意义。”
0x01000012000000B2	Dialogue Text	KIM SWITCH / flashlight	You	"Flashlights go *in* hand?" (Stare at your hand uncomprehendingly.)	“把手电筒握在*你手里*？”（不解地盯着你的手。）
0x01000012000000B9	Dialogue Text	KIM SWITCH / flashlight	Kim Kitsuragi	"Yes," the lieutenant says. "You might even call it a *feature* of the universe, that you need to *hold* tools to *use* them."	“是的，”警督回答到。“你甚至可以称之为宇宙的一种*特征*，你需要把工具*握在手里*才能*使用*它们。”
0x01000012000000C0	Dialogue Text	KIM SWITCH / flashlight	Kim Kitsuragi	"Right. Now let's get to it," the lieutenant nods.	“好吧，现在让我们开始吧，”警督点点头。
0x01000012000000C7	Dialogue Text	KIM SWITCH / flashlight	You	"That makes so much sense."	“这样就合理多了。”
0x01000012000000CE	Dialogue Text	KIM SWITCH / flashlight	You	"That makes no sense at all."	“这样一点都说不通。”
0x01000012000000D6	Dialogue Text	KIM SWITCH / flashlight	Kim Kitsuragi	"I'm sorry the fundamental laws of the universe don't seem to agree with you, detective, but the fact remains that it's too dark to see in here without the flashlight..."	警督皱皱眉。“我很抱歉，宇宙的基本律法好像不太赞同你的意见，警探。不过事实没有改变，这里太黑了，如果没有手电筒，什么也看不见。”
0x01000012000000DD	Dialogue Text	KIM SWITCH / flashlight	Kim Kitsuragi	"So come on. We've got work to do."	“所以赶紧吧。我们还有工作要做。”
0x0100002100001695	Dialogue Text	KIM SWITCH / flashlight	You	"Got it, Kim, no need to rub it in." [Leave.]	“明白了，金，没必要反复说个没完。”[离开。]
0x01000021000016A3	Dialogue Text	KIM SWITCH / flashlight	Tutorial Agent	Some areas are inaccessible without your FLASHLIGHT. After you’ve acquired it, go to your INVENTORY and equip it in a HELD slot to continue exploring.	有些地方必须使用手电筒才可进入。你已经拿到手电筒了，可以在道具栏中装备它并继续探索。
0x01000021000016AC	Dialogue Text	KIM SWITCH / flashlight	Tutorial Agent	Some areas are inaccessible without your FLASHLIGHT. After you’ve acquired it, go to your INVENTORY and equip it in a HELD slot to continue exploring.	有些地方必须使用手电筒才可进入。你已经拿到手电筒了，可以在道具栏中装备它并继续探索。
0x010000050000181E	Dialogue Text	KIM SWITCH / FORTRESS ACCIDENT	Conceptualization	He's right. This wasn't your grandma's game studio, this is something else.	他是对的。这里不是你外婆的游戏工作室，是别的东西。
0x0100000500001830	Dialogue Text	KIM SWITCH / FORTRESS ACCIDENT	Conceptualization	This is *way* above your tiny little policeman head.	这个已经*严重*超越了你这个小警察的想象空间。
0x0100000500001837	Dialogue Text	KIM SWITCH / FORTRESS ACCIDENT	You	"I don't know, I'm not an artist."	“我不知道，我不是艺术家。”
0x010000050000183F	Dialogue Text	KIM SWITCH / FORTRESS ACCIDENT	You	"You're right, this isn't just a pen-and-paper role-playing game. They were trying to make it on *radiocomputers*."	“你说的对，这不仅仅是一个纸笔角色扮演游戏。他们想让游戏能在*无线电脑*上运行。”
0x0100000500001849	Dialogue Text	KIM SWITCH / FORTRESS ACCIDENT	Kim Kitsuragi	"Precisely!" He agrees. "It's absolutely mad -- an *automated* role-playing game."	“就是这样！”他表示赞同。“他们绝对是疯了——一个*自动*的角色扮演游戏。”
0x0100000600019CC6	Dialogue Text	KIM SWITCH / FORTRESS ACCIDENT	Empathy	He has respect -- and curiosity -- for this failed endeavour.	他对这个失败的事业表示尊重——还有好奇。
0x0100000600019CCE	Dialogue Text	KIM SWITCH / FORTRESS ACCIDENT	Interfacing	Like he's ready to lay out a fine theory, crafted together like a puzzle box.	就好像他已经准备好提出一个很好的理论，像拼图盒子一样拼在了一起。
0x0100000600019CD6	Dialogue Text	KIM SWITCH / FORTRESS ACCIDENT	Kim Kitsuragi	"Okay, well, *I* think..." The lieutenant takes a step back, steepling his hands.	“好吧，这个嘛，*我*想想……”警督后退了一步，摩擦着双手。
0x0100000600019CDF	Dialogue Text	KIM SWITCH / FORTRESS ACCIDENT	Esprit de Corps	And I don't use the *mad* lightly, he thinks.	而且我用的这个*疯狂*可不轻，他这样想到。
0x0100000600019CE9	Dialogue Text	KIM SWITCH / FORTRESS ACCIDENT	Esprit de Corps	Utter madness, he thinks -- as a compliment.	彻头彻尾的疯狂，他想到——这是一种恭维。
0x0100000600019CF1	Dialogue Text	KIM SWITCH / FORTRESS ACCIDENT	Electrochemistry	His fascination has swept aside other concerns for the moment. He's a little *hooked*.	这一刻，他的痴迷已经把其他关注点都抛在了一旁。他有点*上头*了。
0x0100000600019CF8	Dialogue Text	KIM SWITCH / FORTRESS ACCIDENT	Interfacing	Coordinating so many games would take a whole switchboard of people, possibly divided into sub-frequencies.	协调这么多的游戏，那接线总机可能要很多人，也许被分成了一些子频段。
0x0100000600019D00	Dialogue Text	KIM SWITCH / FORTRESS ACCIDENT	Kim Kitsuragi	"But I don't think *anyone* has attempted to create an *interisolary* game before. We just don't have the technology."	“但我不觉得之前曾经*有人*试过创造*跨洲*游戏。我们真的没有那种技术。”
0x0100000600019D06	Dialogue Text	KIM SWITCH / FORTRESS ACCIDENT	Rhetoric	*Not* in Revachol West, among the ruins.	*不会*出现在瑞瓦肖西部——这片废墟之间。
0x0100000600019D0F	Dialogue Text	KIM SWITCH / FORTRESS ACCIDENT	Kim Kitsuragi	"I don't think so. I think they genuinely believed..." The lieutenant looks around the derelict room. The pipes howl and a rat crosses the floor.	“我不这么认为。我觉得他们由衷的相信自己能做到……”警督看了看这个荒废的房间。管道在低嚎，一只老鼠爬过地面。
0x0100002100002B7C	Dialogue Text	KIM SWITCH / FORTRESS ACCIDENT	Kim Kitsuragi	"And by 'these people' I mean people in Soona's radio game company -- Fortress Accident."	“我说的‘这些人’指的是苏娜那家无线游戏公司的人——要塞事故。”
0x0100002100002B86	Dialogue Text	KIM SWITCH / FORTRESS ACCIDENT	Interfacing	Like he's ready to lay out a fine theory, crafted together like a puzzle box.	就好像他已经准备好提出一个很好的理论，像拼图盒子一样拼在了一起。
0x0100002100002B8C	Dialogue Text	KIM SWITCH / FORTRESS ACCIDENT	Kim Kitsuragi	"It looks like one of those popular pen-and-paper role-playing games -- only these people were trying to *automate* it. Make it work on *radiocomputers*."	“看起来像是那种流行的纸笔角色扮演游戏——只不过那些人想试着让它变得*自动化*。让游戏能在*无线电脑*上运行。”
0x0100002100002B92	Dialogue Text	KIM SWITCH / FORTRESS ACCIDENT	Esprit de Corps	Utter madness, he thinks -- as a compliment.	彻头彻尾的疯狂，他想到——这是一种恭维。
0x0100009200000842	Dialogue Text	KIM SWITCH / FORTRESS ACCIDENT	Kim Kitsuragi	"What do you think is going on here with the radiocomputer, chalkboard, and fireplace?"	“你觉得这些无线电脑、黑板和壁炉是怎么回事？”
0x0100009200000915	Dialogue Text	KIM SWITCH / FORTRESS ACCIDENT	You	"It's obvious -- this is what remains of Soona's radio game studio, Fortress Accident."	“很明显——这里是苏娜的无线游戏工作室‘要塞事故’的遗址。”
0x0100009200000921	Dialogue Text	KIM SWITCH / FORTRESS ACCIDENT	You	"No time. Let's move." [Leave.]	“没时间了，我们走吧。”[离开。]
0x0100009200000929	Dialogue Text	KIM SWITCH / FORTRESS ACCIDENT	Kim Kitsuragi	"Yes, I got that." The lieutenant shifts on his feet. "What I meant was -- what were they trying to achieve with this damn game..."	“是啊，这个我明白。”警督换了只脚。“我的意思是——他们到底想用这个该死的游戏干什么……”
0x0100009200000930	Dialogue Text	KIM SWITCH / FORTRESS ACCIDENT	You	"Looks like an undercover counterintelligence programme."	“看起来像是一个秘密的反间谍程序。”
0x0100009200000937	Dialogue Text	KIM SWITCH / FORTRESS ACCIDENT	You	"Someone tried to exorcise *the curse* using technology?"	“有人想用科学技术驱除*诅咒*吗？”
0x010000920000093F	Dialogue Text	KIM SWITCH / FORTRESS ACCIDENT	Kim Kitsuragi	"What were their ambitions? Because this here looks rather *advanced*."	“他们有什么野心？因为这里看起来很*先进*。”
0x0100009200000946	Dialogue Text	KIM SWITCH / FORTRESS ACCIDENT	You	"It's just a failed business. The only question is -- what the hell were they making?"	“只是个失败的生意罢了。唯一的问题是——他们到底在做什么鬼？”
0x0100009200000962	Dialogue Text	KIM SWITCH / FORTRESS ACCIDENT	Kim Kitsuragi	"Yes, that *is* the question..." The lieutenant takes a step back, steepling his hands.	“是的，这*才是*问题……”警督后退了一步，摩挲着双手。
0x0100009200000969	Dialogue Text	KIM SWITCH / FORTRESS ACCIDENT	Kim Kitsuragi	"It looks like one of those popular pen-and-paper role-playing games -- only these people were trying to *automate* it. Make it work on *radiocomputers*."	“看起来像是那种流行的纸笔角色扮演游戏——只不过那些人想试着让它变得*自动化*。让游戏能在*无线电脑*上运行。”
0x0100009200000970	Dialogue Text	KIM SWITCH / FORTRESS ACCIDENT	Kim Kitsuragi	"No, that's not it. *I* think..." The lieutenant takes a step back, steepling his hands.	“不，不是这样的。*我*觉得……”警督后退了一步，摩挲着双手。
0x010000920000097F	Dialogue Text	KIM SWITCH / FORTRESS ACCIDENT	You	"Has anyone ever done this before?"	“之前有人做过这个吗？”
0x0100009200000985	Dialogue Text	KIM SWITCH / FORTRESS ACCIDENT	You	"How were they planning to do that?"	“他们打算怎么做？”
0x010000920000098D	Dialogue Text	KIM SWITCH / FORTRESS ACCIDENT	Kim Kitsuragi	"Not to my knowledge. They make automated games in Graad, Messina, Königstein... You know, places with industry."	“据我所知没有。格拉德、墨西拿和柯尼希斯都在做自动化游戏……你知道的，那些工业发达的地方。”
