ArticyId	TermType	ConvTitle	Actor	En	Zh
0x0100005100005BFA	Dialogue Text	KIM SWITCH / PORTRAIT REACTION	Savoir Faire	Suddenly the whole Icebreaker concept seems... just lame.	突然间，破冰者这个说法似乎变得……很蹩脚。
0x0100005100005C01	Dialogue Text	KIM SWITCH / PORTRAIT REACTION	Volition	It's like he re-conditioned your brain.	就好像是他重新调整了你的大脑。
0x0100005100005C0B	Dialogue Text	KIM SWITCH / PORTRAIT REACTION	Authority	The lieutenant's command instantly lets all the wind out of your sails, like he overrode your mind or flicked some secret master-switch.	警督的命令让你立刻泄了气，仿佛他控制了你的思想，或是打开了你的某个秘密开关。
0x0100005100005C17	Dialogue Text	KIM SWITCH / PORTRAIT REACTION	Kim Kitsuragi	"Yes, your face." He nods, looking worried. "Looks like you're having a stroke. Can you even move it?"	“没错，你的脸。”他有些担忧地点点头。“你看起来像中风了一样。还能动吗？”
0x0100005100005C29	Dialogue Text	KIM SWITCH / PORTRAIT REACTION	Suggestion	Better keep the lieutenant in the dark about the whole 'Icebreaker' thing. He's not gonna get it.	最好不要和警督说起破冰者的事情。他是不会明白的。
0x0100005100005C39	Dialogue Text	KIM SWITCH / PORTRAIT REACTION	You	"There's nothing more to talk about, only to *endure*." [Leave.]	“没什么可说的，只要*忍耐*就好。[离开。]
0x0100005100005C41	Dialogue Text	KIM SWITCH / PORTRAIT REACTION	Physical Instrument	That's a negative, lieutenant.	这就是拒绝，警督。
0x0100005100005C48	Dialogue Text	KIM SWITCH / PORTRAIT REACTION	Kim Kitsuragi	"And what is that? A walking mask?"	“那是什么？一只会走路的面具？”
0x0100005100005C4F	Dialogue Text	KIM SWITCH / PORTRAIT REACTION	You	"A noble sufferer."	“一名高贵的受害者。”
0x0100005100005C56	Dialogue Text	KIM SWITCH / PORTRAIT REACTION	You	"Absolutely." (Lift the corners of your mouth with index fingers.) "See?"	“当然。”（用食指戳戳嘴角。）“瞧见没？”
0x0100005100005C65	Dialogue Text	KIM SWITCH / PORTRAIT REACTION	You	"I don't need to 'move it', this is my final form."	“我不需要‘动’，这是我的最终形态。”
0x0100005100005C74	Dialogue Text	KIM SWITCH / PORTRAIT REACTION	You	"He Who Stares Straight into the Eclipse."	“他是凝视日食之人。”
0x0100005100005C7A	Dialogue Text	KIM SWITCH / PORTRAIT REACTION	You	"He Who Withstands All Temptation."	“他是能抵挡一切诱惑之人。”
0x0100005100005C82	Dialogue Text	KIM SWITCH / PORTRAIT REACTION	You	"The last kingsman."	“最后的王下骑士。”
0x0100005100005C8E	Dialogue Text	KIM SWITCH / PORTRAIT REACTION	You	"I'm fine, don't worry about it."	“我很好，不用担心。”
0x0100005100005C98	Dialogue Text	KIM SWITCH / PORTRAIT REACTION	Kim Kitsuragi	"So now you want to go blind as well?" He shakes his head. "How about we become Those Who Solve Murder Cases instead and get back to work?"	“你也想成瞎子吗？”他摇着头。“我们不如成为侦破凶杀案之人，回去工作吧？”
0x0100005100005CA1	Dialogue Text	KIM SWITCH / PORTRAIT REACTION	Kim Kitsuragi	"Including drinking?"	“包括喝酒吗？”
0x0100005100005CA8	Dialogue Text	KIM SWITCH / PORTRAIT REACTION	You	"Excluding drinking."	“除了喝酒。”
0x0100005100005CAF	Dialogue Text	KIM SWITCH / PORTRAIT REACTION	You	"Including drinking."	“包括喝酒。”
0x0100005100005CB6	Dialogue Text	KIM SWITCH / PORTRAIT REACTION	You	"Excluding drinking. And drugs."	“除了喝酒，还有嗑药。”
0x0100005100005CC8	Dialogue Text	KIM SWITCH / PORTRAIT REACTION	Kim Kitsuragi	"No, you are not. What you are is an RCM lieutenant conducting a murder investigation."	“不，你不是。你是一名RCM警督，你正在调查一起谋杀案。”
0x0100005100005CD0	Dialogue Text	KIM SWITCH / PORTRAIT REACTION	Kim Kitsuragi	"You don't look fine and I'm *very* worried about it." He crosses his arms on his chest.	“你看起来不太好，我*很*担心你。”他把手臂交叉在胸前。
0x0100005100005CD7	Dialogue Text	KIM SWITCH / PORTRAIT REACTION	Kim Kitsuragi	"I just don't understand, officer." The lieutenant just stands there, looking perplexed. "Please, help me understand."	“我真是不太明白，警官。”警督困惑地站在那儿。“请帮我解释一下。”
0x0100005100005CDF	Dialogue Text	KIM SWITCH / PORTRAIT REACTION	Esprit de Corps	Should I contact his station's lazareth? Behind his back?	我要不要背着他联系他警局的*检疫所*？
0x0100005100005CED	Dialogue Text	KIM SWITCH / PORTRAIT REACTION	Kim Kitsuragi	"I don't think *you* are supposed to call yourself that." A fleeting smile crosses his lips. "But I appreciate the honesty. Now let's get back to work."	“我觉得*你*不应该那样称呼自己。”他的唇边扬起一抹微笑。“但感谢你说了实话。好了，我们回去工作吧。”
0x0100005100005CF5	Dialogue Text	KIM SWITCH / PORTRAIT REACTION	Rhetoric	Neither was an actual question.	这都不是什么实际的问题。
0x0100005100005D03	Dialogue Text	KIM SWITCH / PORTRAIT REACTION	Savoir Faire	The lieutenant is *not* loving the new look.	警督*不*喜欢新造型。
0x0100005100005D19	Dialogue Text	KIM SWITCH / PORTRAIT REACTION	Kim Kitsuragi	"The last kingsman..." he repeats pensively, inspecting your face. "That's fitting, I suppose. Almost as if you *did* manage to turn back time. If only for yourself."	“最后的王下骑士……”他看着你的脸，沉闷地重复道。“如果你*真的*让时间倒流了，我觉得倒是挺恰当。哪怕那么做是为了自己。”
0x0100005100005D28	Dialogue Text	KIM SWITCH / PORTRAIT REACTION	Kim Kitsuragi	"Alright, detective," he reaches out and pats you on the arm. It feels strangely encouraging. "Let's get going, we've got a killer to catch."	“好了，警探，”他伸出手，拍拍你的胳膊。你莫名有一种被鼓舞的感觉。“我们继续工作吧，还有凶手等着我们去抓呢。”
0x0100005100005D3B	Dialogue Text	KIM SWITCH / PORTRAIT REACTION	Conceptualization	Face of a millipede trapped in amber...	被困在琥珀中的千足虫的脸……
0x0100005100005D43	Dialogue Text	KIM SWITCH / PORTRAIT REACTION	Inland Empire	But somehow it doesn't scare him, like it scared you. Doesn't make him quiver with cold. Poor guy...	可这并没有吓到他，反而像是把你吓了一跳。而且也没让他冷得发抖。可怜鬼……
0x0100005100005D6E	Dialogue Text	KIM SWITCH / PORTRAIT REACTION	Kim Kitsuragi	"What temptations is *He* withstanding then?" asks the lieutenant with a puzzled look.	“那*他*在抵挡什么诱惑呢？”警督疑惑地问道。
0x010000580001DBC0	Dialogue Text	KIM SWITCH / PORTRAIT REACTION	Kim Kitsuragi	"You know what? I don't even want to know. Let it be one of your *internal* side-cases. I just want to get back to work."	“告诉你吧，我根本不想知道答案。留给你自己的*内心*去解决吧。我只想回去工作。”
0x010000580001DBC8	Dialogue Text	KIM SWITCH / PORTRAIT REACTION	Kim Kitsuragi	"Hm." The lieutenant seems almost impressed. "Admitting a problem is the first step forward. Perhaps now we can finally get some work done."	“嗯。”警督似乎有些满意。“承认错误是前进的第一步。现在我们应该终于能工作了。”
0x010000580001DBD9	Dialogue Text	KIM SWITCH / PORTRAIT REACTION	Kim Kitsuragi	"Shall we?" He looks ready to go.	“我们走吧？”他似乎准备离开了。
0x010000060001091F	Dialogue Text	KIM SWITCH / RACIST KITSURAGI	You	"Wait, am I becoming some sort of Death's Head Racist suddenly?!"	“等等，我突然就变成某种骷髅头的种族主义者了吗？”
0x0100000600010925	Dialogue Text	KIM SWITCH / RACIST KITSURAGI	Kim Kitsuragi	"I don't know what you mean by *death's head* but it certainly looks like you're becoming a racist, officer."	“我不知道你说的*骷髅头*是什么意思，但是看起来你确实变成了一个种族主义者，警官。”
0x0100000600010936	Dialogue Text	KIM SWITCH / RACIST KITSURAGI	Drama	We know a *lie*, sire. And it didn't feel like one to us. He chooses to believe though -- for now.	吾辈知道什么是*谎言*，大人。而这个看起来并不是。但是目前——他选择相信了。
0x0100000600010942	Dialogue Text	KIM SWITCH / RACIST KITSURAGI	Kim Kitsuragi	"And one more thing -- as you've seen, these sorts of attitudes are quite common in Martinaise. So I expect this to happen again. And again..."	“还有一件事——你也看到了，这种看法在马丁内斯很常见，所以我觉得这种事以后还会一次又一次的发生……”
0x0100000600010949	Dialogue Text	KIM SWITCH / RACIST KITSURAGI	Kim Kitsuragi	"I've had this conversation enough times in my life. From now on, I'm  going to stay out of it. How you choose to respond is your business." He concludes: "But be careful. Now, let's move on."	“我的一生当中，已经听过很多次这样的话了。从今以后，我会置身事外。你选择怎样的回应是你的事。”他总结到：“不过还是要小心点。现在，我们继续工作吧。”
0x010000060001D193	Dialogue Text	KIM SWITCH / RACIST KITSURAGI	Rhetoric	Okay... feels like this is going to be a *discussion* now.	好吧……现在感觉这会变成一场*辩论*。
0x010000060001D19E	Dialogue Text	KIM SWITCH / RACIST KITSURAGI	Rhetoric	Okay. You think there's a way out of this.	好吧。好吧。你以为总会有办法的。
0x0100000900001FFB	Dialogue Text	KIM SWITCH / RACIST KITSURAGI	You	"Relax, I was practising the time-honoured technique known as the 'lie'."	“放松，我在练习一种由来已久的技术，它的名字叫做‘撒谎’。”
0x0100000900002010	Dialogue Text	KIM SWITCH / RACIST KITSURAGI	You	"It's basic biology."	“这是基础生物学。”
0x0100000900002017	Dialogue Text	KIM SWITCH / RACIST KITSURAGI	You	"Look, what happens when the races get all mixed up?"	“看，种族全部混在一起会发生什么？”
0x010000090000201E	Dialogue Text	KIM SWITCH / RACIST KITSURAGI	Kim Kitsuragi	"I'm going to *stop* this conversation." He makes a sudden hand gesture. An open palm. "This is Martinaise. People have certain attitudes here. You will find plenty of citizens to agree with you. As for me..."	“我要*终止*这次谈话了。”他突然比了个手势，摊开的手掌心。“这里是马丁内斯。这里的人是秉持着某种特定看法的。的确会有很多市民同意你的观点。至于我……”
0x0100000900002026	Dialogue Text	KIM SWITCH / RACIST KITSURAGI	You	(Shrug.) "Let Nature sort them out."	（耸肩。）“让大自然来解决吧。”
0x010000090000202D	Dialogue Text	KIM SWITCH / RACIST KITSURAGI	You	"I've got nothing against them, but we have a responsibility to future generations."	“我对他们没有任何意见，但是我们必须为后代负责。”
0x0100000900002051	Dialogue Text	KIM SWITCH / RACIST KITSURAGI	Kim Kitsuragi	"Well," he says after taking a moment to collect himself. "You've made your views on the subject quite clear..." Another little pause.	“好吧，”他稍微调整了一下自己，然后开口说道，“你对这个问题的看法已经很清楚了……”又是一次短暂的停顿。
0x010000090000207F	Dialogue Text	KIM SWITCH / RACIST KITSURAGI	Kim Kitsuragi	"I suppose that's a relief. Just be careful how often you avail yourself of this 'technique'. A lie may be useful in the short-term, but they have a way of catching up with you later."	“这样也算是种安慰。只不过要小心你自己使用这种‘技术’的频率。短期来看，谎言也许有用，但是之后，它们总有办法惩罚你。”
0x01000009000020D0	Dialogue Text	KIM SWITCH / RACIST KITSURAGI	You	"I was just trying to convey that I understood his grievances and wasn't judging him for having them."	“我只是想试着传达一个观点：我理解他的抱怨，而且也不会因此去评判他什么的。”
0x01000009000020DE	Dialogue Text	KIM SWITCH / RACIST KITSURAGI	You	"Everyone thinks they're better than other people. Some people are just particularly crude about it."	“每个人都觉得自己比别人好。有些人对此特别粗鲁。”
0x01000009000020EC	Dialogue Text	KIM SWITCH / RACIST KITSURAGI	Kim Kitsuragi	The lieutenant falls silent and looks down at his boots. Whether he thinks you have a point or not, he isn't saying. It's unclear what this means for your relationship. Then he speaks...	警督陷入沉默，低下头看着自己的鞋子。不论他认为你的话有没有道理，他都没有说明。这对你们的关系来说意味着什么，谁也不清楚。之后，他开了口……
0x01000009000022C8	Dialogue Text	KIM SWITCH / RACIST KITSURAGI	You	Yes.	是的。
0x01000009000022C8	tooltip1	KIM SWITCH / RACIST KITSURAGI	You	Dresscode: RCM official.	着装要求：RCM警官。
0x01000009000022C8	tooltip2	KIM SWITCH / RACIST KITSURAGI	You	Dresscode: Royalist reenactor.	着装要求：保皇派重演者。
0x01000009000022DD	Dialogue Text	KIM SWITCH / RACIST KITSURAGI	You	"You're right. I didn't mean to cause trouble. Sorry about that."	“你是对的。我不想制造麻烦。很抱歉。”
0x01000009000022E6	Dialogue Text	KIM SWITCH / RACIST KITSURAGI	Kim Kitsuragi	"That's good to hear. I don't want there to be any unnecessary friction in our relationship during this *important* case."	“听你这么说我很高兴。我不希望在这么*重要*的案件调查期间，你我之间的关系产生什么不必要的摩擦。”
0x0100002F00004896	Dialogue Text	KIM SWITCH / RACIST KITSURAGI	Rhetoric	Here we go. Zoom in on the mixed races part. It's the best one.	来吧。聚焦在种族混合的部分，这是最好的。
0x0100002F00004FC1	Dialogue Text	KIM SWITCH / RACIST KITSURAGI	You	"I don't really want to talk about it." [Leave.]	“我真的不想谈论这个。”[离开。]
0x0100002F00004FCE	Dialogue Text	KIM SWITCH / RACIST KITSURAGI	Kim Kitsuragi	The lieutenant looks at you in silence, though you cannot discern if he's judging you or not. "I suppose your reasons are your own."	警督一言不发地看着你，虽然你也辨别不出他是不是在评判你。“我觉得你的理由只属于你自己。”
0x0100002F00004FE3	Dialogue Text	KIM SWITCH / RACIST KITSURAGI	Kim Kitsuragi	"And what exactly do you think should happen to those with *undesirable* traits?"	“那你觉得拥有那些*不良*特征的人应该怎么样呢？”
0x0100006B0000274F	Dialogue Text	KIM SWITCH / RACIST KITSURAGI	Rhetoric	Now you're thinking sensibly.	现在你是在理性地思考。
0x0100007000000881	Dialogue Text	KIM SWITCH / RACIST KITSURAGI	Suggestion	Well, now you've done it. Let's see if you can talk your way out of this one.	好吧，现在你做到了。让我们看看你能不能用自己的方式解决这个问题。
0x010000700000089E	Dialogue Text	KIM SWITCH / RACIST KITSURAGI	Kim Kitsuragi	The lieutenant narrows his gaze. "So you *don't* find his views... say, *unbefitting of a police officer*?"	警督眯起双眼。“所以你*不觉得*他的观点……怎么说呢，*不太适合一个警察吗？*”
0x01000070000008A4	Dialogue Text	KIM SWITCH / RACIST KITSURAGI	You	"It's not about me. As police officers, we gain nothing by staking out the moral high ground over him."	“这与我无关。作为一个警察，就算站在他的道德制高点之上，我们也得不到什么。”
0x01000070000008B2	Dialogue Text	KIM SWITCH / RACIST KITSURAGI	You	"Of course. But he's also not entirely responsible for them. I haven't been in this world for long -- already I'm a product of my environment."	“当然。但是他也不是完全需要对他们负责。我在这个世界待得不长——而我已经是周边环境的产物了。”
0x01000070000008B9	Dialogue Text	KIM SWITCH / RACIST KITSURAGI	Kim Kitsuragi	"There are tens of thousands of people who grew up in Martinaise and somehow managed to avoid becoming racists who yell 'Come here, saffron picker' at passers by."	“有成千上万的人在马丁内斯长大，但却没有让自己变成一个种族主义者，不会对过往的路人叫喊什么‘过来啊，摘番红花的’。”
0x01000070000008C0	Dialogue Text	KIM SWITCH / RACIST KITSURAGI	Kim Kitsuragi	"Our position in Revachol is already precarious: Many people think we're vigilantes as it is. I can't have them thinking we're *racist* vigilantes to boot."	“我们在瑞瓦肖的地位已经很危险了：很多人都觉得我们是义务警员。我可不能让他们觉得我们是*种族主义*的义务警员。”
0x01000070000008CA	Dialogue Text	KIM SWITCH / RACIST KITSURAGI	You	"Well, *actually*..."	“呃，*其实呢*……”
0x01000070000008D1	Dialogue Text	KIM SWITCH / RACIST KITSURAGI	Kim Kitsuragi	"Apology accepted, detective." The lieutenant relaxes. A weight seems to have been lifted from his shoulders.	“我接受你的道歉，警探。”警督松了一口气，肩膀上好像卸下了沉重的负担。
0x01000070000008DE	Dialogue Text	KIM SWITCH / RACIST KITSURAGI	Rhetoric	Wait a second. Are you sure you want to go there? Even if you succeed, you're going to fail.	等一下。你确定想这样做吗？即使成功，你也会失败的。
0x01000070000008E5	Dialogue Text	KIM SWITCH / RACIST KITSURAGI	You	What do you mean? I'm in the right here.	你什么意思？我不就在这里吗。
0x01000070000008EB	Dialogue Text	KIM SWITCH / RACIST KITSURAGI	You	On second thought, maybe I don't.	再仔细一想，也许还是算了。
0x01000070000008F4	Dialogue Text	KIM SWITCH / RACIST KITSURAGI	Rhetoric	Are you sure about that?	你确定吗？
0x01000070000008FB	Dialogue Text	KIM SWITCH / RACIST KITSURAGI	You	Forget it, this was a dumb idea.	算了吧，这主意太蠢了。
0x0100007000000904	Dialogue Text	KIM SWITCH / RACIST KITSURAGI	Rhetoric	Hoo boy, we're really doing this.	好家伙，我们真要这么做了。
0x0100007000000912	Dialogue Text	KIM SWITCH / RACIST KITSURAGI	You	"Maybe he's got a point."	“也许他说的有道理。”
0x0100007000000919	Dialogue Text	KIM SWITCH / RACIST KITSURAGI	Kim Kitsuragi	"And what point would that be?"	“那是什么意思呢？”
0x010000700000095C	Dialogue Text	KIM SWITCH / RACIST KITSURAGI	Kim Kitsuragi	"There's a difference between saying something crude -- and an ideological racist."	“说话粗鲁——跟思想上的种族主义者，两者是有区别的。”
0x0100007000000972	Dialogue Text	KIM SWITCH / RACIST KITSURAGI	Kim Kitsuragi	The lieutenant says nothing, waiting for you to continue.	警督什么也没说，等着你继续。
0x0100007000000978	Dialogue Text	KIM SWITCH / RACIST KITSURAGI	You	"It's only rational for a society to select for the most desirable traits. That's how it works in Nature."	“对于一个社会来说，选择最可取的特征是很合理的。自然界就是这么运作的。”
0x0100007000000981	Dialogue Text	KIM SWITCH / RACIST KITSURAGI	You	"That doesn't mean they don't have rights. If they're perpetrators, then we punish, if they're victims, then we help. That's all there is."	“那也不代表他们没有权利。如果他们是犯罪者，我们惩罚，如果是受害者，我们帮助。就是这个样子。”
0x0100007000000989	Dialogue Text	KIM SWITCH / RACIST KITSURAGI	Kim Kitsuragi	"Wonderful." The lieutenant falls silent. His expression is hard to read, but it certainly doesn't look *happy*. Then he speaks...	“很好。”警督陷入沉默。他的表情很难解读，但看起来肯定不*高兴*。然后他开口了……
0x0100007000000A55	Dialogue Text	KIM SWITCH / RACIST KITSURAGI	Kim Kitsuragi	"Let me say just one more thing. As you've seen, these sorts of attitudes are quite common in Martinaise. So I expect this to happen again. And again..."	“我再说一件事。你也看到了，这种看法在马丁内斯很常见，所以我觉得这种事以后还会一次又一次的发生……”
0x0100007000000A5A	Dialogue Text	KIM SWITCH / RACIST KITSURAGI	Kim Kitsuragi	"Stop right there. I know what you're going to say. Don't. Also -- these attitudes are quite common in Martinaise. So I expect this to happen again. And again."	“好了，打住。我知道你要说什么。别说。还有——这种看法在马丁内斯很常见，所以我觉得这种事以后还会一次又一次的发生……”
0x0100007000000A62	Dialogue Text	KIM SWITCH / RACIST KITSURAGI	Kim Kitsuragi	"I've had this conversation enough times in my life. From now on, I'm going to stay out of it. How you choose to respond is your business." He concludes: "Now -- let's get back to the task at hand."	“我的一生当中，已经听过很多次这样的话了。从今以后，我会置身事外。你选择怎样的回应是你的事。”他总结到：“现在——让我们继续回到手头的工作吧。”
0x0100005100005791	Dialogue Text	KIM SWITCH / REJOIN AFTER MEASURHEAD TALK	Kim Kitsuragi	"Finally. I thought I have to come looking for you. What took you so long?"	“你终于回来了。我都准备去找你了。你怎么耽误那么久？”
0x0100005100005798	Dialogue Text	KIM SWITCH / REJOIN AFTER MEASURHEAD TALK	You	"Just men being men, Kim. You wouldn't understand." (Look solemnly to the horizon.)	“我也是个普通人啊，金。你是不会明白的。”（严肃地望向地平线。）
0x01000051000057A4	Dialogue Text	KIM SWITCH / REJOIN AFTER MEASURHEAD TALK	You	"We got into some pretty deep waters there."	“我们聊的蛮深入的。”
0x01000051000057AA	Dialogue Text	KIM SWITCH / REJOIN AFTER MEASURHEAD TALK	You	"It was *unbelievably* manly."	“真是*太*有男人味了。”
0x01000051000057BE	Dialogue Text	KIM SWITCH / REJOIN AFTER MEASURHEAD TALK	Kim Kitsuragi	"Right..." He nods. "Did he teach you to turn back time?"	“的确……”他点点头。“他教过你怎么让时间倒流吗？”
0x01000051000057C5	Dialogue Text	KIM SWITCH / REJOIN AFTER MEASURHEAD TALK	Rhetoric	The sarcasm is so finely tuned it actually comes off like worry.	这讽刺如此完美，甚至听起来像是在担忧。
0x01000051000057DC	Dialogue Text	KIM SWITCH / REJOIN AFTER MEASURHEAD TALK	You	"We became one."	“我们合为一体了。”
0x01000051000057F1	Dialogue Text	KIM SWITCH / REJOIN AFTER MEASURHEAD TALK	Kim Kitsuragi	"Really? What happened?"	“是吗？发生什么了？”
0x01000051000057F8	Dialogue Text	KIM SWITCH / REJOIN AFTER MEASURHEAD TALK	Esprit de Corps	Probably shouldn't have asked you this.	也许不应该问你这个问题。
0x010000510000580E	Dialogue Text	KIM SWITCH / REJOIN AFTER MEASURHEAD TALK	You	"Time flies when you're in a good company -- how long was I in there?"	“要是有好的同伴，就会感觉时间过得很快——我在那儿待了多久？”
0x0100005100005815	Dialogue Text	KIM SWITCH / REJOIN AFTER MEASURHEAD TALK	Kim Kitsuragi	"Couple of months, a year maybe?" he replies, glancing at his wrist-watch. "What happened in there?"	“几个月，也可能是一年？”他瞥了一眼手表，回答道。“那边怎么了？”
0x010000510000581C	Dialogue Text	KIM SWITCH / REJOIN AFTER MEASURHEAD TALK	Kim Kitsuragi	"René!" he says, snapping his fingers.	“雷内！”他扳着手指说道。
0x010000510000582A	Dialogue Text	KIM SWITCH / REJOIN AFTER MEASURHEAD TALK	Composure	As if a revelation just hit him.	仿佛刚刚获得了启示一般。
0x0100005100005831	Dialogue Text	KIM SWITCH / REJOIN AFTER MEASURHEAD TALK	You	"What about René?"	“雷内怎么了？”
0x0100005100005838	Dialogue Text	KIM SWITCH / REJOIN AFTER MEASURHEAD TALK	You	"You think he's our *killer* after all?"	“你觉得他是我们要找的*凶手*？”
0x010000510000583F	Dialogue Text	KIM SWITCH / REJOIN AFTER MEASURHEAD TALK	You	Just ignore him.	不理会他。
0x0100005100005846	Dialogue Text	KIM SWITCH / REJOIN AFTER MEASURHEAD TALK	Kim Kitsuragi	"No, I don't. But you are reminding me of him more and more. It's not a compliment, I don't like it."	“那倒不是。不过你越来越让我想起他了。这不是在夸你，因为我不喜欢这样。”
0x010000510000584D	Dialogue Text	KIM SWITCH / REJOIN AFTER MEASURHEAD TALK	Kim Kitsuragi	"You are really starting to remind me of him. It's not a compliment. I don't like it."	“你让我想起他的事情来了。这不是在夸你，因为我不喜欢这样。”
0x010000510000585B	Dialogue Text	KIM SWITCH / REJOIN AFTER MEASURHEAD TALK	Inland Empire	You're not going to like it.	你不喜欢这样。
0x0100005100005891	Dialogue Text	KIM SWITCH / REJOIN AFTER MEASURHEAD TALK	You	"What happens in Measurehead's mother's office stays in Measurehead's mother's office."	“在测颅先生母亲的办公室里发生的事情，就永远只能留在那个房间。”
0x0100005100005898	Dialogue Text	KIM SWITCH / REJOIN AFTER MEASURHEAD TALK	You	"No, but he did seem to believe it's possible."	“不，但他好像觉得有这个可能。”
0x010000510000589F	Dialogue Text	KIM SWITCH / REJOIN AFTER MEASURHEAD TALK	You	"No, he thought it's a bad idea and that I should stop obsessing about it."	“不，他觉得那样不好，说我不该继续纠结。”
0x01000051000058A6	Dialogue Text	KIM SWITCH / REJOIN AFTER MEASURHEAD TALK	Kim Kitsuragi	"That's probably best for everyone." He nods. "Let's go then."	“可能这样最好吧。”他点点头。“我们走吧。”
0x01000051000058AF	Dialogue Text	KIM SWITCH / REJOIN AFTER MEASURHEAD TALK	You	"No, he didn't even want to share his novel techniques..."	“不，他甚至都不想分享自己的新奇技巧……”
