ArticyId	TermType	ConvTitle	Actor	En	Zh
0x0100002F000135D1	Dialogue Text	KINEEMA / STATION CALL	Jean Vicquemare	"Hold up, Jules. He doesn't fucking know where he lives?! Did I hear that right?"	“等等，朱尔斯。他妈的，他不知道自己住哪？！我没听错吧？”
0x0100002F000135D8	Dialogue Text	KINEEMA / STATION CALL	Jules Pidieu	"Seems like it, sir."	“好像是的，先生。”
0x0100002F000135DF	Dialogue Text	KINEEMA / STATION CALL	Jean Vicquemare	"No. Fuck him. Don't tell him anything, you understand? He's been hellbound for the gutter, let him have it."	“不。去他妈的。什么都不要告诉他，你明白了吗？他已经泡进地狱的阴沟里了，让他自作自受。”
0x0100002F000135EB	Dialogue Text	KINEEMA / STATION CALL	Jules Pidieu	"Sorry, sir. Anything more I can do for you? Over."	“抱歉，先生。还有什么我能为你做的吗？完毕。”
0x0100002F000135FA	Dialogue Text	KINEEMA / STATION CALL	Jules Pidieu	"10-4. Your badge should have most of your personal details? Look over that. Over."	“10-4。你的警徽里应该包含了你的大部分个人信息？仔细检查一下吧。完毕。”
0x0100002F00013601	Dialogue Text	KINEEMA / STATION CALL	You	"I, uh... I don't have it. My badge."	“我，呃……我没有。警徽。”
0x0100002F0001360A	Dialogue Text	KINEEMA / STATION CALL	You	"Of course. My badge. I can look at my badge that I have." (Lie.)	“当然了。我的警徽。我可以看看警徽。”（撒谎。）
0x0100002F00013618	Dialogue Text	KINEEMA / STATION CALL	Jules Pidieu	"10-4. Anything else for you, sir? Over."	“10-4。还有别的事吗，先生？完毕。”
0x0100004C00000761	Dialogue Text	KINEEMA / STATION CALL	Jules Pidieu	"Sergeant Torson here is wondering if you are still in possession of your genitalia. Over."	“托森警长想知道你的命根子还在不在。完毕。”
0x0100004C0000076C	Dialogue Text	KINEEMA / STATION CALL	You	"Yes, I lost my wiener too, just lay off, okay?"	“是的，我的大香肠也弄丢了，消停点，行吗？”
0x0100004C00000772	Dialogue Text	KINEEMA / STATION CALL	You	"I left it at his momma's after I fucked her ass all night. Tell him that."	“每天晚上跟他老娘走完后门之后，我就把宝贝放在她那里了。你就跟他这么说。”
0x0100004C00000778	Dialogue Text	KINEEMA / STATION CALL	You	"I don't need to listen to this. Firewalker out!" (Turn off the radio.)	“我不需要听这个。火行者下线！”（关掉收音机。）
0x0100004C0000077E	Dialogue Text	KINEEMA / STATION CALL	Kim Kitsuragi	"That did not go well. I guess the important thing is that you followed protocol and reported your lost items."	“看来不太顺利啊。我觉得你应该遵守规章制度，上报不见的东西，这很重要。”
0x0100004C000007A6	Dialogue Text	KINEEMA / STATION CALL	Kim Kitsuragi	"Did we need anything else here?" He looks around in the cabin.	“还有什么别的需要吗？”他四下看了看乘車舱。
0x0100004C000007B4	Dialogue Text	KINEEMA / STATION CALL	Coupris Kineema	The silence is almost deafening after you flick off the switch, severing the connection.	在你关掉开关，断开连接后，那片寂静几乎有点震耳欲聋。
0x0100004C000007BA	Dialogue Text	KINEEMA / STATION CALL	Jean Vicquemare	"Thank god for that! That would have been a nightmare. I don't even want to imagine the poor prick who has to relay that kind of news to the captain."	“谢天谢地！要不然绝对会是一场噩梦。我甚至都不敢想象，哪个可怜虫敢把这种消息汇报给警长。”
0x0100004C000007C5	Dialogue Text	KINEEMA / STATION CALL	You	"This might sound odd, but there's *personal details* I'd like to discuss."	“也许听起来会有些奇怪，但我想谈谈*个人信息*。”
0x0100004C000007D2	Dialogue Text	KINEEMA / STATION CALL	Jules Pidieu	"I guess I can hold off the report for a few days." Oldboy lights another cigarette.	老男孩又点燃一支烟，然后说到：“我猜我可以把报告推迟几天。”
0x0100004C000007E0	Dialogue Text	KINEEMA / STATION CALL	You	"Uh, can you repeat that?"	“啊，你能重复一遍吗？”
0x0100004C000007FC	Dialogue Text	KINEEMA / STATION CALL	Jean Vicquemare	"This shit does *not* leave this room! Not a word of this to the captain or anyone else. We'll give him a couple of days to pull his shit together!"	“这件破事*不能*从这个房间传出去！这句话千万别跟警长或者其他任何人说。我们会给他几天时间，让他赶紧他妈的振作起来！”
0x0100004C00000804	Dialogue Text	KINEEMA / STATION CALL	Physical Instrument	The fuck do you need a gun for? Look at the pythons on your arms. You *are* a gun. The biggest one in the world.	你他妈要枪干嘛？看看你胳膊上的蟒蛇。你*就是*一支枪，世界上最大的枪。
0x0100004C0000080F	Dialogue Text	KINEEMA / STATION CALL	Alice	She sighs. "Right... please hold."	她叹了口气。“好吧……请等一下。”
0x0100004C00000815	Dialogue Text	KINEEMA / STATION CALL	Alice	"Just a moment, officer..."	“稍等一下，警官……”
0x0100004C0000081B	Dialogue Text	KINEEMA / STATION CALL	Jules Pidieu	"I'm not going to..."	“我不会这么说的……”
0x0100004C00000821	Dialogue Text	KINEEMA / STATION CALL	Mack Torson	"Ask him!"	“问他！”
0x0100004C00000827	Dialogue Text	KINEEMA / STATION CALL	Jean Vicquemare	"Mack, man the door," he gestures Torson to block the doorway, then turns to Minot. "You know what he told me? 'I don't want to get better -- I want to get worse.' Those were his words." He sighs heavily and turns to address the room...	“麦克，守好门，”他朝托森打了个手势，让他堵住门口，然后转向迈诺特。“你知道他跟我说什么吗？‘我不想变好——我想变得更糟糕’这是他的原话。”他重重地叹了口气，然后转向房间……
0x0100004C0000082D	Dialogue Text	KINEEMA / STATION CALL	Judit Minot	"I just know we can't give up on him when he's at his weakest. He wouldn't..." The crowd in the room has started fidgeting uncomfortably. Someone's trying to slip out unnoticed.	“我只知道我们不能在他最脆弱的时候放弃他。他不会……”房间里的众人开始有些坐立不安。有人想乘人不注意偷溜出去。
0x0100004C00000833	Dialogue Text	KINEEMA / STATION CALL	Alice	"Just a second, officer..." She puts you on hold, the static crackling softly like a bonfire. After a while you hear an old man greet you from the radio. His rattly voice is oddly familiar:	“稍等一下，警官……”她把你放到保留状态，电流像营火一样，轻轻发出噼里啪啦的声响。过了一会儿，你听到一个电话那头传来一个老人的问候声，他那沙哑的声音让你觉得出奇的熟悉：
0x0100004C00000839	Dialogue Text	KINEEMA / STATION CALL	Jules Pidieu	"That's a negative. Not going to say that. Over."	“那就是否定了。我不会这么说的。完毕。”
0x0100004C00000844	Dialogue Text	KINEEMA / STATION CALL	Mack Torson	"What's he saying? Share with the class!"	“他说了什么？跟我们分享一下？”
0x0100004C0000084A	Dialogue Text	KINEEMA / STATION CALL	Jean Vicquemare	"Yeah? How do you fucking plan to do that, huh?! Get him off the drink?! Go jogging with him in the morning and get him on carrot juice?! He's a lost man!"	“是吗？！那你他妈的打算怎么搞，哈？！让他戒酒？！早晨跟他一起慢跑，让他喝胡萝卜果汁？！他已经彻底迷失了！”
0x0100004C00000850	Dialogue Text	KINEEMA / STATION CALL	Jules Pidieu	"He... He said he sodomized your mother."	“他……他说跟你母亲走过后门。”
0x0100004C00000856	Dialogue Text	KINEEMA / STATION CALL	Judit Minot	"We must help him." Minot looks down at her neatly polished black shoes. There is a quiet firmness to her voice when she speaks.	迈诺特低头看着她那双锃亮的黑色皮鞋。当她说话时，她的声音平静而坚定：“我们必须帮他。”
0x0100004C0000085C	Dialogue Text	KINEEMA / STATION CALL	Mack Torson	"The prick ate momma's vanilla waffles at the captain's birthday party! Some nerve he's got..."	“那个混蛋在警长的生日宴会上吃过妈妈做的香草华夫饼！他真有胆量敢……”
0x0100004C00000866	Dialogue Text	KINEEMA / STATION CALL	Chester McLaine	"Sure her vanilla waffles were the only thing he ate?"	“确定他只吃了她的香草华夫饼吗？”
0x0100004C00000872	Dialogue Text	KINEEMA / STATION CALL	Mack Torson	"Shut up, Chester, this isn't funny. This is my mom we're talking about!"	“闭嘴，切斯特，这一点也不好笑。你们说的可是我妈！”
0x0100004C00000878	Dialogue Text	KINEEMA / STATION CALL	You	Say nothing.	什么也不说。
0x0100004C0000087E	Dialogue Text	KINEEMA / STATION CALL	Mack Torson	"Tell him to apologize right now!"	“让他现在就给我道歉！”
0x0100004C00000884	Dialogue Text	KINEEMA / STATION CALL	Jules Pidieu	"10-4, come in, officer! Over."	“10-4，呼叫，警官！完毕。”
0x0100004C0000088A	Dialogue Text	KINEEMA / STATION CALL	Jules Pidieu	"Sergeant Torson requests that you apologize for the claims you made about his mother. Over."	“托森警长要求你为刚才说出的关于他母亲的那些言论道歉。完毕。”
0x0100004C00000890	Dialogue Text	KINEEMA / STATION CALL	Jules Pidieu	"10-4, come in..." He hesitates. "...*Fire walker*. Over."	“10-4，呼叫……”他有些犹豫。“……*火行者*。完毕。”
0x0100004C0000089B	Dialogue Text	KINEEMA / STATION CALL	Mack Torson	"Yeah, Mullen was fucked alright. Sounded fucking drunk to me."	他突然插嘴进来：“是啊，马伦他妈的搞砸了。我听起来应该是他妈的喝醉了。”
0x0100004C000008A1	Dialogue Text	KINEEMA / STATION CALL	You	"Okay, tell him I'm sorry -- It was just banter, I thought that's what cops do."	“好吧，告诉他我很抱歉——开个玩笑而已，没有恶意，我觉得警察都会这么干。”
0x0100004C000008AC	Dialogue Text	KINEEMA / STATION CALL	Jules Pidieu	"He says he's sorry and he didn't mean nothing by it."	“他说他很抱歉，还有他不是有意的。”
0x0100004C000008B2	Dialogue Text	KINEEMA / STATION CALL	Jean Vicquemare	"He what...? He lost his badge?!"	“他什么……？他的警徽不见了？！”
0x0100004C000008B8	Dialogue Text	KINEEMA / STATION CALL	Mack Torson	"Okay, tell him..."	“好吧，告诉他……”
0x0100004C000008BE	Dialogue Text	KINEEMA / STATION CALL	Jean Vicquemare	"Enough!" The commotion dies down. All eyes turn to Satellite-Officer Vicquemare. "None of this is funny! It's fucking sad, that's what it is. He's a cop. He's one of us, goddamn this..."	随迁警官维克玛咬住指关节，接着一阵吼声传遍整个房间：“够了！”骚乱瞬间平息下来。所有目光都转向了他。“这一点都不好笑！真他妈太悲哀了，这他妈叫悲哀。他是个警察。他是我们中的一员，真他妈该死……”
0x0100004C000008C4	Dialogue Text	KINEEMA / STATION CALL	Jean Vicquemare	"Tell him to find his *goddamn* badge and gun, that's the *only* thing that matters here!"	“告诉他，赶紧找到他那*该死*的警徽和警枪，这是眼下*唯一*重要的事！”
0x0100004C000008ED	Dialogue Text	KINEEMA / STATION CALL	Jules Pidieu	"10-2, 10-5. This is 41st, come in! Over."	“10-2，10-5。这里是41分局，呼叫！完毕。”
0x0100004C000008F3	Dialogue Text	KINEEMA / STATION CALL	Jean Vicquemare	"I'm his *goddamn* partner!"	“我是他*该死的*搭档！”
0x0100004C000008F9	Dialogue Text	KINEEMA / STATION CALL	Chester McLaine	"Yeah, Mack's right, that was some gnarly shit there..."	他右边那个高个子笑的眼泪还没擦干。“是啊，麦克说得对，妈的痴线……”
0x0100004C00000903	Dialogue Text	KINEEMA / STATION CALL	Volition	You *really* need to get your shit together, this is nearing a complete meltdown.	你*真的*需要好好振作起来，现在离彻头彻尾的灾难已经很近了。
0x0100004C00000918	Dialogue Text	KINEEMA / STATION CALL	You	"Fire. Walker."	“火。行者。”
0x0100004C0000091E	Dialogue Text	KINEEMA / STATION CALL	Jean Vicquemare	"Fire-*water*? He's lost it... Fuck it, tell him to find his goddamn badge and gun, that's the only thing that matters!"	“火*什么*？他失心疯了……去他妈的，告诉他，赶紧找到他那该死的警徽和警枪，这是眼下唯一重要的事！”
0x0100004C00000924	Dialogue Text	KINEEMA / STATION CALL	You	"Hey, if you don't like the fallout, maybe *don't* fuck with the Firewalker!"	“喂，如果你不想自食恶果，那也许就*不要*惹毛火行者！”
0x0100004C0000092A	Dialogue Text	KINEEMA / STATION CALL	Jean Vicquemare	"Who?!" The disbelief in Vicquemare's voice is overwhelming.	“谁？！”维克玛的声音里有几分难以置信的味道。
0x0100004C00000930	Dialogue Text	KINEEMA / STATION CALL	Jules Pidieu	"10-2 (Receiving Well), 10-5 (Relay Message). This is 41st, come in! Over."	“10-2（接收良好），10-5（转达口信）。这里是41分局，呼叫！完毕。”
0x0100004C00000936	Dialogue Text	KINEEMA / STATION CALL	Jean Vicquemare	"Wrap it up, don't indulge in his drunken antics!"	“打住，别再沉溺在他酒后的丑态里了！”
0x0100004C0000093C	Dialogue Text	KINEEMA / STATION CALL	You	"Listen, I've actually lost my gun, too."	“听着，我其实还把枪搞丢了。”
0x0100004C00000942	Dialogue Text	KINEEMA / STATION CALL	Jules Pidieu	"Mack, he says maybe you shouldn't have antagonised the Firewalker in the first place."	“麦克，他说也许你不应该一开始惹恼火行者。”
0x0100004C00000954	Dialogue Text	KINEEMA / STATION CALL	Jules Pidieu	"Satellite-Officer Vicque---"	“随迁警官维克玛……”
0x0100004C0000095A	Dialogue Text	KINEEMA / STATION CALL	Jules Pidieu	"What do you need, sir? Over."	“你有什么需要，先生？完毕。”
0x0100004C00000960	Dialogue Text	KINEEMA / STATION CALL	Mack Torson	Mack 'The Torso' Torson is finger-fucking his fist, laughing hoarsely and apparently telling some dirty story to his partner, Chester McLaine, near the entrance.	‘躯干’·麦克·托森用手指头套弄着他的拳头，沙哑地大笑着，显然是在跟自己的搭档，入口处的切斯特·麦克莱恩讲着什么下流的故事。
0x0100004C00000966	Dialogue Text	KINEEMA / STATION CALL	Jules Pidieu	"I am afraid he might be referring to himself as *Firewater*, sir."	“恐怕他自称是*火行者*，先生。”
0x0100004C00000970	Dialogue Text	KINEEMA / STATION CALL	Esprit de Corps	A scrawny old man sits in a dusty cubicle, smoking, with a large white rectangle sewn on his vest. In front of him is a box-shaped apparatus with an array of wires and antennas -- the radio switchboard.	一个骨瘦如柴的老人站在一个满是灰尘的小隔间里抽着烟，马甲上还绣着一个巨大的白色长方形。在他面前是一个盒子形状的装置，上面布满一排排电线和天线——是无线电交换机。
0x0100004C00000976	Dialogue Text	KINEEMA / STATION CALL	Jules Pidieu	"He acknowledges your joke and asks you to lay off."	“他收到了你的笑话，要你消停点。”
0x0100004C00000988	Dialogue Text	KINEEMA / STATION CALL	Jean Vicquemare	"Lay off? Lay off?! Tell him we'll lay off when he retrieves the goddamn police property that he has been entrusted with."	“消停？他说消停？！告诉他，等他把上面郑重托付给他的警方财物找回来之后，我们再消停。”
0x0100004C0000098E	Dialogue Text	KINEEMA / STATION CALL	Jules Pidieu	"10-4, I know, I already wrote it in a report, but..." He hesitates. "It will stay on my desk for a few days. Over."	“10-4，我知道，我已经写进报告了，但是……”他有些犹豫。“它几天后才会出现在我的桌子上。完毕。”
0x0100004C000009AC	Dialogue Text	KINEEMA / STATION CALL	Jean Vicquemare	"Does he actually want something or is he hell-bent on disrupting our work?!"	“他是真的想要干什么，还是不顾一切地想要干扰我们的工作？！”
0x0100004C000009B2	Dialogue Text	KINEEMA / STATION CALL	Jules Pidieu	"Satellite-Officer..."	“随迁警官……”
0x0100004C000009BF	Dialogue Text	KINEEMA / STATION CALL	Jules Pidieu	"10-9, repeat message! I didn't get that, sir. Over."	“10-9，重复消息！我没听明白，先生。完毕。”
0x0100004C000009C5	Dialogue Text	KINEEMA / STATION CALL	You	"No, I think I'm good. I think I'm good without my gun, thanks."	“不，我觉得我没事。就算没了枪，我也挺好的，谢谢。”
0x0100004C000009D0	Dialogue Text	KINEEMA / STATION CALL	You	"I heard him and I'm on it. "	“我听到他的话了，马上就去办。”
0x0100004C000009D6	Dialogue Text	KINEEMA / STATION CALL	Inland Empire	You probably don't *want* to continue on this road.	也许你不*想*继续这条路了。
0x0100004C000009DC	Dialogue Text	KINEEMA / STATION CALL	Jules Pidieu	"10-4, affirmative. Officer is in pursuit of his firearm." There's static.	“10-4，肯定。警官在追查他的武器。”有一点杂音。
0x0100004C00000A03	Dialogue Text	KINEEMA / STATION CALL	Jules Pidieu	"I'm going to report that you are in pursuit of your service weapon. Over."	“我会回报说你在追查自己的警枪。完毕。”
0x0100004C00000A09	Dialogue Text	KINEEMA / STATION CALL	You	"10-4, Station 41. I've got a urgent business. Over."	“10-4，41分局。我有急事。完毕。”
0x0100004C00000A15	Dialogue Text	KINEEMA / STATION CALL	You	"Hi, this is... *me* here, I work at your station."	“嗨，是……*我*，我在你们警局工作。”
0x0100004C00000A1B	Dialogue Text	KINEEMA / STATION CALL	Jules Pidieu	"10-... uh... excuse me, sir? Over."	“10-……呃……请原谅，先生？完毕。”
0x0100004C00000A21	Dialogue Text	KINEEMA / STATION CALL	Jules Pidieu	"The officer is describing his genitalia in exaggerated terms. Over."	“这名警官在用夸张的语言描述他的命根子。完毕。”
0x0100004C00000A2C	Dialogue Text	KINEEMA / STATION CALL	You	"It's got a magnetic accelerator an *arc* that accelerates the energized ball of periwinkle-blue hydrogen-based *blaasma* to near light speed..."	“它有一个电磁加速器，还有一个*电弧*，可以将氢基滨螺蓝*等离子*的能量球加速到接近光速……”
0x0100004C00000A32	Dialogue Text	KINEEMA / STATION CALL	Interfacing	Click, your index finger goes as the thumb cocks the hammer, click, cock, click... and then nothing. Three-shot, probably. Needs reloading. Break it open.	咔哒，你用食指和翘起的大拇指做成锤子的样子，咔哒，嘀嗒，咔哒……然后停下来。大概是敲了三下。需要重新填充。把它打开。
0x0100004C00000A38	Dialogue Text	KINEEMA / STATION CALL	Encyclopedia	You are describing a Villiers three-shot 9mm Pepperbox with a revolving barrel.	你在描述一支维利耶9毫米、带转筒的三发转管手枪。
0x0100004C00000A49	Dialogue Text	KINEEMA / STATION CALL	Jules Pidieu	"So, was there anything else?"	“所以，你还有别的事吗？”
0x0100004C00000A4F	Dialogue Text	KINEEMA / STATION CALL	You	"You really think I'd lose my *Villiers 9mm*? Nine millimetres of red hot leaden pepper for you right here, boys!"	“你真以为我搞丢*维利耶9毫米*手枪了？小伙子们，给你们看看，9毫米火红热辣的铅制小辣椒！”
0x0100004C00000A5B	Dialogue Text	KINEEMA / STATION CALL	You	"Triangular barrel, three shot, hammer at the end -- what else do you want from me? To tell you all about my wooden handle? Lay off, boys."	“三角枪管，三发，尾部有锤子——你还想从我这里得到什么？跟你说说我的木柄吗？消停点吧，小伙子们。”
0x0100004C00000A67	Dialogue Text	KINEEMA / STATION CALL	Jules Pidieu	"He's describing his Pepperbox alright."	“他在描述自己的转管手枪。”
0x0100004C00000A6D	Dialogue Text	KINEEMA / STATION CALL	Jules Pidieu	"10-4 (Message Received), 10-5 (Relay Message). What's your status? Over."	“10-4（收到消息），10-5（转达消息）。请报告你现在的情况？完毕。”
0x0100004C00000A73	Dialogue Text	KINEEMA / STATION CALL	Jules Pidieu	"10-4, what's your status? Over."	“10-4，你现在什么情况？完毕。”
0x0100004C00000A7D	Dialogue Text	KINEEMA / STATION CALL	Jean Vicquemare	"Well, I guess he'd better crack the case before sundown then!"	“好吧，那我猜他最好在太阳下山前把案子给破了！”
0x0100004C00000A87	Dialogue Text	KINEEMA / STATION CALL	Jules Pidieu	"10-4, well that's a..."	“10-4，这是……”
0x0100004C00000A8D	Dialogue Text	KINEEMA / STATION CALL	Jean Vicquemare	"He isn't getting a red cent, you can tell him that!"	“他一分钱也拿不到，你可以直接告诉他！”
0x0100004C00000A99	Dialogue Text	KINEEMA / STATION CALL	You	(Speak into the radio.) "It's a single-shot Armistice Kiejl A9. Over."	（对着无线电说。）“是单发枪，基耶尔止战者A9。完毕。”
0x0100004C00000A9F	Dialogue Text	KINEEMA / STATION CALL	Jules Pidieu	"Says it's a Kiejl 9mm...  Armistice."	“说它是一把基耶尔A9……止战者。”
0x0100004C00000AAE	Dialogue Text	KINEEMA / STATION CALL	Jean Vicquemare	"Armistice? What, is he a fucking...? Clearly he doesn't have his Villiers anymore."	“什么？止战者？他妈的，难道他……显然他的维利耶没了。”
0x0100004C00000AB4	Dialogue Text	KINEEMA / STATION CALL	Judit Minot	"What is going on here? Did something happen?" she asks, startled. Jean Vicquemare turns to her and says...	“这是怎么回事？出什么事了吗？”她惊恐地询问到。让·维克玛转向她，然后说到……
0x0100004C00000ABE	Dialogue Text	KINEEMA / STATION CALL	Jules Pidieu	"Understood, sir. Over."	“明白，先生。完毕。”
0x0100004C00000AC4	Dialogue Text	KINEEMA / STATION CALL	You	"In contact it *detonates* with the power of a dying star, erasing every living thing from existence. Oh, and did I mention it is dripping with sexy blue blaasma?"	“与它接触时，它会*引爆*出一颗垂死之星的能量，消灭所有生命的存在。哦，我有没有提过它还能发射性感的蓝色等离子光束？”
0x0100004C00000ACA	Dialogue Text	KINEEMA / STATION CALL	Jules Pidieu	"Uh... I'm going to need to put you on speaker for a second. Over."	“呃……我要开一下扬声器。完毕。”
0x0100004C00000AD0	Dialogue Text	KINEEMA / STATION CALL	You	"Just reporting in. Over."	“只是报道一下。完毕。”
0x0100004C00000AD6	Dialogue Text	KINEEMA / STATION CALL	You	"My status? I, uh..."	“我的情况？我，呃……”
0x0100004C00000AE1	Dialogue Text	KINEEMA / STATION CALL	Jean Vicquemare	"Sounds like he's being deliberately vague."	“听起来他是故意含糊其辞。”
0x0100004C00000AE7	Dialogue Text	KINEEMA / STATION CALL	Chester McLaine	"Detective Mullen has done it again! 'Uh... where's my gun?'" the speaker crudely mimics your voice.	“马伦警探又来了！‘呃……我的枪呢？’”说话者粗鲁地模仿着你的声音。
0x0100004C00000AFC	Dialogue Text	KINEEMA / STATION CALL	Mack Torson	"Dear god, he lost his gun!!! Oh my... I can't... He..." The man succumbs to laughter again.	“我的天啦，他的枪不见了！！！我的天……这简直……他怎么能……”那人忍不住又笑了起来。
0x0100004C00000B02	Dialogue Text	KINEEMA / STATION CALL	Chester McLaine	"Mack can face the Giant of Koko Nur by himself, but Disco here made him piss his pants!"	“麦克可以自己单挑科科努尔巨人，但是迪斯科却让他尿裤子了！”
0x0100004C00000B08	Dialogue Text	KINEEMA / STATION CALL	Mack Torson	"Oh I... I can't... Fuuuuuck, he lost his... Ask him if he still has his wiener!"	“哦我……我……我不能……该死，他弄丢了他的……问问他的香肠还在不在！”
0x0100004C00000B0E	Dialogue Text	KINEEMA / STATION CALL	Jean Vicquemare	"This isn't really a laughing matter..."	“这真的不是闹着玩的……”
0x0100004C00000B25	Dialogue Text	KINEEMA / STATION CALL	You	(Put the microphone back in its holder and quit the call.)	（把话筒放回支架，结束通话。）
0x0100004C00000B2B	Dialogue Text	KINEEMA / STATION CALL	You	"That's affirmative. Over."	“那是肯定的。完毕。”
0x0100004C00000B31	Dialogue Text	KINEEMA / STATION CALL	You	"I just thought you might have heard of them, that's all."	“我只是觉得你可能听说过他们，仅此而已。”
0x0100004C00000B3D	Dialogue Text	KINEEMA / STATION CALL	Jules Pidieu	"He says he doesn't have it."	“他说他没有。”
0x0100004C00000B49	Dialogue Text	KINEEMA / STATION CALL	Jules Pidieu	"Anything else, sir? Over."	“还有别的事吗，先生？完毕。”
0x0100004C00000B53	Dialogue Text	KINEEMA / STATION CALL	You	"Nothing. Never mind."	“没什么。没事了。”
0x0100004C00000B59	Dialogue Text	KINEEMA / STATION CALL	You	"Say. My. Name."	“说出。我的。名字。”
0x0100004C00000B64	Dialogue Text	KINEEMA / STATION CALL	You	"It's a gun, what can I say? A regular god damn murder weapon, you know how they are -- *bang-bang*."	“它可是枪，我能说什么？一把普通的该死的杀人武器，你知道它们是怎么回事——*砰-砰*。”
0x0100004C00000B76	Dialogue Text	KINEEMA / STATION CALL	Jules Pidieu	"He says it's important to the case."	“他说对案子很重要。”
0x0100004C00000B94	Dialogue Text	KINEEMA / STATION CALL	You	"Trick question. I'm a martial artist. My entire body is one big gun."	“偏题了。我是个武术家。我的整个身体就是一把枪。”
