ArticyId	TermType	ConvTitle	Actor	En	Zh
0x010000580001AD83	Dialogue Text	LIFELINE / GIVING UP	You	"I wish I was fucking dead. Fuck you, fuck you."	“我真他妈希望自己要死了。去你妈的，操。”
0x010000580001AD89	Dialogue Text	LIFELINE / GIVING UP	Volition	Nothing you can say would make you feel any better now...	现在你说什么也不会让感觉变得好起来……
0x010000580001ADAC	Dialogue Text	LIFELINE / GIVING UP	You	"I'm done. No one even likes cops."	“我不干了。根本没人喜欢警察。”
0x010000580001ADBC	Dialogue Text	LIFELINE / GIVING UP	Volition	Despair creeps into you, getting fat on your weakness. Whatever noble intentions you once had as a police officer -- it's eating them all up now.	绝望渐渐爬进你的心底，因为你的软弱愈发膨胀。不论作为一名警察的你曾经有过多么崇高的意愿——现在都变成了它的食粮。
0x010000580001ADC7	Dialogue Text	LIFELINE / GIVING UP	Inland Empire	There's something else in there. There has to be. But -- it's like reaching your hand into muddy water, fishing around, and coming up with nothing...	还有些什么东西。肯定有什么。但是——就像把手伸进泥水中一样，不论怎么四下翻找，还是什么都没有……
0x010000580001ADCD	Dialogue Text	LIFELINE / GIVING UP	Kim Kitsuragi	"Yes, it can be difficult to be on the receiving end of so much distrust and outright hatred," he says with a sad half-smile.	“是啊，承受这么多的怀疑和赤裸裸的仇恨真的很难，”他露出悲伤的微笑。
0x010000580001ADD3	Dialogue Text	LIFELINE / GIVING UP	Conceptualization	You're still coming up with sentences. That's a step up from total annihilation, right?	你还在组织语言。这是离完全的毁灭又近了一步，是吗？
0x010000580001ADD9	Alternate1	LIFELINE / GIVING UP	You	"I'm seriously running out of shits to give. Let corpses hang on trees! I'm quitting. Fuck you."	“我真他妈什么办法也没了。就让尸体挂在树上吧！我不干了。去你妈的。”
0x010000580001ADD9	Dialogue Text	LIFELINE / GIVING UP	You	"I'm seriously running out of shits to give, Kim. Fuck you."	“我真的没什么好说的了，金。去死吧你。”
0x010000580001ADE1	Dialogue Text	LIFELINE / GIVING UP	Interfacing	Yeah, I'm pretty sure you're shit out of luck *fishing around* right now. You're drowning.	是啊，我很肯定你的*搜查*运走到尽头了。你已经被水淹没不知所措了。
0x010000580001ADE7	Alternate1	LIFELINE / GIVING UP	Kim Kitsuragi	"Fuck me? Please leave the *rage* you have for after we finish the investigation."	“去你妈的？请等到我们的调查结束之后再发泄你的*怒火*吧。”
0x010000580001ADE7	Dialogue Text	LIFELINE / GIVING UP	Kim Kitsuragi	"Fuck me? I understand this is by no means an easy investigation, but..."	“叫我去死？我理解这次调查一点也不轻松，不过……”
0x010000580001AE23	Dialogue Text	LIFELINE / GIVING UP	You	"I've wasted my life protecting humans. They don't deserve it."	“保护人类简直就是浪费我的生命。他们不值得。”
0x010000580001BD2C	Dialogue Text	LIFELINE / GIVING UP	Kim Kitsuragi	"I don't dispute that you have been charged with protecting the people of a particularly... challenging district. But poverty does not make one a loser -- poverty is just... poverty."	“我不否认，你确实被指控过，而且是因为保护这里的人，这个……很有挑战性地方的人。但是贫穷不会让人变成废材——贫穷只是……贫穷而已。”
0x010000580001BD32	Dialogue Text	LIFELINE / GIVING UP	Kim Kitsuragi	He watches your meltdown stoically from behind the lenses of his glasses.	他透过鼻梁上的眼镜片，恬淡地看着你陷入崩溃。
0x010000580001BD38	Dialogue Text	LIFELINE / GIVING UP	Cuno	"Too late for that. So whatcha gonna do now? Skewer yourself?"	“现在已经太迟了。所以你打算怎么做？狠狠地嘲笑自己？”
0x010000580001BD3E	Dialogue Text	LIFELINE / GIVING UP	Cuno	"Cuno don't give a shit about your shits."	“坤诺才不管你那张臭嘴说出的屁话。”
0x010000580001BD46	Dialogue Text	LIFELINE / GIVING UP	Cuno	"That you are a loser, Cuno doesn't doubt, but why go around whining about it?"	“你是个废材，坤诺完全不怀疑这一点，但是你为什么还要到处抱怨呢？”
0x010000580001BD4B	Dialogue Text	LIFELINE / GIVING UP	Cuno	"Cuno knew the pig was a f****t."	“坤诺知道这头猪是个狗娘养的杂种。”
0x010000580001BD50	Dialogue Text	LIFELINE / GIVING UP	You	"I wish I was fucking dead. Fuck you, fuck you Cuno."	“我真他妈希望自己要死了。还有你，坤诺，去死吧你。”
0x010000580001BD56	Dialogue Text	LIFELINE / GIVING UP	You	"I'm done. No one even likes cops."	“我不干了。根本没人喜欢警察。”
0x010000580001BD5C	Alternate1	LIFELINE / GIVING UP	You	"I'm seriously running out of shits to give. Let corpses hang on trees! I'm quitting."	“我真他妈什么办法也没了。就让尸体挂在树上吧！我不干了。”
0x010000580001BD5C	Dialogue Text	LIFELINE / GIVING UP	You	"I'm seriously running out of shits to give, Cuno. I'm quitting."	“我真的没什么好说的了，坤诺。老子不干了。”
0x010000580001BD69	Dialogue Text	LIFELINE / GIVING UP	You	"I've wasted my life protecting humans. They don't deserve it."	“保护人类简直就是浪费我的生命。他们不值得。”
0x010000580001BD88	Dialogue Text	LIFELINE / GIVING UP	You	Fuck Martinaise, fuck Revachol. And fuck me. I'm done.	去他妈的马丁内斯，去他妈的瑞瓦肖。还有我自己。老子不干了。
0x010000580001BD8E	Dialogue Text	LIFELINE / GIVING UP	You	I'm done. No one even likes cops.	我不干了。根本没人喜欢警察。
0x010000580001BD99	Dialogue Text	LIFELINE / GIVING UP	You	"I've wasted my life protecting humans. They don't deserve it."	“保护人类简直就是浪费我的生命。他们不值得。”
0x010000580001BD9F	Alternate1	LIFELINE / GIVING UP	You	I'm seriously running out of shits to give. To hell with it.	“我真他妈什么办法也没了。见鬼去吧。”
0x010000580001BD9F	Dialogue Text	LIFELINE / GIVING UP	You	I'm seriously running out of shits to give. To hell with all of this.	我真的没什么好说的了。让这一切见鬼去吧。
0x010000060001E7D8	Dialogue Text	LIFELINE / HEART ATTACK	You	"Help.. someone..."	“救命……有人吗……”
0x010000580001A504	Dialogue Text	LIFELINE / HEART ATTACK	You	So I'm guessing this is bad.	所以我猜，这不是件好事。
0x010000580001A50A	Dialogue Text	LIFELINE / HEART ATTACK	Savoir Faire	Well, this feels familiar.	呃，这种感觉挺熟悉的。
0x010000580001A510	Dialogue Text	LIFELINE / HEART ATTACK	Endurance	Very. *Very* bad. *This is the end* bad.	非常。*非常*糟糕。有*这一切都结束了*那么糟糕。
0x010000580001A51C	Dialogue Text	LIFELINE / HEART ATTACK	You	I'm sure it's just heartburn. Oh god...	我肯定只是胃灼热而已。天啦……
0x010000580001A524	Dialogue Text	LIFELINE / HEART ATTACK	Endurance	No. It's many years of combined self-neglect and self-abuse.	不。这是多年的自我忽略再加上自虐。
0x010000580001A530	Dialogue Text	LIFELINE / HEART ATTACK	Composure	Don't go grabbing at your chest and screaming bloody murder. Keep your cool. Remember -- looking good always makes you feel better.	别抓着你的胸口然后尖叫着什么血腥谋杀了。自己冷静一点。要记住——看起来不错的时候，自己的感觉也会变得不错。
0x010000580001A536	Dialogue Text	LIFELINE / HEART ATTACK	Pain Threshold	We've been here before. You've got this.	以前也有过这种状况。你能搞定的。
0x010000580001A53C	Dialogue Text	LIFELINE / HEART ATTACK	Half Light	Fucking shit, I'm scared. What do I do? Who do I call?	就听你鬼扯吧，哥们我在这儿都要吓晕了好吗。我该怎么办？要打给谁才好？
0x010000580001A542	Dialogue Text	LIFELINE / HEART ATTACK	Endurance	Nope, sorry, you don't. Not this time.	不，不好意思，不行。这次不行。
0x010000580001A54D	Dialogue Text	LIFELINE / HEART ATTACK	Endurance	Don't think this is a sign of anything other than your heart failing.	别把它当做是心脏衰竭的信号就行。
0x010000580001A553	Dialogue Text	LIFELINE / HEART ATTACK	You	The end of the world is here.	世界末日到了。
0x010000580001A574	Dialogue Text	LIFELINE / HEART ATTACK	Endurance	Yeah, screaming isn't happening on account of extreme shortness of breath. You're just making it worse. Oh god, it's painful...	是啊，极度呼吸急促的时候是没法尖叫的。你只是让它变得更糟糕了。天啦，真的好痛苦……
0x010000580001A57A	Dialogue Text	LIFELINE / HEART ATTACK	Physical Instrument	Get it together, boy. You've gotta hold on, no matter how bad...	不要乱，小伙子。不管情况变得多糟糕，你也得坚持下去。
0x010000580001A5A2	Dialogue Text	LIFELINE / HEART ATTACK	Endurance	All you feel is pain and weakness. You have to surrender now. We all do, it gets *so* dark. You don't even see her face, like you always thought you would. You only see pain and fear.	你能感到的只剩下疼痛和虚弱。现在你必须投降。我们都会这么做，眼前变得*如此*黑暗。你甚至看不清她的脸，就像你一直以为的那样。你只看到痛苦和恐惧。
0x010000580001A5C4	Dialogue Text	LIFELINE / HEART ATTACK	You	Try to remain conscious.	试着保持清醒。
0x010000580001A632	Dialogue Text	LIFELINE / HEART ATTACK	Endurance	You feel something in your chest. An unnatural pressure. It's spreading to your left arm, your jaw...	你感到胸中有什么东西。一种不自然的压力。它慢慢朝你的左胳膊扩散，然后是你的下巴……
0x010000580001A655	Dialogue Text	LIFELINE / HEART ATTACK	You	Let it all go.	放下一切吧。
0x010000580001A65B	Dialogue Text	LIFELINE / HEART ATTACK	Endurance	There's no shame in surrendering now. We all do, it gets *so* dark. You don't even see her face, like you always thought you would. You only see pain and fear.	现在投降一点也不羞愧。我们都会这么做，眼前变得*如此*黑暗。你甚至看不清她的脸，就像你一直以为的那样。你只看到痛苦和恐惧。
