ArticyId	TermType	ConvTitle	Actor	En	Zh
0x010000580001D8AA	Dialogue Text	PIER ORB / ultraliberal quest pre-cindy	Drama	Rehearsal helps fine tune a performance. Learn your lines so they can flow out of you like Herc Zeitung's legendary soliloquy in 'Hoppla, jetzt komm ich!'!	排练可以提高演出效果。你要记住你的台词，这样你就能像赫克·泽依顿在《我回来了》当中讲出那段传奇独白一样，把你要说的话脱口而出！
0x010000580001D8B0	Dialogue Text	PIER ORB / ultraliberal quest pre-cindy	You	Alright, I'm listening.	好吧，我听着呢。
0x010000580001D8C0	Dialogue Text	PIER ORB / ultraliberal quest pre-cindy	Savoir Faire	Artistos are known to *repel* wealth. It bounces off their skin like rubber. The moment a reasonable business proposal enters their periphery, they go and get 'political'.	众所周知，艺术家们*厌恶*金钱。金钱会像橡胶一般，只要碰触到他们的皮肤就会被弹开。如果有一份合理的商业计划书放在他们眼前，他们便会开始考虑“政治”因素。
0x010000580001D8C7	Dialogue Text	PIER ORB / ultraliberal quest pre-cindy	Savoir Faire	What you need to do is lure them in with a strong one-liner -- get them on your side before you've even finished a sentence. Show us what you've got -- pretend you're facing the SKULL-girl!	所以你只需要用一句精炼的箴言吸引他们——在话还没说完之前，就让他们已经站在你这边了。我们来看看你的本事吧——假装你现在面对的就是骷髅女孩！
0x010000580001D8D2	Dialogue Text	PIER ORB / ultraliberal quest pre-cindy	You	I've got this. Trust me. [Leave.]	我明白了，相信我。[离开。]
0x010000580001D8D9	Dialogue Text	PIER ORB / ultraliberal quest pre-cindy	Savoir Faire	A streak of individuality? As you wish...	展露个性？如你所愿……
0x010000580001D8E1	Dialogue Text	PIER ORB / ultraliberal quest pre-cindy	Rhetoric	It's true, some of them are known to turn the entire thing into a happening.	确实，他们中有人很清楚怎么让某些事变成现实。
0x010000580001D8F0	Dialogue Text	PIER ORB / ultraliberal quest pre-cindy	You	(Lean in.) Hey beautiful. Let's go for a walk on the *wild side*.	（靠近些。）嘿，美女。我们去*野外*散个步吧。
0x010000580001D8F6	Dialogue Text	PIER ORB / ultraliberal quest pre-cindy	You	Hand over your art. Put it in the bag. NOW!!	把你的作品交出来，放进袋子里。快点！！
0x010000580001D8FC	Dialogue Text	PIER ORB / ultraliberal quest pre-cindy	You	Excuse me, could I please take a look at your art?	不好意思，我可以看一眼你的作品吗？
0x010000580001D903	Dialogue Text	PIER ORB / ultraliberal quest pre-cindy	Savoir Faire	What is this, a dating agency? Are you looking for a Pretty Young Thing to sponsor? Never mix business and pleasure -- *never*.	这是什么东西，婚介所吗？你要去赞助年轻漂亮的小姐吗？绝对不要把工作和娱乐混为一谈——*绝对不要*。
0x010000580001D90C	Dialogue Text	PIER ORB / ultraliberal quest pre-cindy	You	It's your lucky day! I'm in the market for some original *art* by the crème de la crème.	你今天可真走运！我正好想买一些优秀画家的原创*作品*。
0x010000580001D913	Dialogue Text	PIER ORB / ultraliberal quest pre-cindy	Savoir Faire	Holy-moly, are we being arrested here?! Only tax inspectors and debt collectors speak like that. You don't want to start your business relationship with the wrong vibe.	天呐，这是被逮捕了吗？！只有税务稽查员和收债人才会这么说吧。你不也不想在糟糕的氛围里开启商业联系吧。
0x010000580001D918	Dialogue Text	PIER ORB / ultraliberal quest pre-cindy	Electrochemistry	Counterpoint! What if pleasure *is* your business? Gigolos make bank *and* get that wet-wet. It's never too late to change careers...	正相反！如果娱乐*就是*你的工作呢？小白脸既可以赚钱*又可以*爽到。现在换职业还不算太迟……
0x010000580001D91D	Dialogue Text	PIER ORB / ultraliberal quest pre-cindy	Reaction Speed	But it would catch her off-guard. That's *always* an advantage.	但这样能让她措手不及。这*绝对*是一大优势。
0x010000580001D923	Dialogue Text	PIER ORB / ultraliberal quest pre-cindy	Savoir Faire	Boring... BORING... Yawning my jaw off here... Next!	无聊……无聊……我打哈欠打得下巴都快掉了……下一个！
0x010000580001D930	Dialogue Text	PIER ORB / ultraliberal quest pre-cindy	Savoir Faire	Mamma mia, if this isn't the Top Seller in La Delta! Everyone knew you'd eventually get it right...	妈妈咪呀，这不是德尔塔的畅销冠军吗！大家都知道你一定会成功的……
0x010000580001D936	Dialogue Text	PIER ORB / ultraliberal quest pre-cindy	Suggestion	Hmm, it's a decent start, but you might need to change strategies down the line...	嗯，这是个不错的开场白，不过可能得彻底改变一下策略……
0x010000580001D940	Dialogue Text	PIER ORB / ultraliberal quest pre-cindy	Savoir Faire	Okay then, off you go! Let's see what you've got.	那好吧，你去吧！让我们看看你的本事。
0x010000580001D94B	Dialogue Text	PIER ORB / ultraliberal quest pre-cindy	Savoir Faire	Mamma mia, if this isn't the Top Seller in La Delta! No one expected you to nail this on the *first* try -- *congratulazioni*!	妈妈咪呀，这不是德尔塔的畅销冠军吗！谁也不指望你*第一次*尝试就能成功——*祝你好运*！
0x010000580001D963	Dialogue Text	PIER ORB / ultraliberal quest pre-cindy	Empathy	It's polite. What's wrong with being polite?	这是礼貌。礼貌有什么不好的？
0x010000580001D97A	Dialogue Text	PIER ORB / ultraliberal quest pre-cindy	Suggestion	Nonsense, no one 'repels wealth', the businessmen just don't know how to entice them.	胡说，没人会*厌恶金钱*，只是商人们不知道怎么去引诱他们。
0x010000580001FB47	Dialogue Text	PIER ORB / ultraliberal quest pre-cindy	Savoir Faire	There! Right in front of you. Do you see it?	看！就在你面前。看见了吗？
0x010000580001FB5D	Dialogue Text	PIER ORB / ultraliberal quest pre-cindy	Savoir Faire	There! Right in front of you. Do you see it? It's an artist!	看！就在你面前。看见了吗？是一位艺术家！
0x010000580001FB6C	Dialogue Text	PIER ORB / ultraliberal quest pre-cindy	Savoir Faire	What you need to do is lure them in with a strong one-liner -- get them on your side before you've even finished a sentence. Show us what you've got -- pretend you're facing the girl!	所以你只需要用一句精炼的箴言吸引他们——在话还没说完之前，就让他们已经站在你这边了。我们来看看你的本事吧——假装你现在面对的就是那个姑娘！
0x0100005800020625	Dialogue Text	PIER ORB / ultraliberal quest pre-cindy	You	(Whip out your finger pistols and bang them in the sky.) It's your lucky day! I'm in the market for some original *art* by the crème de la crème.	（掏出你的手指枪朝天空开枪。）“今天算你走运！我正好在找原创*艺术品*里精品中的精品。”
