ArticyId	TermType	ConvTitle	Actor	En	Zh
0x0100006B0000184E	Dialogue Text	SEAFORT INT / FELD INSULAR CONSOLE	Cuno	"Whoa... Told you. Military mega grade. Also, like, four hundred years old, I think? A thousand?"	“哇啊……告诉过你了吧。这是军工级的。而且，差不多，有400多年了吧，我猜？也许1000年？”
0x0100006B00009C3E	Dialogue Text	SEAFORT INT / FELD INSULAR CONSOLE	Cuno	"Who the fuck is Soona?" he grunts. "Never mind. It won't work. This is fucking... military mega-grade shit, you know? It's also, like, four hundred years old."	“苏娜他妈的又是谁？”他咕噜着。“无所谓了。反正没用的。这他妈可是……军事百万级，你知道的。而且好像，有400多年了吧。”
0x0100008900001553	Alternate1	SEAFORT INT / FELD INSULAR CONSOLE	Small Blast Door	The door comes screeching to a halt. Behind it you see a hole in the concrete wall. A gust of wind blows in.	门嘎吱嘎吱地停住了。在那背后，你看见混凝土墙上有一个洞，一阵风吹了进来。
0x0100008900001553	Dialogue Text	SEAFORT INT / FELD INSULAR CONSOLE	Small Blast Door	The door comes screeching to a halt. Behind it you see a hole in the concrete wall, where light shines in.	门嘎吱嘎吱地停住了。在那背后，你看见混凝土墙上有一个洞，有光线从里面透出来。
0x010000890000289D	Dialogue Text	SEAFORT INT / FELD INSULAR CONSOLE	Perception (Sight)	Pollen drifts in the light shaft.	花粉在光束中漂浮。
0x01000089000028A3	Dialogue Text	SEAFORT INT / FELD INSULAR CONSOLE	Half Light	A sudden wave of anxiety makes your skin crawl.	突然，一阵焦虑感爬上了你的皮肤。
0x01000089000028AE	Dialogue Text	SEAFORT INT / FELD INSULAR CONSOLE	Shivers	No, it's more than that. There's something there, waiting.	不，绝对不止这些。有什么正在那里，等待着。
0x01000089000028C1	Dialogue Text	SEAFORT INT / FELD INSULAR CONSOLE	You	"Let's go." [Leave.]	“我们走吧。”[离开。]
0x01000089000028C7	Dialogue Text	SEAFORT INT / FELD INSULAR CONSOLE	You	"There was something I needed to do with this console first..."	“我还要先弄一下这个控制台……”
0x01000089000028CD	Dialogue Text	SEAFORT INT / FELD INSULAR CONSOLE	Cuno	"Why? The door is open -- we can just fuck on now."	“为什么？门都开了——我们他妈的可以走了啊。”
0x01000089000028EA	Dialogue Text	SEAFORT INT / FELD INSULAR CONSOLE	You	"What's there?"	“那里有什么？”
0x01000089000028F0	Dialogue Text	SEAFORT INT / FELD INSULAR CONSOLE	You	"Before -- outside. When we were walking across the sand, I felt someone watching me."	“刚才——在外面。我们走过沙滩的时候，我感觉有人在看着我。”
0x01000089000028F6	Dialogue Text	SEAFORT INT / FELD INSULAR CONSOLE	Cuno	"Cuno doesn't know, but Cuno wants to know."	“坤诺不知道，但是坤诺想知道。”
0x01000089000028FC	Dialogue Text	SEAFORT INT / FELD INSULAR CONSOLE	Cuno	"Cuno knows. This place is spooky as fuck."	“坤诺知道。这地方妈的像闹鬼一样。”
0x010000060000E52B	Dialogue Text	SEAFORT INT / MICROGRID GENERATOR	Rhetoric	If anyone's stayed here, they'd need a generator.	如果有人待在这儿，他们会需要一台发电机。
0x010000060000E556	Dialogue Text	SEAFORT INT / MICROGRID GENERATOR	Kim Kitsuragi	"Someone with basic electrical skills has restored it in order to keep the room warm."	“某个懂基础电气技能的人修好了它，来保持这个房间的温度。”
0x010000060000E561	Dialogue Text	SEAFORT INT / MICROGRID GENERATOR	Logic	It's...	那是……
0x010000060000E570	Dialogue Text	SEAFORT INT / MICROGRID GENERATOR	You	"The fire guy. Some kids told me about a *guy* here. A guy who made a fire."	“那个火人。有几个小孩跟我说过这里的*那个家伙*。一个生火的男人。”
0x010000060000E577	Dialogue Text	SEAFORT INT / MICROGRID GENERATOR	Cuno	"All right." He claps his hands. "We're on to something -- Cuno meant fire guy too."	“好吧。”他拍拍手。“我们抓到什么了——坤诺也在说那个火人。”
0x010000060000E588	Dialogue Text	SEAFORT INT / MICROGRID GENERATOR	You	"Do *you* know anything about a fire guy?"	“*你*认不认识那个火人？”
0x010000060000E590	Dialogue Text	SEAFORT INT / MICROGRID GENERATOR	Cuno	"Yeah -- no." He quickly turns his attention back to the generator. "Cuno doesn't come here, I told you."	“是啊——不知道。”他很快又把注意力转回到发电机身上。“坤诺不来这里的，我告诉过你。”
0x0100000F00010BF1	Dialogue Text	SEAFORT INT / MICROGRID GENERATOR	Inland Empire	N-n-n-no. This isn't right...	不……不不。不对劲……
0x0100000F00010C00	Dialogue Text	SEAFORT INT / MICROGRID GENERATOR	You	What's the matter?	怎么了？
0x0100000F00010C05	Dialogue Text	SEAFORT INT / MICROGRID GENERATOR	You	Ignore it.	忽略它。
0x0100000F00010C0E	Dialogue Text	SEAFORT INT / MICROGRID GENERATOR	Inland Empire	'It's cold now,' he was supposed to say. 'But someone has been maintaining it. The wiring has been repaired'...	他本来应该说，“现在是冷的，不过有人一直在维护它。电线也修理过。”……
0x0100000F00010C13	Dialogue Text	SEAFORT INT / MICROGRID GENERATOR	Inland Empire	But he's not here to say it. Something *else* got in the way. Events *intervened*...	可是他没有这么说。有什么*别的原因*阻碍了他。事情被*干扰*了……
0x0100000F00010C18	Dialogue Text	SEAFORT INT / MICROGRID GENERATOR	Microgrid Generator	You brush away the thought and turn back to the generator.	你打消了念头，把注意力转回到发电机上。
0x0100000F00010C25	Dialogue Text	SEAFORT INT / MICROGRID GENERATOR	Inland Empire	W-w-w-wait. Haven't you heard this before?	等……等等。这话之前是不是听过？
0x0100000F00010C46	Dialogue Text	SEAFORT INT / MICROGRID GENERATOR	Kim Kitsuragi	"The kind that's favoured by vagrants and fuel thieves. It's been a long winter..."	“流浪汉和偷燃料的小贼就喜欢这种。毕竟冬天这么漫长……”
0x0100000F00010C4B	Dialogue Text	SEAFORT INT / MICROGRID GENERATOR	Kim Kitsuragi	The lieutenant pauses. Something seems to be pecking at the edge of his concentration. He gives you a sideways look before adding...	警督停顿了一下。似乎有什么东西分散了他的注意力。他瞥了你一眼，然后继续说道……
0x0100000F00010C50	Dialogue Text	SEAFORT INT / MICROGRID GENERATOR	Kim Kitsuragi	"... Long and cold."	“……漫长而又冰冷。”
0x0100000F00010C55	Dialogue Text	SEAFORT INT / MICROGRID GENERATOR	Esprit de Corps	There's no time to dwell on this moment. You've got to keep moving...	这时候没空去细想了。你必须继续行动……
0x010000450001C881	Dialogue Text	SEAFORT INT / MICROGRID GENERATOR	Microgrid Generator	An old cylindrical generator is nested above the ammo lift, with makeshift electrical wiring running out of its side and across the floor. The cables disappear into the wall to your right.	一台老式的圆柱形发电机嵌在弹药电梯上方，临时电线从侧面绕出，一路穿过整个地板。电线最终消失在你右侧的墙上。
0x010000450001C894	Dialogue Text	SEAFORT INT / MICROGRID GENERATOR	Kim Kitsuragi	The lieutenant puts his hand on the metal barrel, checking for warmth...	警督把手放在金属管上，检查它的温度……
0x010000450001C8A1	Dialogue Text	SEAFORT INT / MICROGRID GENERATOR	Kim Kitsuragi	"It's cold now," he concludes. "But someone has been maintaining it. The wiring has been repaired."	“现在是冷的，”他总结道。“不过有人一直在维护它。电线也修理过。”
0x010000450001C8AF	Alternate1	SEAFORT INT / MICROGRID GENERATOR	You	"Where do these wires lead?"	“这些电线通向什么地方？”
0x010000450001C8AF	Dialogue Text	SEAFORT INT / MICROGRID GENERATOR	You	Where do these wires lead?	这些电线通向什么地方？
0x010000450001C8B5	Alternate1	SEAFORT INT / MICROGRID GENERATOR	You	"What kind of generator is this?"	“这是哪种发电机？”
0x010000450001C8B5	Dialogue Text	SEAFORT INT / MICROGRID GENERATOR	You	What kind of generator am I looking at?	我眼前的这台是什么类型的发电机？
0x010000450001C8BB	Dialogue Text	SEAFORT INT / MICROGRID GENERATOR	You	"What does this mean? A generator here?"	“一台发电机为什么会在这里？这意味着什么？”
0x010000450001C8C1	Dialogue Text	SEAFORT INT / MICROGRID GENERATOR	You	[Leave.]	[离开。]
0x010000450001C8C8	Alternate1	SEAFORT INT / MICROGRID GENERATOR	Kim Kitsuragi	He looks at the wall socket. "Downstairs, into the console, then from there into the room's electronics."	他看着墙上的插座。“楼下，先进入控制台，然后是房间里的电子产品。”
0x010000450001C8C8	Dialogue Text	SEAFORT INT / MICROGRID GENERATOR	Kim Kitsuragi	He looks at the wall socket. "Downstairs somewhere."	他看着墙上的插座。“楼下的某个地方吧。”
0x010000450001C8E5	Dialogue Text	SEAFORT INT / MICROGRID GENERATOR	Kim Kitsuragi	"I don't know. I am not a philosopher."	“我不知道。我不是哲学家。”
0x010000450001C8EC	Dialogue Text	SEAFORT INT / MICROGRID GENERATOR	Conceptualization	That is his idea of a joke.	这是他对笑话的定义。
0x010000450001C8F3	Dialogue Text	SEAFORT INT / MICROGRID GENERATOR	Kim Kitsuragi	"Liquid carbon, I would imagine it takes *mazut*." He points to the open fuel cap on the side of the dynamo.	“液碳，我想应该要烧*重油*吧。”他指着发电机旁敞开的油箱盖。
0x010000450001C8FA	Dialogue Text	SEAFORT INT / MICROGRID GENERATOR	Kim Kitsuragi	"The kind that's favoured by vagrants and fuel thieves. It's been a long winter... Long and cold."	“流浪汉和燃料小偷就喜欢这种。毕竟冬天这么长……又漫长又冷。”
0x010000450001C901	Dialogue Text	SEAFORT INT / MICROGRID GENERATOR	You	Tap on the side.	轻拍侧面。
0x010000450001C909	Dialogue Text	SEAFORT INT / MICROGRID GENERATOR	Microgrid Generator	A hollow ring -- the canister is empty. Dust falls from the generator and down into the ammo lift.	一阵空洞的声音响起——里面是空的。灰尘从发电机上震落，落入弹药电梯。
0x010000450001C917	Dialogue Text	SEAFORT INT / MICROGRID GENERATOR	You	"I meant why is it here?"	“我是说它为什么会在这里？”
0x010000450001C91D	Dialogue Text	SEAFORT INT / MICROGRID GENERATOR	You	Say nothing.	什么也不说。
0x010000450001C925	Dialogue Text	SEAFORT INT / MICROGRID GENERATOR	You	"I am. This generator proves the universe is material..." (Kick the generator.)	“我是。这个发电机证明宇宙是物质的……”（踢一脚发电机。）
0x010000450001C935	Dialogue Text	SEAFORT INT / MICROGRID GENERATOR	Microgrid Generator	The wind outside picks up suddenly with a faint howl. Inside it's warm.	外面突然起风了，发出微弱的嚎叫。里面很温暖。
0x010000450001C93D	Dialogue Text	SEAFORT INT / MICROGRID GENERATOR	Kim Kitsuragi	"Someone with basic electrical skills has restored it in order to keep the room warm. Maybe it's the *fire guy*..."	“某个懂基础电气技能的人修好了它，来保持这个房间的温度。也许是那个*火人*……”
0x010000450001C94D	Dialogue Text	SEAFORT INT / MICROGRID GENERATOR	You	Put your hand on the machine.	把你的手放在机器上。
0x010000450001C959	Dialogue Text	SEAFORT INT / MICROGRID GENERATOR	Microgrid Generator	It's cold. Rust flakes off and sticks to your palm.	它很冷。锈迹片片剥落，粘在了你的掌心。
0x010000450001C969	Dialogue Text	SEAFORT INT / MICROGRID GENERATOR	Microgrid Generator	This old cylindrical generator waits with its fuel cap open. Makeshift electrical wiring runs out of its side and across the floor.	这是一台老式的圆柱形发电机，上面的油箱盖是敞开的。临时电线从侧面绕出，一路穿过整个地板。
0x010000450001C982	Alternate1	SEAFORT INT / MICROGRID GENERATOR	Microgrid Generator	Downstairs, into the console -- it's been established. From there they are distributed across the room...	楼下，接入控制台——已经搭建好了。从那里再分布到整个房间……
0x010000450001C982	Dialogue Text	SEAFORT INT / MICROGRID GENERATOR	Microgrid Generator	Downstairs somewhere -- or into the lighting perhaps? You can't tell.	楼下的某个地方——或者是接入照明系统的？你分辨不出来。
0x010000450001C9A3	Dialogue Text	SEAFORT INT / MICROGRID GENERATOR	Microgrid Generator	The industrial smell of *mazut* rises from the fuel cap. This generator uses heavy oil.	油箱盖中升腾起*重油*的工业味道。这台发电机是重油的。
0x010000450001D891	Dialogue Text	SEAFORT INT / MICROGRID GENERATOR	You	Pour fuel into the tank.	把燃料倒进罐子里。
0x010000450001D898	Dialogue Text	SEAFORT INT / MICROGRID GENERATOR	Kim Kitsuragi	The lieutenant assists you, holding the canister up to the fuel tank as you tilt. Dark brown viscous fluid pours out and the room fills with a chemical smell.	警督帮你稳住油桶，你倾斜油桶把燃料倒了进去。深褐色的粘稠液体倾泄而出，整个房间充满一股化学的味道。
0x010000450001D8A8	Dialogue Text	SEAFORT INT / MICROGRID GENERATOR	Microgrid Generator	There's a red starter switch on the side of the cylinder and a start rope on the other side -- the lieutenant flicks the switch.	汽缸一侧有个红色的启动开关，另一侧是一根启动绳——警督扳动了开关。
0x010000450001D8AF	Dialogue Text	SEAFORT INT / MICROGRID GENERATOR	Microgrid Generator	The recoil start wakes the old generator up. The machine sputters like an old war horse before settling down to a rattle.	反冲启动唤醒了这台老发电机。机器像老战马一样发出噼里啪啦的声响，随之嗡嗡地稳定下来。
0x010000450001D8B7	Dialogue Text	SEAFORT INT / MICROGRID GENERATOR	You	Pull the rope.	拉动绳子。
0x010000450001D8C6	Dialogue Text	SEAFORT INT / MICROGRID GENERATOR	Kim Kitsuragi	"That should do it."	“这样应该可以了。”
0x010000450001D8D4	Dialogue Text	SEAFORT INT / MICROGRID GENERATOR	Microgrid Generator	The room fills with a pervasive chemical smell as dark brown liquid flows into the tank. There's a red starter switch on one side of the cylinder and a start rope on the other.	深褐色的液体流入罐中，房间四处弥漫着一股化学的味道。汽缸的一侧有个红色的启动开关，另一侧是一根启动绳。
0x010000450001D8E1	Dialogue Text	SEAFORT INT / MICROGRID GENERATOR	You	Flick the switch.	扳动开关。
0x010000450001D8E7	Dialogue Text	SEAFORT INT / MICROGRID GENERATOR	You	Pull the rope.	拉动绳子。
0x010000450001D8F1	Dialogue Text	SEAFORT INT / MICROGRID GENERATOR	Microgrid Generator	A tiny red light glitters inside the burnt plastic.	一道微弱的红光在烧焦的塑料里晕染开来。”
0x010000450001D909	Dialogue Text	SEAFORT INT / MICROGRID GENERATOR	Microgrid Generator	The recoil start wakes the old generator up. The machine sputters like an old war horse before settling down to a rattle.	反冲启动唤醒了这台老发电机。机器像老战马一样发出噼里啪啦的声响，随之嗡嗡地稳定下来。
0x010000450001D911	Dialogue Text	SEAFORT INT / MICROGRID GENERATOR	Microgrid Generator	Nothing happens.	什么也没发生。
0x010000450001D931	Dialogue Text	SEAFORT INT / MICROGRID GENERATOR	Microgrid Generator	The tank is far from full, but there should be enough inside to keep it going for a day.	油罐还远远没有装满，但也足够维持一天了。
0x0100006B00001780	Alternate1	SEAFORT INT / MICROGRID GENERATOR	Cuno	He looks at the wall socket. "Downstairs into that console we saw. And then to the rest of the room. Yeah. Electrical shit."	他看着墙上的插座。“是我们之前在楼下看到的控制台。然后再通往房间的其他地方。是啊。电气之类的狗屁玩意。”
0x0100006B00001780	Dialogue Text	SEAFORT INT / MICROGRID GENERATOR	Cuno	He looks at the wall socket. "Dunno, looks like downstairs somewhere..."	他看着墙上的插座。“不知道，看起来像是楼下的某个地方……”
0x0100006B00001788	Dialogue Text	SEAFORT INT / MICROGRID GENERATOR	Cuno	"Smells like *mazut*." The kid taps on the open fuel cap on the side of the dynamo. "Heavy fuel shit."	“闻起来像*重油*”。小孩拍了拍发电机侧面开启的油箱盖。“重油之类的狗屁玩意。”
0x0100006B00001790	Dialogue Text	SEAFORT INT / MICROGRID GENERATOR	Cuno	Cuno puts his hand on the generator. "This shit's cold."	坤诺把手放在发电机上。“这破玩意凉了。”
0x0100006B00001796	Dialogue Text	SEAFORT INT / MICROGRID GENERATOR	Cuno	The boy helps you out, holding the canister up to the fuel tank as you tilt. Dark brown viscous fluid pours out and the room fills with a chemical smell.	男孩帮你扶稳油桶，你倾斜油桶把燃料倒了进去。深褐色的粘稠液体倾泄而出，整个房间充满一股化学的味道。
0x0100008900002725	Dialogue Text	SEAFORT INT / MICROGRID GENERATOR	Microgrid Generator	There's a red starter switch on the side of the cylinder and a start rope on the other side -- Cuno flicks the switch.	汽缸一侧有个红色的启动开关，另一侧是一根启动绳——坤诺扳动了开关。
0x010000890000272C	Dialogue Text	SEAFORT INT / MICROGRID GENERATOR	You	Pull the rope.	拉动绳子。
0x0100008900002732	Dialogue Text	SEAFORT INT / MICROGRID GENERATOR	Microgrid Generator	The recoil start wakes the old generator up instantly. The machine sputters like an old war horse before settling down to a rattle.	反冲启动立即唤醒了这台老发电机。机器像老战马一样发出噼里啪啦的声响，随之嗡嗡地稳定下来。
0x010000890000273C	Dialogue Text	SEAFORT INT / MICROGRID GENERATOR	Cuno	"We're in. We're doing this," he says over the sputter.	“我们搞定了。我们就要这样做，”他的声音盖过了噼啪声。
0x010000890000275C	Dialogue Text	SEAFORT INT / MICROGRID GENERATOR	You	"What does this mean? A generator here?"	“这是什么意思？一台发电机放在这里？”
0x0100008900002763	Dialogue Text	SEAFORT INT / MICROGRID GENERATOR	Cuno	"Fuck does Cuno know?"	“坤诺他妈的怎么知道？”
0x0100008F00003D6E	Dialogue Text	SEAFORT INT / MICROGRID GENERATOR	Conceptualization	Is it not the wisest man who knows he knows nothing?	只有最聪明的人才能认识到自己的无知，不是吗？
0x0100008F00003D74	Dialogue Text	SEAFORT INT / MICROGRID GENERATOR	Microgrid Generator	The wind outside picks up suddenly with a faint howl. Inside it's warm.	外面突然起风了，发出微弱的嚎叫。里面很温暖。
0x0100008F00003D7A	Dialogue Text	SEAFORT INT / MICROGRID GENERATOR	You	Say nothing.	什么也不说。
0x0100008F00003D83	Dialogue Text	SEAFORT INT / MICROGRID GENERATOR	You	"I meant why is it here?"	“我是说它为什么会在这里？”
0x0100008F00003D89	Dialogue Text	SEAFORT INT / MICROGRID GENERATOR	Cuno	"Probably because it's winter. Some bums who camp here don't wanna freeze to death? Maybe? Probably. Cuno's probably right..."	“大概因为是冬天吧。有些在这里扎营的流浪汉不想被冻死？也许？可能吧。坤诺也许是对的……”
0x0100008F00003D8E	Dialogue Text	SEAFORT INT / MICROGRID GENERATOR	Cuno	"Yeah, Cuno's fucking wise like that. Cuno's gonna be a real wise pig."	“是啊，坤诺就他妈这么聪明。坤诺会变成一头超级聪明的猪。”
0x0100008F00003D93	Dialogue Text	SEAFORT INT / MICROGRID GENERATOR	You	"You have taught me the meaning of wisdom, Cuno."	“坤诺，你教会了我聪明的含义。”
0x0100008F00003DAA	Dialogue Text	SEAFORT INT / MICROGRID GENERATOR	Pain Threshold	A small agony -- minuscule bones may have fractured -- but it proves the point.	有点痛——大概是一块小骨头断裂了——但是刚好就证明了这一点。
0x0100008F00003DAF	Dialogue Text	SEAFORT INT / MICROGRID GENERATOR	You	"...ouch." (Grab your wounded toe.)	“……好痛。”（抓住你受伤的脚趾头。）
0x0100008F00003DC4	Dialogue Text	SEAFORT INT / MICROGRID GENERATOR	Kim Kitsuragi	He nods approvingly. He even smiles.	他赞许地点点头，甚至露出了笑容。
0x010000060000E7E1	Dialogue Text	SEAFORT INT / READING MATERIALS	Visual Calculus	Hmm... the print in some of these is pretty small though. This person has good eyesight.	嗯……这里面有些印刷字体挺小的。这人的视力一定很好。
0x010000060000E7F1	Alternate1	SEAFORT INT / READING MATERIALS	Conceptualization	Still nothing. Just books. The reading materials of this old man out of time.	还是什么也没有，只有书。一个过时老人的读物。
0x010000060000E7F1	Dialogue Text	SEAFORT INT / READING MATERIALS	Conceptualization	Still nothing. Just books.	还是什么也没有，只有书。
0x010000060000E817	Dialogue Text	SEAFORT INT / READING MATERIALS	Conceptualization	Oh yes. Under the bed there is a rather extensive collection of *critical theory* -- that is: dour, life-non-affirming left wing literature -- published by small imprints such as Abattoir Firm and Ousia. It's not exactly light reading.	是的。床下好像有相当大量的*批判理论*藏书——换句话说：阴沉，*消极生活*的左翼文献——都是小出版商发行的，比如斗兽场公司和澳希亚出版社。其实算不上是消遣读物。
0x010000060000E820	Dialogue Text	SEAFORT INT / READING MATERIALS	You	"Look, Cuno. Powerful communist theory, rigorous and truthful."	“看啦，坤诺。强大的康米主义理论，严谨又真实。”
0x010000060000E826	Dialogue Text	SEAFORT INT / READING MATERIALS	You	"Look, Cuno. Deranged commie ranting."	“看，坤诺。康米主义者的疯狂妄语。”
0x010000060000E82C	Dialogue Text	SEAFORT INT / READING MATERIALS	You	"Look, Cuno. Downbeat dribble for people who can't get shit done."	“看啦，坤诺。对于那些屁事都做不好的人来说，就是些悲观的蠢话。”
0x010000060000E832	Dialogue Text	SEAFORT INT / READING MATERIALS	You	"Look, Cuno. A book. Left wing. I have no comments -- do you?"	“看，坤诺。一本书。左翼的。我没什么意见发表——你呢？”
0x010000060000E851	Dialogue Text	SEAFORT INT / READING MATERIALS	Kim Kitsuragi	"Ousia..." he enunciates the word diligently. "Looks like our straggler has kept some literature around -- for a quick ideological fix."	“澳希亚……”他努力念出这个词。“看来我们这位流浪汉保留了一些文献——为了快速修正意识形态的问题。
0x010000060000E857	Dialogue Text	SEAFORT INT / READING MATERIALS	Cuno	"Yeah. Yeah." He nods, sagely. "Man's hooked on the book. Gotta get his fix. Cuno's seen this shit before. Cuno's never getting hooked on that Hjelmdall shit..."	“是啊，是啊。”他睿智地点点头。“书呆子。他大概是很上瘾吧。坤诺以前见过这种狗屁玩意。坤诺从来都不迷这种赫姆达尔的垃圾……”
0x010000060000E85D	Dialogue Text	SEAFORT INT / READING MATERIALS	Reading Materials	Your incendiary remark has failed to stir a reaction in these books.	你那煽动性的言论并没有激起这些书的反应。
0x010000060000E8CE	Dialogue Text	SEAFORT INT / READING MATERIALS	Volition	As usual, he does not respond to the political agitation.	像往常一样，他对政治动乱没有反应。
0x010000060000E8D9	Dialogue Text	SEAFORT INT / READING MATERIALS	Electrochemistry	He's probably already hooked on *that Hjelmdall shit*. A kid his age.. that's the best Hjelmdall age.	他可能已经迷上*那个狗屁赫姆达尔*了。像他那个年纪的小孩，是最适合赫姆达尔的年纪。
0x010000060000E8E1	Dialogue Text	SEAFORT INT / READING MATERIALS	Rhetoric	It's hard to get a good argument on -- when your partner gets shot and you're alone.	这种时候很难好好辩论一番——特别是你的搭档中了枪，而你独身一人的时候。
0x010000060001EF47	Dialogue Text	SEAFORT INT / READING MATERIALS	Rhetoric	Interesting...	有意思……
0x010000060001EF50	Dialogue Text	SEAFORT INT / READING MATERIALS	Rhetoric	This means we have a critical theory loving vagrant here... interesting.	这就意味着这里有一个热爱批判理论的流浪汉……有意思。
0x0100004200000389	Dialogue Text	SEAFORT INT / READING MATERIALS	You	"Look, Kim. Powerful communist theory, rigorous and truthful."	“看啦，金。强大的康米主义理论，严谨又真实。”
0x010000420000038F	Dialogue Text	SEAFORT INT / READING MATERIALS	You	"Look, Kim. Deranged commie ranting."	“看，金。康米主义者的疯狂妄语。”
0x0100004200000395	Dialogue Text	SEAFORT INT / READING MATERIALS	You	"Look, Kim. Downbeat dribble for people who can't get shit done."	“看啦，金。对于那些屁事都做不好的人来说，就是些悲观的蠢话。”
0x010000420000039B	Dialogue Text	SEAFORT INT / READING MATERIALS	You	"Look, Kim. A book. Left wing. I have no comments -- do you?"	“看，金。一本书。左翼的。我没什么意见发表——你呢？”
0x01000042000003A1	Dialogue Text	SEAFORT INT / READING MATERIALS	You	Hmm... A book. Left wing. I have no comments -- does anyone else?	嗯……一本书。左翼的。我没什么意见发表——谁有吗？
0x01000042000003A7	Dialogue Text	SEAFORT INT / READING MATERIALS	You	Hmm... Deranged commie ranting.	嗯……康米主义者的疯狂妄语。
0x01000042000003AD	Dialogue Text	SEAFORT INT / READING MATERIALS	You	Hmm... Downbeat dribble for people who can't get shit done.	嗯……对于那些屁事都做不好的人来说，就是些悲观的蠢话。
