ArticyId	TermType	ConvTitle	Actor	En	Zh
0x01000042000003B3	Dialogue Text	SEAFORT INT / READING MATERIALS	You	Hmm... Powerful communist theory, rigorous and *truthy*!	嗯……强大的康米主义理论，严谨又*真实*！
0x010000450001CBA3	Dialogue Text	SEAFORT INT / READING MATERIALS	Reading Materials	Books and magazines lie scattered on the floor and on a makeshift cupboard. They are not particularly well organized.	书和杂志凌乱地躺在地板和一个临时橱柜上，并没有特别收整过。
0x010000450001CBAA	Dialogue Text	SEAFORT INT / READING MATERIALS	Encyclopedia	Popular depictions of man-versus-nature by amateur naturalists T. and T. Harpin (husband and wife). Widely read by people from all walks of life. Who doesn't like nature? Who doesn't want to *survive*?	业余博物学家T.和T.哈平（夫妻二人）对人与自然的流行描述。在各界人士中广泛流行。谁不喜欢自然呢？谁不想*生存*呢？
0x010000450001CBB1	Dialogue Text	SEAFORT INT / READING MATERIALS	Reading Materials	Among what is mostly commercial fiction and serialized stories, you find a 'Magazine Cathodique' for electrical engineering. Then it's back to pulp: light erotica, an international thriller about circuit benders...	这里几乎全都是商业小说和连载故事，不过你在其中找到了一本电气工程的‘阴极杂志’。然后是一团纸浆：光之欲念，一部关于电路创意改装的国际惊悚小说……
0x010000450001CBB8	Dialogue Text	SEAFORT INT / READING MATERIALS	You	Sift through them.	仔细查看。
0x010000450001CBBE	Dialogue Text	SEAFORT INT / READING MATERIALS	You	[Leave.]	[离开。]
0x010000450001CBC7	Dialogue Text	SEAFORT INT / READING MATERIALS	Reading Materials	Most are softcovers: serialized *fantastique* and detective stories from the Twenties and Thirties. This disparate digest includes the classic 'Animal Adventures'.	大部分都是平装书：连载*幻想小说*，还有20-30世纪的侦探小说。这些完全不同的书籍里还包含那本经典的“动物冒险”。
0x010000450001CBDB	Dialogue Text	SEAFORT INT / READING MATERIALS	You	[Leave.]	[离开。]
0x010000450001CBEE	Dialogue Text	SEAFORT INT / READING MATERIALS	Kim Kitsuragi	"Someone's made themselves a home." The lieutenant inspects a softcover.	“有人把这里当成家了。”警督随手翻看着一本平装书。
0x010000450001CBFA	Alternate1	SEAFORT INT / READING MATERIALS	Reading Materials	Soft covers, serialized *fantastique* and detective stories -- and a small collection of critical theory from obscure publishing houses. Under the bed.	平装书，连载*幻想小说*和侦探小说——还有一系列无名出版社发行的批判理论作品。就藏在床下。
0x010000450001CBFA	Dialogue Text	SEAFORT INT / READING MATERIALS	Reading Materials	Softcovers, serialized *fantastique* and detective stories, 'Animal Adventures', a magazine for electrical engineering, and an international thriller. Also: light erotica and some historical novels from the century past.	平装书，连载*幻想小说*，侦探小说，“动物冒险”，一本电气工程学杂志，还有一本国际惊悚小说。除此之外，还有：光之欲念，和一部世纪前的历史小说。
0x010000450001CC10	Dialogue Text	SEAFORT INT / READING MATERIALS	You	Does anything stand out as unusual?	有没有发现什么不寻常的东西？
0x010000450001CC10	tooltip1	SEAFORT INT / READING MATERIALS	You	All things communist.	全都是康米主义的。
0x010000450001CC10	tooltip2	SEAFORT INT / READING MATERIALS	You	Enraged by commies.	被康米主义者激怒。
0x010000450001CC10	tooltip3	SEAFORT INT / READING MATERIALS	You	Dresscode: Winter revolutionary.	着装要求：冬日革命。
0x010000450001CC1D	Dialogue Text	SEAFORT INT / READING MATERIALS	Conceptualization	Not that you can tell. This is a digest of someone who's dead bored. Most of it is for entertainment purposes, fittingly right next to the *radiola* on the floor.	你看不出来。这是某个无聊至极的人的藏书。大部分都是用来消遣的，正好适合旁边地板上那个*无线电*。
0x010000450001CC23	Dialogue Text	SEAFORT INT / READING MATERIALS	Conceptualization	Oh yes. Under the bed, there is a rather extensive collection of *critical theory* -- that is: dour, life-non-affirming left wing literature -- published by small imprints such as Abattoir Firm and Ousia. It's not exactly light reading.	是的。床下好像有相当大量的*批判理论*藏书——换句话说：阴沉，*消极生活*的左翼文献——都是小出版商发行的，比如斗兽场公司和澳希亚出版社。其实算不上是消遣读物。
0x010000450001CC31	Dialogue Text	SEAFORT INT / READING MATERIALS	You	Nothing? Nothing out of the ordinary?	什么也没有？没什么特别的吗？
0x010000450001CC37	Dialogue Text	SEAFORT INT / READING MATERIALS	You	Okay.	好吧。
0x010000450001CC3E	Dialogue Text	SEAFORT INT / READING MATERIALS	Conceptualization	Maybe it's a little old-fashioned? There's a nude mag? More than that, you can't say.	也许有点老套？比如说裸体杂志？比那个还过的话，你也说不出来了。
0x010000450001CC46	Dialogue Text	SEAFORT INT / READING MATERIALS	Conceptualization	You do feel there's something you're not *getting* here, though. Oh well.	你确实感觉到有些*不太理解*的地方。不过无所谓了。
0x010000450001CC60	Dialogue Text	SEAFORT INT / READING MATERIALS	You	"Look, Kim. Deranged commie ranting."	“看，金。康米主义者的疯狂妄语。”
0x010000450001CC66	Dialogue Text	SEAFORT INT / READING MATERIALS	Kim Kitsuragi	"Ousia..." he enunciates the word diligently. "I agree -- humanitarian sciences. It stands out. Not a lot of critical theory around in Revachol West..."	“澳希亚……”他努力念出这个词。“我同意——人道主义科学。它确实挺突出的。评判理论在瑞瓦肖西部可不常见……”
0x010000450001CC6C	Dialogue Text	SEAFORT INT / READING MATERIALS	You	"Look, Kim. Powerful communist theory, rigorous and truthful."	“看啦，金。强大的康米主义理论，严谨又真实。”
0x010000450001CC73	Dialogue Text	SEAFORT INT / READING MATERIALS	You	"Look, Kim. Downbeat dribble for people who can't get shit done."	“看啦，金。全是些只有一事无成的废物们才会看的悲观蠢话。”
0x010000450001CC79	Dialogue Text	SEAFORT INT / READING MATERIALS	You	"Look, Kim. A book. Left wing. I have no comments -- do you?"	“看，金。一本书。左翼的。我没什么意见发表——你呢？”
0x010000450001CC9E	Dialogue Text	SEAFORT INT / READING MATERIALS	You	Hmm... Powerful communist theory, rigorous and *truthy*!	嗯……强大的康米主义理论，严谨又*真实*！
0x010000450001CCA4	Dialogue Text	SEAFORT INT / READING MATERIALS	You	Hmm... Deranged commie ranting.	嗯……康米主义者的疯狂妄语。
0x010000450001CCAA	Dialogue Text	SEAFORT INT / READING MATERIALS	You	Hmm... Downbeat dribble for people who can't get shit done.	嗯……对于那些屁事都做不好的人来说，就是些悲观的蠢话。
0x010000450001CCB0	Dialogue Text	SEAFORT INT / READING MATERIALS	You	Hmm... A book. Left wing. I have no comments -- does anyone else?	嗯……一本书。左翼的。我没什么意见发表——谁有吗？
0x010000450001CCC6	Dialogue Text	SEAFORT INT / READING MATERIALS	Rhetoric	Your incendiary remark has failed to provoke him.	你那煽动性的言论并没有把他惹火。
0x010000450001CCCD	Dialogue Text	SEAFORT INT / READING MATERIALS	Kim Kitsuragi	"Ousia..." he enunciates the word diligently. "Humanitarian sciences. Stands out. Not a lot of critical theory around in Revachol West anymore..."	“澳希亚……”他努力念出这个词。“我同意——人道主义科学。它确实挺突出的。批判理论在瑞瓦肖西部可不常见……”
0x010000450001CCD6	Dialogue Text	SEAFORT INT / READING MATERIALS	Reaction Speed	Wasn't there some in the communist student's room?	那个康米主义学生的房间里不是有这些吗？
0x010000450001CCED	Dialogue Text	SEAFORT INT / READING MATERIALS	Rhetoric	It's making a *strong* comeback. After all...	它又*强力*复出了。毕竟……
0x010000450001CD0B	Dialogue Text	SEAFORT INT / READING MATERIALS	You	"Kids dig this stuff. There was plenty of it in the student's room. At the apartment building."	“小屁孩就是喜欢探究这种东西。学生的房间里有很多这种书。就在公寓大楼里。”
0x010000450001CD11	Dialogue Text	SEAFORT INT / READING MATERIALS	You	"A student in the apartment building seemed to have some as well."	“公寓大楼里有个学生好像也有这种书。”
0x010000450001CD17	Dialogue Text	SEAFORT INT / READING MATERIALS	You	Keep it to yourself.	自己保密。
0x010000450001CD1F	Dialogue Text	SEAFORT INT / READING MATERIALS	Kim Kitsuragi	"Well, yes. That one student did."	“呃，是的。确实是有个学生。”
0x010000450001CD26	Dialogue Text	SEAFORT INT / READING MATERIALS	Kim Kitsuragi	He nods. "That one student did have some, yes. It's still out of the ordinary."	他点点头。“没错，那个学生确实有。还是有点不同寻常。”
0x010000450001CD34	Dialogue Text	SEAFORT INT / READING MATERIALS	Reading Materials	The little books seem inconsequential next to the big pile of frivolous entertainment covering them.	相比盖在上面的那一大堆无聊的娱乐作品来说，这些小册子好像有些不合理。
0x010000450001CD48	Dialogue Text	SEAFORT INT / READING MATERIALS	You	"Critical theory books... What do you think this means?"	“批判理论的书……你觉得这是什么意思？”
0x010000450001CD69	Dialogue Text	SEAFORT INT / READING MATERIALS	Kim Kitsuragi	"Again, I am not a philosopher. But whoever has lived here -- they have *some* education. And a certain *set* of interests."	“再说一次，我不是哲学家。但是不管谁住在这里——肯定接受过*某种*教育。而且还有某种*特定*的兴趣爱好。”
0x010000450001CD70	Dialogue Text	SEAFORT INT / READING MATERIALS	Kim Kitsuragi	"Whoever has lived here -- they have *some* education. And a certain set of interests."	“不管谁住在这里——肯定接受过*某种*教育。而且还有某种*特定*的兴趣爱好。”
0x010000450001CD8B	Dialogue Text	SEAFORT INT / READING MATERIALS	Reading Materials	Your incendiary remark has failed to stir a reaction in these inanimate objects.	你煽动性的言论并没有激起这堆无生命物体的反应。
0x010000450001CD94	Dialogue Text	SEAFORT INT / READING MATERIALS	Reading Materials	None of these *objects* have anything to add. It's silent in the flak tower.	这些*物体*都没有什么要补充的。高射炮塔楼里鸦雀无声。
0x010000450001CD9F	Dialogue Text	SEAFORT INT / READING MATERIALS	Logic	Is this not odd? Not a lot of *critical theory* around these days...	难道不奇怪吗？最近很少见到这些*批判理论*了……
0x010000450001CDA8	Dialogue Text	SEAFORT INT / READING MATERIALS	Reaction Speed	Wasn't there some in the communist student's room?	那个康米主义学生的房间里不是有这些吗？
0x010000450001CDB7	Dialogue Text	SEAFORT INT / READING MATERIALS	Conceptualization	The little books seem inconsequential next to the big pile of frivolous entertainment covering them.	相比盖在上面的那一大堆无聊的娱乐作品来说，这些小册子好像有些不合理。
0x010000450001CDBD	Dialogue Text	SEAFORT INT / READING MATERIALS	You	Keep it to yourself.	自己保密。
0x010000450001CDDD	Dialogue Text	SEAFORT INT / READING MATERIALS	Rhetoric	A vulgar materialist reflection. Critical theory is making a *strong* comeback. After all...	一篇通俗的唯物主义反思。批判理论又*强力*复出了。毕竟……
0x010000450001CDE3	Dialogue Text	SEAFORT INT / READING MATERIALS	You	A student in the apartment building seemed to have some as well.	公寓大楼里有个学生好像也有这种书。
0x010000450001CDEE	Dialogue Text	SEAFORT INT / READING MATERIALS	You	Kids dig this stuff. There was plenty of it in the student's room. In the apartment building.	小屁孩就是喜欢探究这种东西。学生的房间里有很多这种书。就在公寓大楼里。
0x010000450001CE17	Dialogue Text	SEAFORT INT / READING MATERIALS	Conceptualization	Sure. Why not. The little books seem inconsequential next to the big pile of frivolous entertainment covering them.	当然。为什么不呢。相比盖在上面的那一大堆无聊的娱乐作品来说，这些小册子好像有些不合理。
0x0100006B000017C4	Dialogue Text	SEAFORT INT / READING MATERIALS	You	"Look, Cuno. Downbeat dribble for people who can't get shit done."	“看啦，坤诺。对于那些屁事都做不好的人来说，就是些悲观的蠢话。”
0x0100006B000017CA	Dialogue Text	SEAFORT INT / READING MATERIALS	You	"Look, Cuno. Deranged commie ranting."	“看，坤诺。康米主义者的疯狂妄语。”
0x0100006B000017D0	Dialogue Text	SEAFORT INT / READING MATERIALS	You	"Look, Cuno. Powerful communist theory, rigorous and truthful."	“看啦，坤诺。强大的康米主义理论，严谨又真实。”
0x0100006B000017D6	Dialogue Text	SEAFORT INT / READING MATERIALS	You	"Look, Cuno. A book. Left wing. I have no comments -- do you?"	“看，坤诺。一本书。左翼的。我没什么意见发表——你呢？”
0x0100006B000017E0	Dialogue Text	SEAFORT INT / READING MATERIALS	Cuno	"Yeah. Yeah." He nods, sagely.	“是啊，是啊。”他睿智地点点头。
0x0100006B000017E5	Dialogue Text	SEAFORT INT / READING MATERIALS	Cuno	"Been readin' shit here," Cuno notes, thoughtfully. "Hooked on the book."	“一直在这里看些狗屁不通的东西，”坤诺若有所思的回答到。“被书迷住了。”
0x01000089000027E1	Dialogue Text	SEAFORT INT / READING MATERIALS	You	"Critical theory books... What do you think this means?"	“批判理论的书……你觉得这是什么意思？”
0x01000089000027E8	Dialogue Text	SEAFORT INT / READING MATERIALS	Cuno	"Cuno doesn't give a shit. Cuno's not hooked on the book. Tryna get me hooked on it, teachers and shit..."	“坤诺他妈的才不在乎。坤诺他妈的不喜欢书。崔娜想让我对这个着迷,老师啊还有什么之类的狗屁……”
0x0100008900002806	Dialogue Text	SEAFORT INT / READING MATERIALS	Reaction Speed	Wasn't there some in the communist student's room?	那个康米主义学生的房间里不是有这些吗？
0x0100008900002811	Dialogue Text	SEAFORT INT / READING MATERIALS	Rhetoric	He has no idea what that means.	他不明白是什么意思。
0x0100008900002825	Dialogue Text	SEAFORT INT / READING MATERIALS	Conceptualization	The little books seem inconsequential next to the big pile of frivolous entertainment covering them.	相比盖在上面的那一大堆无聊的娱乐作品来说，这些小册子好像有些不合理。
0x0100008900002830	Dialogue Text	SEAFORT INT / READING MATERIALS	Rhetoric	Critical theory is making a *strong* comeback. After all...	一篇通俗的唯物主义反思。批判理论又*强力*复出了。毕竟……
0x0100008900002836	Dialogue Text	SEAFORT INT / READING MATERIALS	You	"A student in the apartment building seemed to have some as well."	“公寓大楼里有个学生好像也有这种书。”
0x010000890000283C	Dialogue Text	SEAFORT INT / READING MATERIALS	You	Keep it to yourself.	自己保密。
0x0100008900002846	Dialogue Text	SEAFORT INT / READING MATERIALS	You	"Kids dig this stuff. There was plenty of it in the student's room. At the apartment building."	“小屁孩就是喜欢探究这种东西。学生的房间里有很多这种书。就在公寓大楼里。”
0x010000890000284C	Dialogue Text	SEAFORT INT / READING MATERIALS	Cuno	"Mhm, yeah. Cool. Detective shit." He seems at a loss as to what to add.	“嗯，是啊，牛逼啊。狗屁警探。”他似乎不知道该补充些什么。
0x0100008900002852	Dialogue Text	SEAFORT INT / READING MATERIALS	Cuno	"Mhm, yeah. Cool. Detective shit." He seems at a loss as to what to add.	“嗯，是啊，牛逼啊。狗屁警探。”他似乎不知道该补充些什么。
0x01000003000002D5	Dialogue Text	SEAFORT INT / SPRING MATTRESS	Spring Mattress	Sleep.	睡觉。
0x01000003000002E2	Dialogue Text	SEAFORT INT / SPRING MATTRESS	Spring Mattress	Sleep.	睡觉。
0x010000060000E533	Dialogue Text	SEAFORT INT / SPRING MATTRESS	Inland Empire	Also -- what if the bad thing happens again?	还有——如果又发生什么坏事呢？
0x010000060000E5A1	Dialogue Text	SEAFORT INT / SPRING MATTRESS	Logic	Someone has been squatting here. Very recently -- the fire guy the twins mentioned?	有人非法占用了这个地方。就在最近——也许是双胞胎提到的火人？
0x010000060001EF81	Dialogue Text	SEAFORT INT / SPRING MATTRESS	Endurance	The bed is quite inviting, all things considered. It's much warmer inside than out there...	整体来看，这张床还是很诱人的。里面比外面要暖和多了……
0x010000450001C9B1	Dialogue Text	SEAFORT INT / SPRING MATTRESS	Spring Mattress	There's a greasy old spring mattress in the corner, resting on piles of softcover books. White linen and a pillow are visible under a worn-out karakul blanket.	角落里有一张油腻的旧弹簧床垫，上面堆放着一些平装书。破烂的羊皮毯下面，能看见白色的床单和一个枕头。
0x010000450001C9C8	Alternate1	SEAFORT INT / SPRING MATTRESS	You	"No time to rest now." [Leave.]	“现在没时间休息了。”[离开。]
0x010000450001C9C8	Dialogue Text	SEAFORT INT / SPRING MATTRESS	You	No time to rest now. [Leave.]	现在没时间休息了。[离开。]
0x010000450001CA32	Alternate1	SEAFORT INT / SPRING MATTRESS	You	"Maybe a little shut-eye, just an hour..." [Go to sleep.]	“也许稍微眯一小会儿，就一小时……”[睡觉。]
0x010000450001CA32	Dialogue Text	SEAFORT INT / SPRING MATTRESS	You	Maybe a little shut-eye, just for an hour... [Go to sleep.]	也许稍微眯一小会儿，就一小时……[睡觉。]
0x010000450001CA3F	Dialogue Text	SEAFORT INT / SPRING MATTRESS	Kim Kitsuragi	"Someone has been squatting here." The lieutenant inspects the bed. "The linen is fresh. Recently washed."	“有人非法占用了这个地方。”警督检查着床。“床单是新的。最近刚洗过。”
0x010000450001CA46	Dialogue Text	SEAFORT INT / SPRING MATTRESS	Logic	Someone has been squatting here. Very recently.	有人非法占用了这个地方，就是最近的事。
0x010000450001CA55	Dialogue Text	SEAFORT INT / SPRING MATTRESS	You	Inspect the linen.	检查床单。
0x010000450001CA5C	Dialogue Text	SEAFORT INT / SPRING MATTRESS	Spring Mattress	It stands out because it's freshly washed.	它很显眼，因为刚刚洗过。
0x010000450001CA6C	Dialogue Text	SEAFORT INT / SPRING MATTRESS	You	"How recently..."	“有多近……”
0x010000450001CA72	Dialogue Text	SEAFORT INT / SPRING MATTRESS	You	"Do you think whoever slept here is..."	“你觉得睡在这里的人……”
0x010000450001CA78	Dialogue Text	SEAFORT INT / SPRING MATTRESS	You	"There are signs that someone... lives..."	“有迹象显示有人……生活在……”
0x010000450001CA80	Dialogue Text	SEAFORT INT / SPRING MATTRESS	Kim Kitsuragi	"You know, officer..." He looks at you with a touch of concern. "You *can* rest here if you're feeling tired. I will keep watch. You could use some rest for what's ahead."	“你知道的，警官……”他带着一丝关心的看着你。“如果你觉得累了，*可以*在这里休息。我会看着的。前面还有很多东西等着我们，你可以先休息一下。”
0x010000450001CA86	Dialogue Text	SEAFORT INT / SPRING MATTRESS	Kim Kitsuragi	"Yes. Any time. If you need a rest *later*, it's okay by me."	“是的。随时可以。如果你*之后*想要休息，我也没有意见。”
0x010000450001CA8C	Dialogue Text	SEAFORT INT / SPRING MATTRESS	Spring Mattress	The greasy old spring mattress lies in the corner, fresh linen under the heavy karakul cover.	角落里有一张油腻的旧弹簧床垫，厚重的羊皮毯下是一床崭新的床单。
0x010000450001CAA4	Dialogue Text	SEAFORT INT / SPRING MATTRESS	Pain Threshold	A flash of pain interrupts you, making you wince instead of letting the words out.	一阵疼痛打断了你的言语，让你缩成了一团。
0x010000450001CAAF	Dialogue Text	SEAFORT INT / SPRING MATTRESS	Pain Threshold	You force the rest of the sentence out through pain, thick as molasses, no longer able to hear yourself speak.	你强忍住疼痛说出剩下的话语，但痛觉就像糖浆一样浓稠，连你也听不见自己的声音。
0x010000450001CAF6	Dialogue Text	SEAFORT INT / SPRING MATTRESS	You	Could they still be...	他们有没有可能还在这里……
0x010000450001CAFC	Dialogue Text	SEAFORT INT / SPRING MATTRESS	You	How recently...	有多近……
0x010000450001CB04	Dialogue Text	SEAFORT INT / SPRING MATTRESS	Pain Threshold	You push the rest of the thought through pain thick as molasses, without really concentrating on it.	你忍住宛如糖浆一般厚重的疼痛说出剩下的话语，但是注意力根本没有集中。
0x010000450001CB0A	Dialogue Text	SEAFORT INT / SPRING MATTRESS	Pain Threshold	A flash of pain interrupts your thought, making you grimace.	一阵疼痛打断了你的言语，让你缩成了一团。
0x010000450001CB19	Dialogue Text	SEAFORT INT / SPRING MATTRESS	Endurance	Technically speaking, you *could* rest here if you're hurting... someone else has. It should be possible.	从技术的层面来讲，如果你受伤了，*可以*在这里休息……有人就这样做过。所以应该是可行的。
0x010000450001CB20	Dialogue Text	SEAFORT INT / SPRING MATTRESS	Inland Empire	The mattress is soggy, but that linen feels more inviting than the pain and exhaustion. It's not too cold here...	床垫湿乎乎的，但是床单比疼痛和疲惫要诱人的多。而且这里也不算太冷……
0x010000450001CB36	Dialogue Text	SEAFORT INT / SPRING MATTRESS	Esprit de Corps	You don't have to be a hero.	你没必要强逞英雄。
0x010000450001CB48	Dialogue Text	SEAFORT INT / SPRING MATTRESS	Kim Kitsuragi	"The offer still stands," he says, looking out the pillbox window. "Take it -- you don't look so good."	“我的提议仍然有效，”他看向小屋窗外，开口说到。“接受吧——你看起来不是很好。”
0x010000450001CB58	Dialogue Text	SEAFORT INT / SPRING MATTRESS	Endurance	Still rather inviting, all things considered. It's much warmer inside than out there...	从整体来看，它仍然很诱人。里面要比外面要温暖多了……
0x010000450001CB76	Dialogue Text	SEAFORT INT / SPRING MATTRESS	Spring Mattress	The greasy old spring mattress lies in the corner.	角落里躺着一张油腻的旧弹簧床垫。
0x010000450001CB90	Dialogue Text	SEAFORT INT / SPRING MATTRESS	Kim Kitsuragi	"Maybe it's better to get back to the mainland? Rest there -- you've earned it."	“也许最好回到内陆？到了那里再休息吧——这是你应得的。”
0x010000450001DF70	Dialogue Text	SEAFORT INT / SPRING MATTRESS	Spring Mattress	You face the concrete wall. There's less light there, in the dark corner. Like a dog you lie there...	你面对着水泥墙。黑暗的角落里光线比较微弱。你像条狗一样地躺了下去……
0x0100006B0000179C	Dialogue Text	SEAFORT INT / SPRING MATTRESS	Cuno	"What, you wanna like... live on this fucking island now?" He crosses his arms. "Go sleep in your own bed."	“什么，你不是想……住在这个该死的破岛上吧？”他把胳膊交叉抱在胸前。“回你自己的床上睡去吧。”
0x0100006B000017A3	Dialogue Text	SEAFORT INT / SPRING MATTRESS	Cuno	"I'm gonna say it again -- Cuno doesn't feel like carrying your corpse off this island, so maybe you should fucking crash?"	“我再说一次——坤诺可不想把你的尸体从岛上运出去，所以也许你他妈的应该睡一会儿？”
0x0100006B000017AA	Dialogue Text	SEAFORT INT / SPRING MATTRESS	Cuno	"Hey... Cuno doesn't wanna *hurt your feelings*, but you look like shit. Maybe you should lie down in the bed -- like recover. Before you die."	“喂……坤诺不想*伤害你的感情*，不过你看起来跟狗屎一样。也许你应该在床上躺下——恢复一下。在你死之前。”
0x0100006B000017B0	Dialogue Text	SEAFORT INT / SPRING MATTRESS	Cuno	"Check this shit. Someone's been squatting here." The kid waves his hand at the bed. "Cuno knows because this shit looks like Cuno's place."	“看看这破玩意。有人非法占用了这里。”他朝着床挥舞双手。“坤诺知道，因为这个破烂地方跟坤诺那里很像。”
0x0100007200007959	Dialogue Text	SEAFORT INT / SPRING MATTRESS	Spring Mattress	The blanket feels cold. The entire room does -- concrete and cold. Minutes pass. Half an hour maybe? The sounds of the sea beyond grow distant. Your eyelids close. Until...	毛毯感觉有些冷。整个房间都是——硬邦邦，冰冰凉凉。几分钟过去了。也许是半小时？大海的声音越变越遥远。你合上了眼睑。直到……
0x0100007200007960	Dialogue Text	SEAFORT INT / SPRING MATTRESS	You	Curl up with your knees close to your chest.	把膝盖蜷起来，贴在胸口。
0x010000720000796D	Dialogue Text	SEAFORT INT / SPRING MATTRESS	Endurance	You didn't realize how tired you were. Your body is still nowhere near healed...	你还没意识到自己到底有多累。你的身体还远远没有治愈……
0x010000720000797D	Dialogue Text	SEAFORT INT / SPRING MATTRESS	You	Until?	直到？
