ArticyId	TermType	ConvTitle	Actor	En	Zh
0x01000078000139CC	Dialogue Text	TRIBUNAL / THEY DID NOT DO THIS!	Kortenaer	"Go ahead." He points his gun at Elizabeth. "Tell me about some cunt who killed herself one more time..."	他用手枪指着伊丽莎白。“来啊——再他妈的跟我说一次哪个婊子自杀了……”
0x01000078000139D2	Dialogue Text	TRIBUNAL / THEY DID NOT DO THIS!	Kortenaer	"You think I'm fucking *stupid*..." There's a dangerous gleam in his eye. "What if I just shot one of your pals here right now, huh?"	“你以为我他妈是*傻子*吗，警察？”他的眼睛里闪过一丝危险的光芒。“如果我现在就在这里开枪干掉你的一个伙伴怎么样，哈？”
0x010000060001E8A1	Dialogue Text	TRIBUNAL / THIRD GUY?	Volition	Easy. Easy now.	放松，放松一点。
0x010000060001E8A7	Dialogue Text	TRIBUNAL / THIRD GUY?	Half Light	Now! Now is the time! Stop waiting.	现在！就是现在！别等了！
0x0100007800011A4E	Dialogue Text	TRIBUNAL / THIRD GUY?	De Paule	"Ruud? Ruud is the killer --" The armoured woman smiles a vicious smile. "Ruud 'The Killer' Hoenkloewen -- he doesn't talk much."	“鲁德？鲁德是杀手——”穿铠甲的女人露出恶毒的笑容。“*杀手*鲁德·霍恩克洛温——他的话可不多。”
0x0100007800011A55	Dialogue Text	TRIBUNAL / THIRD GUY?	Ruud Hoenkloewen	"... all of you fucking cunts inside out..."	“……干翻你们这群狗娘养的杂种……”
0x0100007800011A5E	Dialogue Text	TRIBUNAL / THIRD GUY?	Kortenaer	"The gunner." He gestures toward himself. "The radist." He nods towards the woman. "The killer." He points to the figure clad entirely in ceramic plate.	“炮手。”他对着自己比了个手势。“种族歧视者。”他朝那个女人点点头。“杀手。”他指着一个全身上下被陶瓷板包裹的严严实实的人。
0x0100007800011A64	Dialogue Text	TRIBUNAL / THIRD GUY?	You	"The *Killer*?"	“*杀手*？”
0x0100007800011A6A	Dialogue Text	TRIBUNAL / THIRD GUY?	You	"He kills?"	“他杀人吗？”
0x0100007800011A70	Dialogue Text	TRIBUNAL / THIRD GUY?	Kortenaer	"Smart loincloth." He stares at you with his watery eyes. "He fucks natives up. Soldier of the Apocalypse-style."	“聪明的野人。”他用水汪汪的眼睛盯着你。“他把当地人搞得一团糟。末日战士的风格。”
0x0100007800011A76	Dialogue Text	TRIBUNAL / THIRD GUY?	You	"You think you're real tough, huh? This killing is meaningless."	“你觉得自己很强是吧，哈？这种杀戮毫无意义。”
0x0100007800011A80	Dialogue Text	TRIBUNAL / THIRD GUY?	De Paule	"What are we waiting for?! Let's blow that pig-fucking mouth off his face!"	“我们还在等什么？！现在就把他那张贱嘴给撕了！”
0x0100007800011A86	Dialogue Text	TRIBUNAL / THIRD GUY?	You	"Uh... tends to the stables?"	“呃……照料马厩的？”
0x0100007800011A8C	Dialogue Text	TRIBUNAL / THIRD GUY?	Kortenaer	"Hold your fire!" He licks his lips. "Wait for my command."	“先别开火！”他舔了舔嘴唇。“等我的命令。”
0x0100007800011A92	Dialogue Text	TRIBUNAL / THIRD GUY?	Perception (Sight)	He has chewed his lips bloody.	他把嘴唇咬出了血。
0x0100007800011A9A	Dialogue Text	TRIBUNAL / THIRD GUY?	Kortenaer	"Lance-corporal..." He turns to the woman. "Just fucking shut up and wait for your order."	“一等兵……”他转向那个女人。“你他妈的给我闭嘴，等我的命令。”
0x0100007800011AA0	Dialogue Text	TRIBUNAL / THIRD GUY?	You	"Good -- I *kill* killers." (Point to your chest.)	“很好——我专门*杀*杀手。”（指着自己的胸膛。)
0x0100007800011AAB	Dialogue Text	TRIBUNAL / THIRD GUY?	Authority	He is not used to commanding, or leading. He feels uncomfortable. He'd rather shoot to kill...	他不习惯下命令，或者是做领导。他感觉不太舒服。他宁愿开枪杀人……
0x0100007800011AB5	Dialogue Text	TRIBUNAL / THIRD GUY?	Composure	This man has been under severe emotional pressure recently.	这个男人最近一直承受着严重的情绪压力。
0x0100007800011AC9	Dialogue Text	TRIBUNAL / THIRD GUY?	Kortenaer	"This... talking-shit won't help you." The man shakes his head and staggers forward.	“这种……狗屁谈话帮不到你的。”男人摇了摇头，向前晃了一步。
0x0100007800011ACF	Alternate1	TRIBUNAL / THIRD GUY?	You	"Okay. Let's just keep talking -- no one needs to die today." (Back off.)	“好吧。那咱们就接着说——今天谁都不用死。”（返回。）
0x0100007800011ACF	Alternate2	TRIBUNAL / THIRD GUY?	You	"Okay. Let's just keep talking -- no one needs to die tonight." (Back off.)	“好吧。那咱们就接着说——今晚谁都不用死。”（返回。）
0x0100007800011ACF	Alternate3	TRIBUNAL / THIRD GUY?	You	"Okay. Let's just keep talking -- no one needs to die this night." (Back off.)	“好吧。那咱们就接着说——今晚谁都不用死。”（返回。）
0x0100007800011ACF	Dialogue Text	TRIBUNAL / THIRD GUY?	You	"Okay. Let's just keep talking -- no one needs to die today." (Back off.)	“好吧。那咱们就接着说——今天谁都不用死。”（退后。）
0x0100007800011ADD	Dialogue Text	TRIBUNAL / THIRD GUY?	Half Light	Now! Now is the time! Stop waiting.	现在！就是现在！别等了！
0x0100007800011AEE	Dialogue Text	TRIBUNAL / THIRD GUY?	Kortenaer	"What do you think he *does?*"	“你觉得他是*做什么*的？”
0x0100007800011B00	Dialogue Text	TRIBUNAL / THIRD GUY?	You	"I'm a killer too."	“我也是个杀手。”
0x0100007800011B07	Dialogue Text	TRIBUNAL / THIRD GUY?	Kortenaer	"You're a tit-sucking pig..." He staggers forward: "I'm gonna show you killer."	“你是他妈的一头猪……”他向前晃了一步：“我他妈让你看看什么叫杀手。”
0x0100007800011B0E	Dialogue Text	TRIBUNAL / THIRD GUY?	You	"What was that, Ruud?"	“这是做什么，鲁德？”
0x0100007800011B15	Dialogue Text	TRIBUNAL / THIRD GUY?	Ruud Hoenkloewen	"... rip you open..."	“……把你撕开……”
0x0100007800011B1C	Dialogue Text	TRIBUNAL / THIRD GUY?	Conceptualization	Perhaps it's for the best. Him not talking *too* much.	也许这样最好。他的话不会*太多*。
0x0100007800011B25	Dialogue Text	TRIBUNAL / THIRD GUY?	Kortenaer	"Huh?" He just stares at you with his watery eyes.	“哈？”他用水汪汪的眼睛死盯着你。
0x0100007800011B2C	Dialogue Text	TRIBUNAL / THIRD GUY?	Empathy	That struck some chord -- a dark chord.	这引起了某种共鸣——阴暗的共鸣。
0x0100007800011B49	Dialogue Text	TRIBUNAL / THIRD GUY?	Perception (Sight)	There -- on the rim of Hoenkloewen's helmet -- you count little stick figures: 19, 20, 21...	在那里——霍恩克洛温头盔的边缘——你数着上面画的小人：19,20,21……
0x0100007800011B5C	Dialogue Text	TRIBUNAL / THIRD GUY?	You	Count the figures.	数一下小人。
0x0100007800011B65	Dialogue Text	TRIBUNAL / THIRD GUY?	Perception (Sight)	About *fifty* little stick figures -- all of them black. Plus two little white ones in the end.	大概有*50*个小人——全都是黑色的。加上最后有两个白色的。
0x0100007800011B74	Dialogue Text	TRIBUNAL / THIRD GUY?	Encyclopedia	These men served in Semenine... the native islanders...	这些人在塞美尼服役过……岛上的居民……
0x0100007800011B7D	Alternate1	TRIBUNAL / THIRD GUY?	You	"Kills black people -- almost exclusively?"	“基本上——只杀黑人吗？”
0x0100007800011B7D	Dialogue Text	TRIBUNAL / THIRD GUY?	You	"Kills black people?"	“杀黑人？”
0x0100007800011B84	Dialogue Text	TRIBUNAL / THIRD GUY?	Kortenaer	"That's right." He stares at you with watery eyes. "Plenty of kipts here in Revachol too."	“没错。”他用水汪汪的眼睛盯着你。“还有不少瑞瓦肖的吉皮特。”
0x0100007800011B96	Dialogue Text	TRIBUNAL / THIRD GUY?	Logic	The two little *white* figures in the end are from when they moved to Revachol. They're recent.	最后那两个*白色*小人是他们搬到瑞瓦肖的时候做的，应该就是最近。
0x0100007800011BC3	Dialogue Text	TRIBUNAL / THIRD GUY?	Kortenaer	"Not today, Ruud. That'll be *me* today..." He looks at the woman on the plaza floor.	“今天不行，鲁德。今天轮到*我*了……”他看着站在广场上的女人。
0x0100007800011BCA	Dialogue Text	TRIBUNAL / THIRD GUY?	The Gardener	She has fallen silent.	她陷入沉默。
0x0100007800011BD1	Dialogue Text	TRIBUNAL / THIRD GUY?	Eugene	"T, let's fucking *do* it," the man presses through his teeth -- his hand is on his belt.	“T，赶紧他妈的*动手*吧，”男人咬紧牙关——手还放在腰带上。
0x0100007800011BE4	Dialogue Text	TRIBUNAL / THIRD GUY?	Titus Hardie	"Gene..."	“尤金……”
0x0100007800011BF4	Dialogue Text	TRIBUNAL / THIRD GUY?	De Paule	"What are we waiting for?" She turns to the leader. "Let's blow that big fucking mouth off his face!"	“我们还在等什么？”她转向头目。“赶紧把他那张臭嘴给撕烂！”
0x0100007800011C23	Dialogue Text	TRIBUNAL / THIRD GUY?	De Paule	"Oh yeah, that's Ruud." The armoured woman smiles a vicious smile. "Ruud 'The Killer' Hoenkloewen -- he doesn't talk much."	“哦，没错，那个是鲁德。”穿着盔甲的女人露出恶毒的笑容。“*杀手*鲁德·霍恩克洛温——他的话可不多。”
0x0100007800013983	Dialogue Text	TRIBUNAL / THIRD GUY?	Volition	Easy. Easy now.	放松，放松一点。
0x010000780001398B	Dialogue Text	TRIBUNAL / THIRD GUY?	Volition	Easy. Easy now.	放松，放松一点。
0x0100007800013991	Dialogue Text	TRIBUNAL / THIRD GUY?	Half Light	Now! Now is the time! Stop waiting.	现在！就是现在！别等了！
0x010000060001E90F	Dialogue Text	TRIBUNAL / WHERE IS KLAASJE?	Rhetoric	For god's sake, tell 'em the Hardies didn't *do* it, present a case!	老天爷啊，告诉他们不是哈迪兄弟*做的*，拿出证据来！
0x01000078000123C6	Dialogue Text	TRIBUNAL / WHERE IS KLAASJE?	Kim Kitsuragi	"Klaasje -- the woman upstairs? Where is she?"	“卡拉洁——楼上那个女人？她在哪？”
0x01000078000123DA	Dialogue Text	TRIBUNAL / WHERE IS KLAASJE?	Garte, the Cafeteria Manager	"She left!" The manager calls down from the balcony.	“她走了！”经理站在阳台上朝下喊。
0x01000078000123E1	Dialogue Text	TRIBUNAL / WHERE IS KLAASJE?	Composure	Unarmed, hunched, but keeping it together.	赤手空拳，弯腰驼背，但是十分镇静。
0x01000078000123EE	Dialogue Text	TRIBUNAL / WHERE IS KLAASJE?	You	"What do you mean she *left*?"	“你说*她走了*是什么意思？”
0x01000078000123F4	Dialogue Text	TRIBUNAL / WHERE IS KLAASJE?	You	"Garte, what the hell are you *doing* here?"	“加尔特，你他妈在这里*搞什么鬼*？”
0x0100007800012401	Dialogue Text	TRIBUNAL / WHERE IS KLAASJE?	Garte, the Cafeteria Manager	"She LEFT! Her room's cleaned out -- right before these assholes showed up!"	“她走了！她的房间都清理干净了——就在这些混账出现之前！”
0x0100007800012409	Dialogue Text	TRIBUNAL / WHERE IS KLAASJE?	Garte, the Cafeteria Manager	"What am I doing?! My fucking establishment is UNDER FIRE!" He points to the armoured figures. "You know how much windows *cost?*"	“我在做什么？我的地方他妈的被袭击了！”他指向那群穿盔甲的人。“你知道这些窗户*值多少钱*吗？”
0x010000780001241F	Dialogue Text	TRIBUNAL / WHERE IS KLAASJE?	Kortenaer	"HEY, BUSHMEN!!!" The veins on the man's neck expand as he yells. "Your little CUNT isn't gonna help you out of this one!"	“喂，布希曼人！！！”男人大声喊叫，脖子上的青筋也随之爆出。“那个小婊子是不会帮你摆脱困境的！”
0x0100007800012432	Dialogue Text	TRIBUNAL / WHERE IS KLAASJE?	Kim Kitsuragi	"We should have arrested her..." The lieutenant whispers, his eyes still on the armed mercenaries.	“我们应该逮捕她的……”警督低语到，他的双眼没有离开那些武装雇佣兵。
0x0100007800012438	Dialogue Text	TRIBUNAL / WHERE IS KLAASJE?	Empathy	You can *feel* how upset he is with himself. Just for a second. Then the fear takes over and he's back in the moment.	你能*感觉*到他到底有多不安。只持续了一会儿。接着，恐惧占据了上风，他又回到了这一刻。
0x0100007800012464	Dialogue Text	TRIBUNAL / WHERE IS KLAASJE?	Volition	She's gone. Forget about it now. Concentrate on this.	她走了。现在忘了它吧。集中对付眼下的情况。
0x0100007800012491	Dialogue Text	TRIBUNAL / WHERE IS KLAASJE?	Kortenaer	"Who the fuck is that?"	“那他妈的又是谁？”
0x0100004500018AF8	Dialogue Text	TRIBUNAL / YOU ARE DRUNK!	Kortenaer	"Yes... So what?"	“是的……所以呢？”
0x010000780001223D	Dialogue Text	TRIBUNAL / YOU ARE DRUNK!	You	"Nothing. It's okay."	“没什么。挺好的。”
0x0100007800012243	Dialogue Text	TRIBUNAL / YOU ARE DRUNK!	You	"I'm drunk too. Let's dance, baby."	“我也喝多了。来跳舞吧，宝贝。”
0x0100007800012249	Dialogue Text	TRIBUNAL / YOU ARE DRUNK!	You	"Your judgement is impaired. You'll regret this."	“你的判断是错误的。你会后悔的。”
0x010000780001224F	Dialogue Text	TRIBUNAL / YOU ARE DRUNK!	You	"Al Gul is a trick the desert pygmees played on us. Do not *succumb* to it!"	“酒精是沙漠侏儒欺骗我们的诡计。千万不要向它*屈服*。”
0x0100007800012264	Dialogue Text	TRIBUNAL / YOU ARE DRUNK!	You	I don't need a drink right now for god's sake. Look at this! I'm in a fight!	老天啊，我现在不想喝酒。看看这个！我正在战斗中呢！
0x010000780001226A	Dialogue Text	TRIBUNAL / YOU ARE DRUNK!	Electrochemistry	Exactly. This is *so* horrible! People are gonna die whatever you do -- it will be all your fault. Only a drink will soothe this. Keep thinking about the drink!	没错。这真是*太可怕*了！不论你做什么，人们都会死——这全都是你的错。只有酒精能带来一些安慰。接着想喝酒的事吧！
0x0100007800012270	Dialogue Text	TRIBUNAL / YOU ARE DRUNK!	Electrochemistry	Yeah. So what. You should be drunk too. Or, like, *drunker*. You don't want to die sober do you?	是的。所以呢？你也应该喝醉。或者，比如说，应该喝的*更醉*。你应该不想清醒的死去吧？
0x0100007800012276	Dialogue Text	TRIBUNAL / YOU ARE DRUNK!	You	I don't need a drink right now, for god's sake, the gardener just got shot!	老天啊，我现在不需要喝酒，园丁刚中枪了！
0x0100007800012282	Dialogue Text	TRIBUNAL / YOU ARE DRUNK!	Electrochemistry	Fucking horrible... A girl got shot?! Because of you?! Only warm alcohol will help soothe the guilt!	卧槽，好可怕……一个姑娘中枪了？！因为你吗？！只有温热的美酒能帮你抚平这种罪恶感了！
0x0100007800012288	Dialogue Text	TRIBUNAL / YOU ARE DRUNK!	Volition	Shut up! Let him think, too much is on the line, he's *not* gonna fuck it up because of you. I won't let you.	闭嘴！让他想想，现在情况太危险，他是*不会*因为你搞砸的。我不会让你这么做。
0x010000780001229F	Dialogue Text	TRIBUNAL / YOU ARE DRUNK!	Electrochemistry	Yeah. So what? You should be drunk too. It's insane how long it's been since your last drink. Get one in you RIGHT NOW.	是的。所以呢？你也应该喝醉。想想你上次喝酒已经过去多久了，真是太疯狂了吧。赶紧给自己来上一杯。
0x01000078000122BA	Dialogue Text	TRIBUNAL / YOU ARE DRUNK!	Kortenaer	"Nah..." He wipes the sweat from his brow. "I'm clear as day. Fucking government ordained super-soldier..."	“不……”他擦掉眉头上的汗水。“我清楚的不得了。混账政府任命的超级士兵……”
0x01000078000122C5	Dialogue Text	TRIBUNAL / YOU ARE DRUNK!	Kortenaer	"Interrupt me again and I will execute you on the spot, lance-corporal." The outburst is accompanied by yellowish saliva around his mouth.	“再打断我一次，我就当场处决你，一等兵。”他的情绪随着嘴唇周围的淡黄色唾液一起迸发了。
0x01000078000122CB	Dialogue Text	TRIBUNAL / YOU ARE DRUNK!	De Paule	"Enough already! What is this?!" The woman's voice is furious. "We didn't come here to fucking chat!"	“够了！这是干什么？！”女人的声音十分恼怒。“我们来这儿可不是他妈的为了闲聊的！”
0x01000078000122D3	Dialogue Text	TRIBUNAL / YOU ARE DRUNK!	Kortenaer	"Stupid shit..." He wipes the sweat from his brow. "I know what you're doing, you *fuck*. It's not gonna work. I'm clear as day."	“脑子进屎的蠢货……”他擦掉眉头上的汗水。“我知道你在做什么，你这个*杂种*。没用的，我很清楚。”
0x01000078000122DA	Dialogue Text	TRIBUNAL / YOU ARE DRUNK!	Composure	He must be tweaked off too. With something other than alcohol. They always are...	他肯定是嗑嗨了，酒之外的其它东西。他们总是这样……
0x01000078000122E6	Dialogue Text	TRIBUNAL / YOU ARE DRUNK!	Suggestion	Now! You got them both off-piste! He's foaming mad at her...	就是现在！你让他们都分心了！他快被她气炸了……
0x01000078000122EF	Dialogue Text	TRIBUNAL / YOU ARE DRUNK!	Kortenaer	"All right." He wipes the sweat from his brow. "Let's do this. Smear your shit all over this fucking dung field..."	“好吧。”他擦掉眉头上的汗水。“就这么做吧。把你的屎涂遍整个该死的粪坑……”
0x01000078000122F6	Dialogue Text	TRIBUNAL / YOU ARE DRUNK!	Authority	That didn't work at all, he's *more* focused now.	这样没用，他*更*专注了。
0x01000078000122FE	Dialogue Text	TRIBUNAL / YOU ARE DRUNK!	Kortenaer	"Didn't sound like nothing." He wipes the sweat from his brow. "Sounded like you were about to break into a sermon. Was that it?"	“听起来什么也不是。”他擦掉眉头上的汗水。“更像是你要开始布道了。是这样吗？”
