ArticyId	TermType	ConvTitle	Actor	En	Zh
0x0100004500019F54	Dialogue Text	WHIRLING F2 / KIM WAKEUP	Kim Kitsuragi	"Because we *deterred* them? Or Joyce did? Maybe the harbour -- in full lockdown -- is too costly a target. Or maybe..." he breathes in the fumes, thinking.	“因为我们*阻止*了他们？或者是乔伊斯阻止的？也许将港口——现在已经全面封闭——作为目标的代价太大了。或者，也许……”他吸了一口烟，若有所思。
0x0100004500019F5B	Dialogue Text	WHIRLING F2 / KIM WAKEUP	Kim Kitsuragi	"Maybe they are simply taking their time and will attack soon? I don't know."	“也许他们只是打算慢慢来，不久后就会发动袭击？我不知道。”
0x0100004500019F66	Dialogue Text	WHIRLING F2 / KIM WAKEUP	Kim Kitsuragi	"Four: Glen, Theo, Angus, the fat one, he... took a lot of bullets." There's a pause.	“四个：格伦，特奥，安格斯，那个胖子，他……中了很多枪。”他停顿了一下。
0x0100004500019F6C	Dialogue Text	WHIRLING F2 / KIM WAKEUP	Kim Kitsuragi	"And Elizabeth too -- Elizabeth Beaufort was her name. The gardener."	“还有伊丽莎白——她的名字叫伊丽莎白·博福特，那个园丁。”
0x0100004500019F72	Dialogue Text	WHIRLING F2 / KIM WAKEUP	You	"She did not make it?"	“她没挺过来？”
0x0100004500019F79	Dialogue Text	WHIRLING F2 / KIM WAKEUP	Kim Kitsuragi	"No. She bled out before Evrart's surgeon could help her. Evrart sent his personal doctor but..." He shakes his head. "A costly loss for the Union. She was being trained for leadership."	“没有。她失血过多，艾弗拉特的医生没能帮上她。艾弗拉特把私人医生都派出来了，不过……”他摇摇头。“工会付出了昂贵的代价。她本来是被训练成接班人。”
0x0100004500019F87	Dialogue Text	WHIRLING F2 / KIM WAKEUP	Kim Kitsuragi	"All." He nods.	“就这些。”他点点头。
0x0100004500019F8E	Dialogue Text	WHIRLING F2 / KIM WAKEUP	You	"An absolute disaster."	“一场绝对的灾难。”
0x0100004500019F94	Dialogue Text	WHIRLING F2 / KIM WAKEUP	You	"It's a total shit show, Kim."	“这是一场彻头彻尾的灾难，金。”
0x0100004500019F9C	Dialogue Text	WHIRLING F2 / KIM WAKEUP	You	"Not *that* bad -- all things considered."	“也没*那么*糟糕——如果从整体来看的话。”
0x0100004500019FA2	Dialogue Text	WHIRLING F2 / KIM WAKEUP	You	"I don't see how it could have gone any better."	“我看不出还有更好的可能。”
0x0100004500019FAB	Alternate1	WHIRLING F2 / KIM WAKEUP	Kim Kitsuragi	"Let's face it, officer -- and this is both of our fault..." he says calmly -- without accusation. "It could have gone *a little* better. Seven people are dead."	“面对现实吧，警官——这都是我们的错……”他的声音很平静——没有谴责的意味。“本来情况可以*稍微*好一点。一共死了7个人。”
0x0100004500019FAB	Dialogue Text	WHIRLING F2 / KIM WAKEUP	Kim Kitsuragi	"Let's face it, officer -- and this is both of our fault..." he says calmly -- without accusation. "It could have gone *a little* better. Six people are dead."	“面对现实吧，警官——这都是我们的错……”他的声音很平静——没有谴责的意味。“本来情况可以*稍微*好一点。一共死了7个人。”
0x0100004500019FB7	Alternate1	WHIRLING F2 / KIM WAKEUP	Kim Kitsuragi	"But what's done is done. The violence is cordoned off, the hornets did not get into the beehive." He rubs his swollen chin. "The worst scenario has not materialized -- yet."	“但是过去的事都过去了。暴动被封锁隔离，大黄蜂没有归巢。”他揉了揉肿胀的下巴。“最糟糕的情节没有上演——暂时没有。”
0x0100004500019FB7	Dialogue Text	WHIRLING F2 / KIM WAKEUP	Kim Kitsuragi	"But what's done is done. The violence is cordoned off, the mercenary tribunal is neutralized. The worst scenario has not materialized -- yet."	“但过去的事都过去了。暴动被封锁隔离，雇佣兵宣判撤销了。最糟糕的情节没有上演——暂时没有。”
0x0100004500019FC1	Alternate1	WHIRLING F2 / KIM WAKEUP	Kim Kitsuragi	"Oh no, officer," he says calmly -- without accusation. "It's pretty bad. Seven people are dead."	“不，哈里，”他的声音很平静——没有谴责的意味。“真的挺糟糕的。一共死了6个人。”
0x0100004500019FC1	Alternate2	WHIRLING F2 / KIM WAKEUP	Kim Kitsuragi	"Oh no, Harry," he says calmly -- without accusation. "It's pretty bad. Seven people are dead."	“不，哈里，”他的声音很平静——没有谴责的意味。“真的挺糟糕的。一共死了6个人。”
0x0100004500019FC1	Dialogue Text	WHIRLING F2 / KIM WAKEUP	Kim Kitsuragi	"Oh no, officer," he says calmly -- without accusation. "It's pretty bad. Six people are dead."	“不，警官，”他的声音很平静——没有谴责的意味。“真的挺糟糕的。一共死了7个人。”
0x0100004500019FC8	Alternate1	WHIRLING F2 / KIM WAKEUP	Kim Kitsuragi	"Yes, officer," he says calmly. "Seven people are dead. It's not a success."	“是的，警官，”他的声音很平静。“死了6个人。算不上是成功。”
0x0100004500019FC8	Dialogue Text	WHIRLING F2 / KIM WAKEUP	Kim Kitsuragi	"Yes, officer," he says calmly. "Six people are dead. It's not a success."	“是的，警官，”他的声音很平静。“死了7个人。算不上是成功。”
0x0100004500019FF7	Dialogue Text	WHIRLING F2 / KIM WAKEUP	Rhetoric	He did not expect you both to survive once you stepped between those two armies.	在你们选择介入两队纷争的时候，他就没指望你们两个都能幸存。
0x0100004500019FFD	Dialogue Text	WHIRLING F2 / KIM WAKEUP	Endurance	His smoking, his hunched back... you have it worse, but he took a real beating. That cigarette has *medicinal* purposes.	他的香烟，佝偻的后背……你的情况更糟糕，但他也受了不少罪。那些香烟有*医疗*作用。
0x010000450001A018	Dialogue Text	WHIRLING F2 / KIM WAKEUP	You	"Eugene?"	“尤金？”
0x010000450001A01E	Dialogue Text	WHIRLING F2 / KIM WAKEUP	Kim Kitsuragi	"Yes. He's still alive too."	“是的。他也活着。”
0x010000450001A02D	Dialogue Text	WHIRLING F2 / KIM WAKEUP	You	"So you also killed."	“所以你也杀人了。”
0x010000450001A034	Dialogue Text	WHIRLING F2 / KIM WAKEUP	Kim Kitsuragi	He nods.	他点点头。
0x010000450001A03F	Dialogue Text	WHIRLING F2 / KIM WAKEUP	Kim Kitsuragi	"As retaliation, their rifleman tried shooting you. He hit the cuirass... I heard it go off. I was looking for a clear line of sight to him."	“作为报复，他们的步枪手想朝你开枪。他打中了你的胸甲……我听到响声了。当时我正在寻找能看见他，视线清晰的地方。”
0x010000450001A052	Dialogue Text	WHIRLING F2 / KIM WAKEUP	Kim Kitsuragi	"As retaliation, their rifleman shot you. He hit. With his carabine -- I was looking for a clear line of sight. When I found it..."	“作为报复，他们的步枪手朝你开了一枪。他打中了——用他的卡宾枪。当时我正在寻找能看见他，视线清晰的地方。当我发现的时候……”
0x010000450001A058	Dialogue Text	WHIRLING F2 / KIM WAKEUP	Hand/Eye Coordination	He sounds a *tiny bit* sorry he did not find it before you got hit.	他听起来*有些*抱歉，自己没能抢在你中枪之前发现。
0x010000450001A065	Alternate1	WHIRLING F2 / KIM WAKEUP	Kim Kitsuragi	"What happened? You shot the colonel -- unsuccessfully. Then you threw your gun at him. A firefight ensued."	“发生什么事了？你朝上校开枪——不过失败了。然后你把枪朝他扔了过去。接着双方开始交火。”
0x010000450001A065	Dialogue Text	WHIRLING F2 / KIM WAKEUP	Kim Kitsuragi	"What happened? You shot the major. Unsuccessfully. A firefight ensued."	“发生什么事了？你朝少校开枪。失败了。然后双方开始交火。”
0x010000450001A0C0	Dialogue Text	WHIRLING F2 / KIM WAKEUP	Kim Kitsuragi	"What happened? You threw an improvised petroleum bomb at the major. A firefight ensued."	“发生什么事了？你朝少校扔了一个临时做的烈酒炸弹。然后双方开始交火。”
0x010000450001A0C9	Dialogue Text	WHIRLING F2 / KIM WAKEUP	Kim Kitsuragi	"You tried to throw an improvised petroleum bomb. It missed. Then you said *it's a fiasco, bratan* in a funny voice. A firefight ensued."	“你朝少校扔了一个临时做的烈酒炸弹。没打中。接着你用一种很滑稽的声音说了句：*真是大失败啊，兄弟*。然后双方开始交火。”
0x010000450001A0D5	Dialogue Text	WHIRLING F2 / KIM WAKEUP	You	"The tie made me do it."	“是领带让我这么做的。”
0x010000450001A0DD	Dialogue Text	WHIRLING F2 / KIM WAKEUP	Kim Kitsuragi	He does not answer, and searches for something in his coat pocket instead.	他没有回应，而是在上衣口袋里翻找着什么。
0x010000450001A0FD	Dialogue Text	WHIRLING F2 / KIM WAKEUP	Kim Kitsuragi	"What happened? We tried to take the diplomatic route and hoped they wouldn't attack first. They did. The major gave the command."	“发生什么事了？我们想试着走外交路线，希望他们不会先动手。不过他们还是这么做了。是少校下的命令。”
0x010000450001A11D	Dialogue Text	WHIRLING F2 / KIM WAKEUP	You	"Titus is dead?"	“提图斯死了？”
0x010000450001A12C	Dialogue Text	WHIRLING F2 / KIM WAKEUP	Kim Kitsuragi	"Yes."	“是的。”
0x010000450001A142	Alternate1	WHIRLING F2 / KIM WAKEUP	Kim Kitsuragi	"You were bleeding out. I think you said something about your wife... And you *warned* me. I was able to disarm the major before he got the jump on me."	“你血流不止。我想你说了些关于你妻子的话……而且你*警告*了我。我抢在科顿艾尔之前解除了他的武装。”
0x010000450001A142	Alternate2	WHIRLING F2 / KIM WAKEUP	Kim Kitsuragi	"You were bleeding out. I think you said no one wants to party with you. And you *warned* me. I was able to disarm the major before he got the jump on me."	“你血流不止。我想你说什么没人想跟你一起派对。而且你*警告*了我。我抢在少校之前解除了他的武装。”
0x010000450001A142	Alternate3	WHIRLING F2 / KIM WAKEUP	Kim Kitsuragi	"You were bleeding out. I think you said you lied about being an amnesiac. And you *warned* me. I was able to disarm the major before he got the jump on me."	“你血流不止。我想你说什么自己失忆是假装的。而且你*警告*了我。我抢在少校之前解除了他的武装。”
0x010000450001A142	Dialogue Text	WHIRLING F2 / KIM WAKEUP	Kim Kitsuragi	"You were bleeding out by then..." He thinks. "You warned me -- I was able to disarm Kortenaer before he got the jump on me."	“那时候你血流不止……”他想了想。“你警告了我——我抢在科顿艾尔之前解除了他的武装。”
0x010000450001A15B	Dialogue Text	WHIRLING F2 / KIM WAKEUP	You	"And the major..."	“那个少校……”
0x010000450001A162	Dialogue Text	WHIRLING F2 / KIM WAKEUP	Kim Kitsuragi	"... is in a private hospital across the river. Krenel claimed him from the local butcher shop, where Titus died. Turns out he's *insured*."	“……在河对岸的一家私人医院里。科奈尔在当地的肉铺里找到了他，提图斯死在了那里。结果他做了*保险措施*。”
0x010000450001A16A	Dialogue Text	WHIRLING F2 / KIM WAKEUP	Kim Kitsuragi	"We won't get to him anymore. The good news is -- he's not coming here either. I did some damage."	“我们再也找不到他了。好消息是——他也不会再回到这里。我还是造成了一点伤害的。”
0x010000450001A171	Dialogue Text	WHIRLING F2 / KIM WAKEUP	Half Light	There is unveiled anger in his voice.	他的声音里充满着赤裸裸的愤怒。
0x010000450001A184	Dialogue Text	WHIRLING F2 / KIM WAKEUP	Kim Kitsuragi	"Four: Glen, Theo, Angus. The fat one, he... took a lot of bullets." There's a pause. "And Titus."	“四个：格伦，特奥，安格斯，那个胖子，他……中了很多枪。”他停顿了一下。“还有提图斯。”
0x010000450001A19F	Dialogue Text	WHIRLING F2 / KIM WAKEUP	Kim Kitsuragi	"Five: Glen, Theo, Angus. The fat one, he... took a lot of bullets." There's a pause. "And Titus."	“五个：格伦，特奥，安格斯，那个胖子，他……中了很多枪。”他停顿了一下。“还有提图斯。”
0x010000450001A1A7	Dialogue Text	WHIRLING F2 / KIM WAKEUP	Kim Kitsuragi	"Three: Glen, Theo, Angus. The fat one, he... took a lot of bullets." There's a pause. "And Theo -- he was just too old for combat."	“三个：格伦，特奥，安格斯。那个胖子，他……中了很多枪。”他停顿了一下。“还有特奥——他太老了，不适合上战场。”
0x010000450001A1BA	Dialogue Text	WHIRLING F2 / KIM WAKEUP	Kim Kitsuragi	"And..." he smiles: "We are still alive -- both of us."	“而且……”他笑了：“我们还活着——两个人都活下来了。”
0x010000450001A22D	Dialogue Text	WHIRLING F2 / KIM WAKEUP	Kim Kitsuragi	"Let's face it, officer," he says calmly -- without accusation. "It could have gone a little better. You could've *not* missed."	“面对现实吧，警官，”他的声音很平静——没有谴责的意味。“本来情况可以稍微好一点。你本来*不该*失手的。”
0x010000450001A239	Dialogue Text	WHIRLING F2 / KIM WAKEUP	Kim Kitsuragi	"Let's face it, officer..." he says calmly -- without accusation. "It could have gone a little better. You could've *not* missed with the bomb. If you already threw it."	“面对现实吧，警官，”他的声音很平静——没有谴责的意味。“本来情况可以稍微好一点。有了那个炸弹，你本来*不该*失手的。毕竟你都扔出去了。”
0x010000450001A245	Alternate1	WHIRLING F2 / KIM WAKEUP	Kim Kitsuragi	"Let's face it, officer..." he says calmly -- without accusation. "It could have gone a little better. You could have been *armed*. It was my mistake too, I should have attacked..."	“面对现实吧，警官，”他的声音很平静——没有谴责的意味。“本来情况可以稍微好一点。你本来可以带上*武器*的。这也是我的错，我应该动手的……”
0x010000450001A245	Dialogue Text	WHIRLING F2 / KIM WAKEUP	Kim Kitsuragi	"Let's face it, officer..." he says calmly -- without accusation. "It could have gone a little better. The diplomatic approach was terrible. It was my mistake. I should have attacked..."	“面对现实吧，警官……”他的声音很平静——没有谴责的意味。“本来情况可以更好一些。外交手段太可怕了。这是我的错。我应该动手的……”
0x010000450001A250	Dialogue Text	WHIRLING F2 / KIM WAKEUP	Half Light	He was afraid.	他很害怕。
0x010000450001A263	Dialogue Text	WHIRLING F2 / KIM WAKEUP	You	"What happens now, Kim?"	“现在会怎么样，金？”
0x010000450001A277	Dialogue Text	WHIRLING F2 / KIM WAKEUP	Kim Kitsuragi	"Reasonably bad. You were shot in the left quadriceps -- that's your thigh. It appears no major arteries were nicked. The bullet was removed and a bacterial infection treated with mercurochrome."	“相当糟糕。你左侧的四头肌中枪了——就是你的大腿。看来主动脉都没有被割伤。子弹已经取出来了，还用红药水治疗了细菌感染。”
0x010000450001A283	Dialogue Text	WHIRLING F2 / KIM WAKEUP	You	"Can I... walk?"	“我还……能走吗？”
0x010000450001A289	Dialogue Text	WHIRLING F2 / KIM WAKEUP	Kim Kitsuragi	"We will see."	“等以后看吧。”
0x010000450001A297	Dialogue Text	WHIRLING F2 / KIM WAKEUP	Endurance	With considerable pain and the stitches tearing every now and then -- you should be able to do it.	伴随着相当大的疼痛，还有时不时撕裂的缝线——你应该能做到。
0x010000450001A29C	Dialogue Text	WHIRLING F2 / KIM WAKEUP	Endurance	Through tears and blood and stitches tearing it *should* be possible.	通过血和泪，还有那撕裂的缝线，*应该*是可能做到的。
0x010000450001A2AE	Dialogue Text	WHIRLING F2 / KIM WAKEUP	Volition	If it's possible, then by pure willpower alone. You are going to have to become... a psycholocomotor.	如果可能的话，那就只能是依靠纯粹的意志力。你会变成……一个心灵电动马达。
0x010000450001A2C1	Dialogue Text	WHIRLING F2 / KIM WAKEUP	Kim Kitsuragi	"The bruising in your shoulder is negligible. The armour took the brunt of the fire."	他指着你的肩膀：“你肩膀上的擦伤可以忽略不计。装甲承受了火力的冲击。”
0x010000450001A2DF	Dialogue Text	WHIRLING F2 / KIM WAKEUP	Kim Kitsuragi	"Pretty bad, officer. You've suffered two wounds. The first is below your shoulder. The bullet passed through your shoulder blade, luckily missing your lung -- and heart."	“挺糟糕的，警官。你有两处伤口。第一个在肩膀下面。子弹穿过你的肩胛骨，幸运的是没有打中你的肺部——还有心脏。”
0x010000450001A2E5	Dialogue Text	WHIRLING F2 / KIM WAKEUP	Kim Kitsuragi	"The second shot hit you in the thigh -- the left quadriceps." He points to your leg. "No major arteries were nicked, but the bullet had to be removed. A bacterial infection was treated with mercurochrome."	“另一处在你的大腿——左边的四头肌。”他指着你的腿说。“主动脉没有被擦伤，子弹已经取出来了。还用红药水治疗了细菌感染。”
0x010000450001A2EE	Dialogue Text	WHIRLING F2 / KIM WAKEUP	Kim Kitsuragi	"Reasonably bad. You were shot in the left quadriceps -- that's your thigh. The outer side thankfully, no major arteries were nicked. The bullet was removed and a bacterial infection treated with mercurochrome."	“相当糟糕。你左侧的四头肌中枪了——就是你的大腿。幸运的是，外侧主动脉没有被擦伤。子弹已经取出来了。还用红药水治疗了细菌感染。”
0x010000450001A308	Dialogue Text	WHIRLING F2 / KIM WAKEUP	Savoir Faire	You won't be able to dance much, that's for sure. You should be able to live with limping around though.	可以肯定的是，你应该没什么办法跳舞了。不过一瘸一拐走路还是可以的。
0x010000450001A314	Dialogue Text	WHIRLING F2 / KIM WAKEUP	You	"I'm a psycholocomotor."	“我是个心灵电动马达。”
0x010000450001A31A	Dialogue Text	WHIRLING F2 / KIM WAKEUP	Kim Kitsuragi	"Good. You'll need to be... whatever that is."	“很好。你是的……不管那到底是什么东西。”
0x010000450001A326	Dialogue Text	WHIRLING F2 / KIM WAKEUP	You	"Has anyone from my station been to see me?"	“我的警局有人来看过我吗？”
0x010000450001A32C	Dialogue Text	WHIRLING F2 / KIM WAKEUP	Kim Kitsuragi	"No."	“没有。”
0x010000450001A333	Dialogue Text	WHIRLING F2 / KIM WAKEUP	You	"If not my station, then who treated me?"	“如果不是我的警局，那是谁帮我治的？”
0x010000450001A339	Dialogue Text	WHIRLING F2 / KIM WAKEUP	Kim Kitsuragi	"I did."	“我。”
0x010000450001A33F	Dialogue Text	WHIRLING F2 / KIM WAKEUP	You	"Thank you."	“谢谢。”
0x010000450001A345	Dialogue Text	WHIRLING F2 / KIM WAKEUP	You	"I didn't know you could... do that."	“我不知道你还……会这个。”
0x010000450001A34C	Dialogue Text	WHIRLING F2 / KIM WAKEUP	Kim Kitsuragi	"No need."	“不用。”
0x010000450001A353	Dialogue Text	WHIRLING F2 / KIM WAKEUP	Kim Kitsuragi	"It's part of a detective's task chain. You can do it too."	“这是警探任务链的一环。你也可以做到。”
0x010000450001A35A	Dialogue Text	WHIRLING F2 / KIM WAKEUP	You	"They don't care about me at all."	“他们一点都不关心我。”
0x010000450001A360	Dialogue Text	WHIRLING F2 / KIM WAKEUP	You	"Good. I don't need them."	“很好。我也不需要他们。”
0x010000450001A366	Dialogue Text	WHIRLING F2 / KIM WAKEUP	You	"Really?"	“真的吗？”
0x010000450001A36D	Dialogue Text	WHIRLING F2 / KIM WAKEUP	You	"Are you hurt?"	“你受伤了吗？”
0x010000450001A376	Dialogue Text	WHIRLING F2 / KIM WAKEUP	You	"Isn't that... strange?"	“难道不觉得……有些奇怪吗？”
0x010000450001A37D	Dialogue Text	WHIRLING F2 / KIM WAKEUP	Kim Kitsuragi	"I called your station after the fight. The injury was logged in. They told me they've sent officers to join you on the site."	“交火结束之后，我给你的警局去了电话。受伤情况已经登记过了。他们告诉我会派警官去现场跟你会合。”
0x010000450001A387	Dialogue Text	WHIRLING F2 / KIM WAKEUP	You	"Odd. You haven't seen any, have you?"	“奇怪。你没看见他们，不是吗？”
0x010000450001A38E	Dialogue Text	WHIRLING F2 / KIM WAKEUP	Kim Kitsuragi	There's a pause. "I'm sure they're worried about you."	他停顿了一下。“我确定他们是担心你的。”
0x010000450001A39B	Dialogue Text	WHIRLING F2 / KIM WAKEUP	You	"Okay."	“好吧。”
0x010000450001A3A1	Dialogue Text	WHIRLING F2 / KIM WAKEUP	Kim Kitsuragi	"I'm sure they're worried about you."	“我确定他们是担心你的。”
0x010000450001A3A7	Dialogue Text	WHIRLING F2 / KIM WAKEUP	Rhetoric	No. They would be here if they were truly worried.	不对。如果他们真的担心，现在就应该在这里。
0x010000450001A3AF	Dialogue Text	WHIRLING F2 / KIM WAKEUP	Rhetoric	That means he hasn't seen them around while you were out. They're not *really* worried about you. If they were, wouldn't they be here?	这就意味着在你昏迷的时候他没有在附近看到他们。他们并不是*真正*担心你。要是真担心，他们不应该在吗？
0x010000450001A3BD	Dialogue Text	WHIRLING F2 / KIM WAKEUP	Kim Kitsuragi	"Not very." He rubs his chin. "I have a concussion from that woman beating me with the butt of her gun... I try to not move too much."	“不算吧。”他揉揉下巴。“我被那女人的枪托砸了一下，有点脑震荡……我尽量不多动。”
0x010000450001A3CD	Dialogue Text	WHIRLING F2 / KIM WAKEUP	Kim Kitsuragi	"Not very." He rubs his chin. "I have a concussion from the major beating me with the butt of his gun. I try to not move too much."	“不算吧。”他揉揉下巴。“我被少校的枪托砸了一下，有点脑震荡。我尽量不多动。”
0x010000450001A3D3	Dialogue Text	WHIRLING F2 / KIM WAKEUP	Kim Kitsuragi	"Things would be worse if you didn't warn me." There's a pause. "Thank you. I did not see her coming. Stupid of me..."	“如果你没有警告我，情况说不定会更糟糕。”他停顿了一下。“谢谢你。我没想到她会来这一下子。我真是太蠢了……”
0x010000450001A3D9	Dialogue Text	WHIRLING F2 / KIM WAKEUP	Kim Kitsuragi	"Things would be much worse if you didn't warn me." There's a pause. "Thank you. I did not see him coming. Stupid of me..."	“如果你没有警告我，情况说不定会更糟糕。”他停顿了一下。“谢谢你。我没想到他会来这一下子。我真是太蠢了……”
0x010000450001A3E1	Dialogue Text	WHIRLING F2 / KIM WAKEUP	You	"If they're so worried about me where are they?"	“如果他们担心我的话，那他们人呢？”
0x010000450001A3E7	Dialogue Text	WHIRLING F2 / KIM WAKEUP	You	Better not agitate yourself further, it already hurts.	最好别再让自己激动了，这样真的很疼。
0x010000450001A3EF	Dialogue Text	WHIRLING F2 / KIM WAKEUP	Kim Kitsuragi	"I don't know."	“我不知道。”
0x010000450001A3F6	Dialogue Text	WHIRLING F2 / KIM WAKEUP	Rhetoric	Sorry.	抱歉。
0x010000450001A405	Dialogue Text	WHIRLING F2 / KIM WAKEUP	You	"Okay...." (Get up.)	“好吧……”（起身。）
0x010000450001A40B	Dialogue Text	WHIRLING F2 / KIM WAKEUP	Kim Kitsuragi	"Easy now..." The lieutenant turns double again, before your eyes. An orange hue of pain...	“轻一点……”你眼前再次出现了两个警督。一阵橙黄色的痛楚……
0x010000450001A43A	Dialogue Text	WHIRLING F2 / KIM WAKEUP	Savoir Faire	Your balance is *way* off. You feel like you're about to fall over on that thing...	你的平衡能力差了*很多*。你感觉自己要倒下去了……
0x010000450001A441	Dialogue Text	WHIRLING F2 / KIM WAKEUP	Pain Threshold	You can take it. Just don't lean on that leg of yours too heavily.	你可以承受住的。只要不把太多重量放在大腿上。
0x010000450001A449	Dialogue Text	WHIRLING F2 / KIM WAKEUP	Kim Kitsuragi	"How are you?"	“你还好吗？”
0x010000450001A450	Dialogue Text	WHIRLING F2 / KIM WAKEUP	You	"My... disco days are done."	“我的……迪斯科岁月已经结束了。”
0x010000450001A456	Dialogue Text	WHIRLING F2 / KIM WAKEUP	You	"I feel fantastic. Let's... rock."	“我感觉非常好。我们……燥起来吧！”
0x010000450001A45C	Dialogue Text	WHIRLING F2 / KIM WAKEUP	You	"Who cares. Who cares about me. It doesn't matter."	“谁在乎。谁关心过我。不重要了。”
0x010000450001A462	Dialogue Text	WHIRLING F2 / KIM WAKEUP	You	"I'm very bad, Kim. Things are very bad."	“我非常不好，金。情况真的很糟糕。”
0x010000450001A46E	Dialogue Text	WHIRLING F2 / KIM WAKEUP	You	"Gnhhhh..."	“唔……”
0x010000450001A479	Dialogue Text	WHIRLING F2 / KIM WAKEUP	Kim Kitsuragi	The lieutenant doesn't reply -- just looks at you teetering on your feet.	警督没有回应——只是看着你摇摇晃晃地站着。
0x010000450001A481	Dialogue Text	WHIRLING F2 / KIM WAKEUP	Physical Instrument	He thinks you should sit back down. Back straight, now... you're not sitting ANYWHERE.	他在想你应该坐下。坐直，就是现在……你没有坐在任何地方。
0x010000450001A488	Dialogue Text	WHIRLING F2 / KIM WAKEUP	Kim Kitsuragi	The lieutenant looks at you -- teetering on your feet.	警督看着你——摇摇晃晃地站着。
0x010000450001A48E	Dialogue Text	WHIRLING F2 / KIM WAKEUP	Kim Kitsuragi	He nods.	他点点头。
