ArticyId	TermType	ConvTitle	Actor	En	Zh
0x010000060001611B	Dialogue Text	WHIRLING F2 / BLACKOUT DREAM	You	Is this the last dream?	这是最后一个梦境吗？
0x0100000600016123	Dialogue Text	WHIRLING F2 / BLACKOUT DREAM	Ancient Reptilian Brain	No. This is the one before that. We'll just keep cycling it for you, if you don't mind. As long as we can. Spin it like black yarn.	不。这是在它之前的那一个。如果你不介意的话，我们会继续为你循环……只要我们可以的话。像黑色线圈一样，不断旋转。
0x010000060001612A	Dialogue Text	WHIRLING F2 / BLACKOUT DREAM	Limbic System	Enjoy it while it lasts.	趁它还在的时候，好好享受吧。
0x0100000600016132	Dialogue Text	WHIRLING F2 / BLACKOUT DREAM	Volition	Go.	走吧。
0x0100000600016138	Dialogue Text	WHIRLING F2 / BLACKOUT DREAM	You	But I've been bad. I haven't earned this.	但我一直表现地很糟糕。这不是我应得的。
0x010000060001613F	Dialogue Text	WHIRLING F2 / BLACKOUT DREAM	Ancient Reptilian Brain	No, you haven't. You've just *been*.	不，你没有。你刚刚*有过*。
0x010000060001616E	Dialogue Text	WHIRLING F2 / BLACKOUT DREAM	You	I've heard this song before.	我之前听过这首歌。
0x0100000600016175	Dialogue Text	WHIRLING F2 / BLACKOUT DREAM	You	Sing along -- in silent communion.	在无声的交流中——不断歌唱。
0x010000060001617B	Dialogue Text	WHIRLING F2 / BLACKOUT DREAM	Ancient Reptilian Brain	This is greatest hits material. Black tape spinning and spinning and spinning... You finally tired yourself. Cornered the flicker of your mind and extinguished it.	这是最棒的精选集。黑色的磁带不断旋转着，旋转着……你终于累了。将你心灵的闪光逼入绝境，然后掐灭它。
0x0100000600016181	Dialogue Text	WHIRLING F2 / BLACKOUT DREAM	Limbic System	For now -- a little while -- you can...	目前——这一会儿——你可以……
0x0100000600016189	Dialogue Text	WHIRLING F2 / BLACKOUT DREAM	You	How many days have I been in Martinaise already...	我已经在马丁内斯待了多少天……
0x0100000600016190	Dialogue Text	WHIRLING F2 / BLACKOUT DREAM	Ancient Reptilian Brain	There are no days here. There are no weeks. Just black tape spinning. On repeat. Until the end.	这里没有日子。这里没有星期。只有黑色的磁带在旋转。循环往复。直到尽头。
0x0100000600016198	Dialogue Text	WHIRLING F2 / BLACKOUT DREAM	Ancient Reptilian Brain	Blackness, blackness, blackness. The ultimate disco. The ruins of your life behind you, still smouldering. Ashes rise. But you're not looking.	黑暗，黑暗，黑暗。终极的迪斯科。生活的废墟就躺在你身后，还在缓慢地燃烧着。灰尘扬起。但你却没有回头去看。
0x01000006000161A2	Dialogue Text	WHIRLING F2 / BLACKOUT DREAM	You	(Sleep. Without words or images.)	（睡觉。没有语言或者图像。）
0x01000006000161AA	Dialogue Text	WHIRLING F2 / BLACKOUT DREAM	Limbic System	When the pictograms and the hieroglyphs of the world return, they seem silent somehow. The alarm rings quietly too. You're ready.	当世界里的象形符号和文字回归之时，它们似乎变得有些沉默。就连闹钟铃声也变得异常安静。你已经准备好了。
0x01000006000161B1	Dialogue Text	WHIRLING F2 / BLACKOUT DREAM	Half Light	Ready -- but something is coming. It always is.	准备好——但是有什么要来了。总是这样。
0x010000060001E639	Dialogue Text	WHIRLING F2 / BLACKOUT DREAM	You	Oh god...	天啦……
0x0100008100002FA8	Dialogue Text	WHIRLING F2 / BLACKOUT DREAM	Limbic System	It's easier, this time, drifting off. Your head has found a comfortable indent in the pillow. Your legs and your torso feel like lead weights sinking to the bottom of the sea, until they're suddenly light...	这次简单一些，你就这么迷迷糊糊的睡了过去。你的脑袋在枕头里找到了一个舒服的位置。腿和躯干就像铅坠一样沉入深深的海底，直到一缕光线突然出现……
0x0100008100002FBC	Dialogue Text	WHIRLING F2 / BLACKOUT DREAM	Ancient Reptilian Brain	This respite -- you've earned it, brother. Bask in the darkness. Let it swallow you up and swivel you around while you forget everything you've managed to remember...	休息——这是你应得的，兄弟。沐浴在黑暗里。它将你吞没，在你周围盘旋，而你……忘记了曾经记得的一切……
0x0100008100002FC4	Dialogue Text	WHIRLING F2 / BLACKOUT DREAM	You	Thank you, darkness. Thank you.	谢谢你，黑暗。谢谢。
0x0100008100002FCB	Dialogue Text	WHIRLING F2 / BLACKOUT DREAM	Ancient Reptilian Brain	You're welcome, Harry-boy. You earned it.	不用客气，小哈里。这是你应得的。
0x0100008100002FD8	Dialogue Text	WHIRLING F2 / BLACKOUT DREAM	You	(Fall into a deep, uninterrupted sleep.)	（深入深层的、不间断的睡眠。）
0x0100008100002FDF	Dialogue Text	WHIRLING F2 / BLACKOUT DREAM	Limbic System	After centuries of darkness, the alarm rings -- but what's this? You *actually* feel rested. There's no time to cuddle with your pillow, however, or as much as shiver from the cold. The world awaits.	仿佛经历了几个世纪的黑暗，闹钟响了——这是怎么回事？你*确实*感觉休息得很好。不过没时间跟你的枕头缠绵，或者是在寒冷中慑慑发抖了。世界在等着你。
0x0100008100002FE6	Dialogue Text	WHIRLING F2 / BLACKOUT DREAM	You	[Open your eyes.]	[睁开双眼。]
0x010000040000C457	Dialogue Text	WHIRLING F2 / BROKEN WINDOW VISCAL	Logic	This person also *forced* the drinks on you.	这个人也在*强迫*你喝酒。
0x010000040000C45D	Dialogue Text	WHIRLING F2 / BROKEN WINDOW VISCAL	Visual Calculus	Congratulations, you smashed the window with your own shoe. Now you only have one. If you're lucky you can still find the other on the balcony outside. The door to it should be outside your room.	恭喜，你用自己的鞋砸碎了窗户。现在你只剩下一只。如果走运的话，你还能在外面的阳台上找到另外一只。那扇门应该在你的房间外面。
0x010000040000C469	Dialogue Text	WHIRLING F2 / BROKEN WINDOW VISCAL	You	Wait, what am I doing?	等等，我在做什么？
0x010000040000C475	Dialogue Text	WHIRLING F2 / BROKEN WINDOW VISCAL	You	What did this then?	这是怎么回事？
0x010000040000C47D	Dialogue Text	WHIRLING F2 / BROKEN WINDOW VISCAL	You	Maybe it wasn't me?	也许不是我？
0x010000040000C48A	Dialogue Text	WHIRLING F2 / BROKEN WINDOW VISCAL	Visual Calculus	You mean someone else took your shoe off and smashed the window with it?	你的意思是别人拿了你的鞋，然后用它砸碎了窗户？
0x010000040000C497	Dialogue Text	WHIRLING F2 / BROKEN WINDOW VISCAL	Visual Calculus	The shards face outward. Whatever broke this window came from the inside.	碎片是朝外的。不管是谁砸碎了这扇窗户，一定是从里面下的手。
0x010000040000C49D	Dialogue Text	WHIRLING F2 / BROKEN WINDOW VISCAL	Visual Calculus	A fine web of scarring covers the back of your right hand, but none of it is recent.	你的右手背上覆盖着一层疤痕织成的细网，但是没有一个是最近留下的。
0x010000040000C4B1	Dialogue Text	WHIRLING F2 / BROKEN WINDOW VISCAL	Visual Calculus	More likely a projectile than a held object. There are no fragments on the floor from pulling a tool back in after impact.	比起手持东西砸窗户，看起来更像是把物体呈抛射状扔出去造成的。地板上没有冲击后把工具朝里拉而形成的碎片。
0x010000040000C4BD	Dialogue Text	WHIRLING F2 / BROKEN WINDOW VISCAL	Visual Calculus	It is too large for a bullet yet too small for a piece of furniture. You're looking for something heavy and larger than your fist.	对于子弹来说太大了，对于家具来说又太小。你在寻找某样比自己的拳头更大更重的东西。
0x010000040000C4C3	Dialogue Text	WHIRLING F2 / BROKEN WINDOW VISCAL	Visual Calculus	The single green shoe you found fits the hole almost as well as your foot. It would have also been heavy enough, if thrown with force.	你找到的那只绿鞋符合破洞的大小——还有你的脚。如果扔的特别用力，也能产生足够的重量。
0x010000040000C4C9	Dialogue Text	WHIRLING F2 / BROKEN WINDOW VISCAL	You	Assess the size of the impact.	评估冲击的尺寸。
0x010000040000C4CF	Dialogue Text	WHIRLING F2 / BROKEN WINDOW VISCAL	Visual Calculus	Like the green shoe that's on the hat rack in the corner, which -- coincidentally -- is missing its friend.	比如角落里衣帽架上的那只绿鞋，巧合的是——它正在想念自己的朋友。
0x010000040000C4DF	Dialogue Text	WHIRLING F2 / BROKEN WINDOW VISCAL	Visual Calculus	Something you've done before.	你之前做过的事。
0x010000040000C4E5	Dialogue Text	WHIRLING F2 / BROKEN WINDOW VISCAL	You	Did I break it with my own hands? (Look at them.)	我用手把它砸碎的吗？（看着自己的双手。）
0x010000040000C50E	Dialogue Text	WHIRLING F2 / BROKEN WINDOW VISCAL	Broken Window	The window stands broken in its frame. Cold wind blows in.	破碎的窗户仍然站立在窗框里。冷风从破洞中吹了进来。
0x010000040000C51E	Dialogue Text	WHIRLING F2 / BROKEN WINDOW VISCAL	You	Look out.	看向外面。
0x010000040000C52A	Dialogue Text	WHIRLING F2 / BROKEN WINDOW VISCAL	You	[Leave.]	[离开。]
0x010000040000C54F	Dialogue Text	WHIRLING F2 / BROKEN WINDOW VISCAL	You	Assess the damage.	评估受损情况。
0x010000040000C54F	tooltip1	WHIRLING F2 / BROKEN WINDOW VISCAL	You	Has been here a while.	已经在这里有一会儿了。
0x010000040000C54F	tooltip2	WHIRLING F2 / BROKEN WINDOW VISCAL	You	The lights are on!	灯打开了！
0x010000040000C55E	Dialogue Text	WHIRLING F2 / BROKEN WINDOW VISCAL	Visual Calculus	What do you mean *assess the damage*? How would you do that? What are you even trying to do?	你说*评估受损情况*是什么意思？你打算怎么做？话说回来，你到底打算做什么？
0x010000040000C57B	Dialogue Text	WHIRLING F2 / BROKEN WINDOW VISCAL	You	I don't need it. I don't need *anyone*.	我不需要它。我不要*任何人*。
0x010000040000C581	Dialogue Text	WHIRLING F2 / BROKEN WINDOW VISCAL	You	I should go and get that shoe.	我应该去把鞋拿回来。
0x010000040000C589	Dialogue Text	WHIRLING F2 / BROKEN WINDOW VISCAL	Broken Window	The window agrees. Its cracked smile is cold and sparkly.	窗户同意了。它破碎的微笑冰冷而耀眼。
0x010000040000C591	Dialogue Text	WHIRLING F2 / BROKEN WINDOW VISCAL	Broken Window	A cool wind gushes in. Your toes curl up from the cold.	一阵冷风涌了进来。你的脚趾因为寒冷而蜷缩起来。
0x010000580001B81C	Alternate1	WHIRLING F2 / BROKEN WINDOW VISCAL	Broken Window	You see some lights shimmering outside, but it's difficult to make out the outlines of the buildings below -- dark phantoms with many tiny eyes chaotically arranged and not looking at you.	你看见外面有灯光在闪烁，但是很难辨认出下面建筑的轮廓——长着无数只小眼的黑色幻影杂乱地排列着，并没有看着你的方向。
0x010000580001B81C	Dialogue Text	WHIRLING F2 / BROKEN WINDOW VISCAL	Broken Window	The morning light hurts your eyes. It's hazy, but you see the ocean and some war-torn buildings...	清晨的阳光刺伤了你的眼睛。朦胧中，你看见一片大海和饱受战火摧残的建筑……
0x010000580001B82D	Dialogue Text	WHIRLING F2 / BROKEN WINDOW VISCAL	Visual Calculus	The shoe you found out on the balcony fits the hole almost as well as your foot. It would have also been heavy enough, if thrown with force.	你在阳台上找到的那只绿鞋符合破洞的大小——还有你的脚。如果扔的特别用力，也能产生足够的重量。
0x010000580001B834	Dialogue Text	WHIRLING F2 / BROKEN WINDOW VISCAL	Visual Calculus	Congratulations, you smashed the window with your own shoe.	恭喜，你用自己的鞋子砸碎了窗户。
0x010000580001B83B	Dialogue Text	WHIRLING F2 / BROKEN WINDOW VISCAL	Logic	This person also *forced* the drinks on you.	这个人也在*强迫*你喝酒。
0x010000580001B841	Dialogue Text	WHIRLING F2 / BROKEN WINDOW VISCAL	Visual Calculus	You mean someone else took your shoe off and smashed the window with it?	你的意思是别人拿了你的鞋，然后用它砸碎了窗户？
0x010000580001B847	Dialogue Text	WHIRLING F2 / BROKEN WINDOW VISCAL	You	Maybe it wasn't me?	也许不是我？
0x010000580001B857	Dialogue Text	WHIRLING F2 / BROKEN WINDOW VISCAL	You	I'm sure I had a good reason for it. Maybe I was trying to hit someone?	我肯定自己这么做是有充足理由的。也许我是想打中某个人？
0x010000580001B85E	Dialogue Text	WHIRLING F2 / BROKEN WINDOW VISCAL	You	What a stupid thing to do.	真是件愚蠢的事情。
0x010000580001B864	Dialogue Text	WHIRLING F2 / BROKEN WINDOW VISCAL	Visual Calculus	And maybe, just maybe, you succeeded. We'll never know.	也许，只是也许，你成功了。我们永远也不会知道。
0x010000580001B86B	Dialogue Text	WHIRLING F2 / BROKEN WINDOW VISCAL	Inland Empire	Or maybe you were trying to smash your own reflection in the windowpane?	或者你是想用它砸碎窗户上自己的倒影？
0x010000580001B874	Dialogue Text	WHIRLING F2 / BROKEN WINDOW VISCAL	Visual Calculus	Pretty much. But, hey, at least you found your shoe.	差不多吧。不过，至少你找到自己的鞋了。
0x010000580001B87B	Dialogue Text	WHIRLING F2 / BROKEN WINDOW VISCAL	Pain Threshold	Not that it will keep you warm at night. Brrr.	并不是说这样就能让你拥有一个温暖的夜。呵。
0x010000580001B883	Alternate1	WHIRLING F2 / BROKEN WINDOW VISCAL	Visual Calculus	Congratulations, you smashed the window with your own shoe. That's why you only have one. If you're lucky, you might still find the other on the balcony outside. The door to it should be outside your room.	恭喜，你用自己的鞋砸碎了窗户。所以现在只剩下一只鞋。如果走运的话，你还能在外面的阳台上找到另外一只。那扇门应该在你的房间外面。
0x010000580001B883	Dialogue Text	WHIRLING F2 / BROKEN WINDOW VISCAL	Visual Calculus	Congratulations, you smashed the window with your own shoe. Now you only have one. If you're lucky, you can still find the other on the balcony outside. The door to it should be outside your room.	恭喜，你用自己的鞋砸碎了窗户。现在只剩下一只鞋了。如果走运的话，你还能在外面的阳台上找到另外一只。那扇门应该在你的房间外面。
0x0100008900000A8E	Dialogue Text	WHIRLING F2 / BROKEN WINDOW VISCAL	Visual Calculus	The shoe you found out on the balcony fits the hole almost as well as your foot. It's similar to the green shoe that's on the hat rack in the corner, which -- coincidentally -- is missing its friend.	你在阳台上找到的那只绿鞋符合破洞的大小——还有你的脚。它跟角落里衣帽架上挂着的那只很相似，巧合的是——挂着的那只正在想念它的伙伴。
0x0100008900000A94	Dialogue Text	WHIRLING F2 / BROKEN WINDOW VISCAL	Visual Calculus	Congratulations, you smashed the window with your own shoe.	恭喜，你用自己的鞋砸碎了窗户。
0x01000006000169A0	Dialogue Text	WHIRLING F2 / CUNO WAKEUP	You	"What style was that?"	“那是什么风格？”
0x01000006000169A6	Dialogue Text	WHIRLING F2 / CUNO WAKEUP	Cuno	"Final-style," he repeats. "You fucked everything up. Now Cuno's all you got. Terminal Cuno."	“终结风格，”他重复到。“你把一切都搞砸了。现在你只有坤诺了。终结者坤诺。”
0x01000006000169B4	Dialogue Text	WHIRLING F2 / CUNO WAKEUP	Esprit de Corps	Nix Gottlieb, station medic, throws a bag containing a small bullet into the medical waste disposer. Then he pops some caramel candy into his mouth and says: "Next." There's a line behind his door...	尼克斯·戈特利布，警局的医师，把一个装着小子弹的袋子扔进了医疗废物处置机。接着，他往嘴里塞了些焦糖糖果，说道：“下一个。”他的门后有一排队伍……
0x01000006000169BD	Dialogue Text	WHIRLING F2 / CUNO WAKEUP	Cuno	"What?" He studies your expression. "You don't believe the Cuno? You don't believe the Cuno knows this shit? Fuck you, Cuno keeps tabs. Bitch is outta town."	“什么？”他研究着你的表情。“你不相信坤诺？你不知道坤诺知道这些破事？去死吧，坤诺一直在监视。婊子已经出城了。”
0x010000060001EA67	Dialogue Text	WHIRLING F2 / CUNO WAKEUP	Volition	Thank god, okay, he's alive.	谢天谢地，好吧，他还活着。
0x010000060001EA6F	Dialogue Text	WHIRLING F2 / CUNO WAKEUP	Logic	There were only ten people present at the fight. Ten times more than that is very unlikely.	交火现场只有十个人。十倍以上是不太可能的。
0x010000060001EA77	Dialogue Text	WHIRLING F2 / CUNO WAKEUP	Logic	If he did triage and left, you must be relatively stable.	如果他确实做了验伤然后离开了，你肯定会相对稳定一些。
0x010000060001EA83	Dialogue Text	WHIRLING F2 / CUNO WAKEUP	Electrochemistry	We're detecting *drouamine* in your bloodstream. It's a potent morphine-based painkiller. The good doctor must have given you some... It's gonna suck when it wears off.	我们在你的血液里检测到*多巴宁*。这是一种以吗啡为基础的强效止痛药。好医生肯定给你用了一些……它消散之后肯定会很痛苦。
0x010000060001EA91	Dialogue Text	WHIRLING F2 / CUNO WAKEUP	Pain Threshold	Ouch, ouch... The kid turns double for a second. Damn, that hurts. Breathe...	哎哟，好痛……有那么一秒，男孩变成了两个人。该死，好痛。呼吸……
0x010000060001EA99	Dialogue Text	WHIRLING F2 / CUNO WAKEUP	Pain Threshold	Yeah, that kid's taken a beating -- or ten -- from his dad. He has regard for a man who can walk after taking some damage.	是啊，男孩被打过一次——或者是十次——他爸打的。他很尊重受了伤还能走的人。
0x010000060001EAA1	Dialogue Text	WHIRLING F2 / CUNO WAKEUP	You	"You mean Garte?"	“你是说加尔特？”
0x010000060001EAA8	Dialogue Text	WHIRLING F2 / CUNO WAKEUP	Cuno	"Yeah, fuckin' babybeard. Cleaned all your shit up. He's like your fuckin' mom now or something."	“是啊，那个该死的小胡子。把烂摊子全清理干净了。他妈的，现在他都快变成你的老母亲什么的了。”
0x010000060001EAB0	Dialogue Text	WHIRLING F2 / CUNO WAKEUP	Cuno	He looks you in the eye and repeats: "Two days is *nothing* to the Cuno."	他看着你的眼睛，重复到：“对于坤诺来说，两天根本*不算什么*。”
0x010000060001EAB8	Dialogue Text	WHIRLING F2 / CUNO WAKEUP	You	"Titus is dead...?"	“提图斯死了……？”
0x010000060001EABF	Dialogue Text	WHIRLING F2 / CUNO WAKEUP	Cuno	"Yeah, fuckin' dead. Died in the hospital, I hear. Union's all weepy and shit..." He gives you a nod of acknowledgement: "It's probably your fault."	“是啊，他妈的死了。我听说是死在了医院里。工会的人全都哭的眼泪汪汪什么的……”他点头表示确认：“这可能是你的错。”
0x010000060001EAC6	Dialogue Text	WHIRLING F2 / CUNO WAKEUP	Hand/Eye Coordination	It probably is... fucking butterfingers.	可能是的……你这个该死的笨手笨脚的家伙。
0x010000060001EACD	Dialogue Text	WHIRLING F2 / CUNO WAKEUP	Volition	It's the *fault* of those who *killed* him. Not you.	这是*杀了*他的人的*错*。不是你的。
0x010000060001EADB	Dialogue Text	WHIRLING F2 / CUNO WAKEUP	You	"She escaped?"	“她逃跑了？”
0x010000060001EAE3	Dialogue Text	WHIRLING F2 / CUNO WAKEUP	Volition	Who would have thought? Perhaps you should have *arrested* her?	谁能想到呢？也许你应该*逮捕*她？
0x010000060001EAEB	Dialogue Text	WHIRLING F2 / CUNO WAKEUP	You	"Do you know if Klaasje -- the blonde next door -- is really gone?"	“你知不知道卡拉洁——隔壁那个金发女郎——她真走了吗？”
0x010000060001EAF1	Dialogue Text	WHIRLING F2 / CUNO WAKEUP	Cuno	"Yeah, she's way gone pig. Cuno's been here for two days and babybeard and you are the only fucks in the building."	”是啊，她走得远远的了，猪头。坤诺在这里待了两天，这个地方只有你和小胡子两个人。”
0x010000060001EAFF	Dialogue Text	WHIRLING F2 / CUNO WAKEUP	Volition	Of course she's *really* gone, what did you think.	她当然*真的*走了，你想什么呢。
0x010000060001EB10	Dialogue Text	WHIRLING F2 / CUNO WAKEUP	Cuno	"Was nothin'." He tries to shake off the image. "Cuno's gonna go into a bag too. We all are."	“这没什么。”他试着摆脱那个画面。“坤诺也会被装进袋子里。我们都会的。”
0x010000060001EB18	Dialogue Text	WHIRLING F2 / CUNO WAKEUP	Half Light	That bag's on *you*. You could have done something, but you just stood there. Fuck...	那个袋子应该算在*你*头上。你本来可以做点什么的，但你却只是站在那里。该死……
0x010000060001EB21	Dialogue Text	WHIRLING F2 / CUNO WAKEUP	Reaction Speed	He's really been keeping tabs -- on you, the Hardies, even the company rep.	他真的在监视——监视你，哈迪兄弟，甚至是公司代表。
0x010000060001EB2A	Dialogue Text	WHIRLING F2 / CUNO WAKEUP	Esprit de Corps	Let's do this tango, pig, he thinks. Detective Pig and detective Cunn on the case. We bouncin'.	我们行动吧，猪头，他想到。猪头警探和坤诺警探准备调查案件。我们开始吧。
0x010000060001EB3A	Dialogue Text	WHIRLING F2 / CUNO WAKEUP	Composure	Cunn and Pig? And you're picking him up on your cop-frequency too. This is... bad.	坤诺和猪头？而且你还在警察频道提过他。这……不太妙啊。
0x010000060001EB42	Dialogue Text	WHIRLING F2 / CUNO WAKEUP	You	"Yeah, it probably is."	“是啊，有可能。”
0x010000060001EB48	Dialogue Text	WHIRLING F2 / CUNO WAKEUP	You	"The fuck Cuno?"	“坤诺，你他妈怎么回事？”
0x010000060001EB4E	Dialogue Text	WHIRLING F2 / CUNO WAKEUP	Cuno	"Walls are full of holes in here, pig. Even Cuno knows that."	“这里的墙上全是洞，猪头。就连坤诺都知道这个。”
0x010000060001EB56	Dialogue Text	WHIRLING F2 / CUNO WAKEUP	Cuno	"You want Cuno to be your yes-man, or you want me to tell it like it is? Walls are full of holes here, pig. Even Cuno knows that."	“你想让坤诺当个对你唯唯诺诺的人，还是你想让我实话实说？这里的墙上全是洞，猪头。就连坤诺都知道这个。”
0x010000060001EB5F	Dialogue Text	WHIRLING F2 / CUNO WAKEUP	Logic	There is no telling *when* it was made. He had a point there.	谁也不知道这是什么*时候*造成的。他说的有道理。
0x010000060001EB68	Dialogue Text	WHIRLING F2 / CUNO WAKEUP	Suggestion	He's genuinely impressed, but that's mostly to do with how scientific that percentage sounded.	他真的被打动了，不过主要取决于这个百分比听起来有多科学。
0x010000060001EB7C	Dialogue Text	WHIRLING F2 / CUNO WAKEUP	Shivers	A gust of wind blows in from the bay, the duraluminium box around you vibrates imperceptibly... a familiar cold, a red thread on the roof upstairs. Taut. Plucked like a string by the gust.	一阵风从海湾吹来，你周围的杜拉铝盒子微微震动着……一种熟悉的寒冷，屋顶上的一根红线。逐渐拉紧。就像一根被狂风拨动的弦。
0x010000060001EB87	Dialogue Text	WHIRLING F2 / CUNO WAKEUP	Pain Threshold	Also, it's just close enough to endure the walk.	而且距离挺近的，走几步应该能忍得了。
0x010000060001EB97	Dialogue Text	WHIRLING F2 / CUNO WAKEUP	Logic	You did mention doing more ballistics...	你确实听过多做些弹道测试……
0x010000060001EBA2	Dialogue Text	WHIRLING F2 / CUNO WAKEUP	Visual Calculus	Ballistics. In Klaasje's room. Do it *properly*.	弹道学。在卡拉洁的房间里。做得*恰当*一点。
0x010000060001EBB8	Dialogue Text	WHIRLING F2 / CUNO WAKEUP	Cuno	"You askin' Cuno to come along to your shit-show and you don't even know what to do? Fuckin' check your pig journal or something. C'mon..."	“=你让坤诺加入你的狂欢，结果你居然不知道该怎么做？他妈的，看看你的日志或者什么的啊。真是服了……”
0x01000007000083AF	Dialogue Text	WHIRLING F2 / CUNO WAKEUP	Cuno	"Nix Fucklieb, I think he was called," he says trying to remember the situation. "Said he was a doctor. Then fucked off and told me to phone him if you shit yourself."	“我想他好像叫尼克斯·什么列布，”他尝试回忆当时的情景。“说自己是个医生。然后他妈的就走了，还说如果你大便失禁的话就给他打电话。”
0x01000007000083C3	Dialogue Text	WHIRLING F2 / CUNO WAKEUP	Cuno	"Two days," he says indifferently. "Cuno's been out longer, sleepin' off the speed train. Two days is nothing."	“两天，”他冷漠地开了口。“坤诺没嗑思必得的时间都比这个长。两天算不上什么。”
0x01000007000083C9	Dialogue Text	WHIRLING F2 / CUNO WAKEUP	You	"How long was I out?"	“我昏迷多久了？”
0x01000007000083D8	Alternate1	WHIRLING F2 / CUNO WAKEUP	You	"You said half the town is dead?"	“你说城里一半的人都死了？”
0x01000007000083D8	Dialogue Text	WHIRLING F2 / CUNO WAKEUP	You	"You said thousands are dead?"	“你说几千人死了？”
0x01000007000083E3	Dialogue Text	WHIRLING F2 / CUNO WAKEUP	Cuno	"Yeah, it was a fucking massacre," Cuno says with a wide grin. "You and Cuno are the only ones left here."	“是啊，他妈的就是一场大屠杀，”坤诺大大地裂开嘴笑了。“你和坤诺是唯一剩下来的人。”
0x01000007000083EA	Dialogue Text	WHIRLING F2 / CUNO WAKEUP	Volition	Relax, the kid is just messing with you. You didn't actually get *thousands* of people killed.	放松，这小孩只是在戏弄你。你不是真的害死了*上千人*。
